,Unnamed: 0,neg_prob,pos_prob,neg_vader,neu_vader,pos_vader,sentence,dict,identifier
3337,3337,0.9977439459356184,0.002256054064379364,0.23600000000000002,0.764,0.0,My anxiety medication helped for a while but the anxiety is creeping back in.,nsubj,1
3338,3338,0.9998049948611659,0.0001950051388233941,0.31,0.69,0.0,Anxiety medication isn't helping as much as it used to.,nsubj,1
3347,3347,0.9998604991137371,0.00013950088626456096,0.14,0.86,0.0,"I know meds aren't the answer to everything, but I'm just really anxious all the time and it's semi crippling.",nsubj,1
3348,3348,0.9993143993315432,0.0006856006684680898,0.11699999999999999,0.773,0.11,"I didn't like the way medication made me feel, and I've been generally alright off of it.",nsubj,1
3356,3356,0.9999622714203801,3.7728579610456895e-05,0.0,0.797,0.203,Here's hoping this medication works out so I can take the next step.,nsubj,1
3363,3363,0.9999845950487246,1.540495128988785e-05,0.0,1.0,0.0,My current medications have really helped me.,nsubj,1
3376,3376,0.9995928940640729,0.00040710593592337797,0.0,1.0,0.0,"I made [this post](https://www.reddit.com/r/Anxiety/comments/2yl0vn/going_to_be_out_of_meds_soon_sense_of_impending/) yesterday, about me possibly having to be off medication for a while.",nsubj_pobj,1
3383,3383,0.9999577891878476,4.2210812147801e-05,0.375,0.625,0.0,The medication has also given me bowel problems and sleep problems.,nsubj,1
3388,3388,0.9999775205309952,2.247946899361813e-05,0.0,1.0,0.0,I am 27F if medications affect age and gender differently.,nsubj,1
3395,3395,0.9999240185898229,7.598141016301155e-05,0.19699999999999998,0.8029999999999999,0.0,The anti-psychotic medication has helped in some ways to conquer my problem.,nsubj,1
3396,3396,0.9999608846229284,3.9115377069900674e-05,0.256,0.7440000000000001,0.0,So basically all the medication has done is taken away the stress because I don't have wet dreams anymore and have absolutely no need for sex.,nsubjpass,1
3419,3419,0.9999002346980398,9.976530197102828e-05,0.0,0.847,0.153,"I'm afraid because while I feel meds would probably help me, I'm afraid to go on them.",nsubj,1
3424,3424,0.999993232346576,6.767653409834144e-06,0.0,0.87,0.13,Given that these didn't happen before I'm pretty sure this is the meds leaving my system but just wondered if you guys had been through anything similar?,nsubj,1
3438,3438,0.9950556271119856,0.004944372888025268,0.0,0.664,0.336,If meds would help at all it could change my life in a very positive way.,nsubj,1
3449,3449,0.999973254576447,2.674542354153453e-05,0.08900000000000001,0.721,0.191,No medications- I've had nothing but miserable experiences with almost every anti-anxiety med I've tried.,nsubj,1
3451,3451,0.999936310551975,6.368944802275447e-05,0.23199999999999998,0.6779999999999999,0.09,"Tl;Dr My girlfriend is an emotional zombie, and I think her anxiety meds are to blame.",nsubj,1
3456,3456,0.992560341444048,0.007439658555938991,0.16699999999999998,0.833,0.0,"Even though the medication helped me get through my panic attacks a little, it was not enough for me to keep up with the material to graduate on time despite being only 3 classes short.",nsubj,1
3467,3467,0.9999809681485171,1.9031851498022334e-05,0.153,0.847,0.0,I don't take any medication for it because my parents constantly give me shit about how much my current medicine (epilepsy) costs.,dobj_nsubj,1
3470,3470,0.9823916015908876,0.0176083984091136,0.336,0.664,0.0,I do believe that medication has helped me over the last 15 years but it doesn't prevent those every once in a while bad days or bad few hours of anxiety.,nsubj,1
3486,3486,0.9999875142987622,1.2485701250563455e-05,0.145,0.855,0.0,So psyche meds are really just an absolute no for me at this point.,nsubj,1
3488,3488,0.9997910539776864,0.00020894602231694617,0.11599999999999999,0.884,0.0,"Which meds, at low doses,  have worked for you guys with the least amount of side affects?",nsubj,1
3504,3504,0.9993524105984892,0.0006475894014902263,0.0,0.879,0.121,"If the medication is causing insomnia, is it safe to assume that I could take it in the morning rather than at night?",nsubj,1
3505,3505,0.9911455163455284,0.008854483654454508,0.139,0.787,0.073,"And as a related question, I know I'm not far enough in for the medication to really make an impact yet, but does anyone have any similar experience where it seems like anxiety in the morning is worse than usual?",nsubj,1
3526,3526,0.9892678114641396,0.010732188535872423,0.09300000000000001,0.705,0.20199999999999999,Every once in a while I doubt that medication will work on me and hope everyday it won't make me worse in any way.,nsubj,1
3533,3533,0.9992559882174432,0.0007440117825508639,0.0,0.455,0.545,The meds help to a certain extent.,nsubj,1
3543,3543,0.999879062229699,0.00012093777030280659,0.252,0.665,0.083,"I have been having bad anxiety lately and I really don't like the way medicine makes me feel, I'd much rather use kava or a natural alternative.",nsubj,1
3572,3572,0.999485931458962,0.0005140685410281034,0.0,0.828,0.172,"eventually I told my SO (because I was concerned I might say mean things to him, or even hit him) and he reassured me that I hadn't said anything upsetting yet and he was ok with being patient until the meds settled down.",nsubj,1
3584,3584,0.9997211473679576,0.00027885263204838336,0.08199999999999999,0.9179999999999999,0.0,"He said to me today ""I don't think medication is ever the answer with anxiety, the answer is in yourself"".",nsubj,1
3586,3586,0.9999410081630692,5.899183692618332e-05,0.0,0.633,0.36700000000000005,I hope the medicine doesn't change me.,nsubj,1
3603,3603,0.9999905007306092,9.499269384778404e-06,0.0,0.8,0.2,The medicine started with an S. Soloman or something like that?...,nsubj,1
3613,3613,0.9999520179333836,4.7982066621345785e-05,0.0,1.0,0.0,I think medicine should be a last resort.,nsubj,1
3616,3616,0.9997773368310724,0.00022266316893535562,0.0,0.856,0.14400000000000002,"How much does your medication help, and does it hinder your social life (mixing alcohol and meds)?",nsubj_conj,1
3626,3626,0.9999081538345506,9.18461654305839e-05,0.172,0.828,0.0,Also I'm getting really worried about the hair-loss side effects these meds have.,nsubj,1
3628,3628,0.9999831122290348,1.6887770958258042e-05,0.179,0.821,0.0,Three weeks ago I decided my anxiety is too much to handle on my own so I went to psychiatrist who diagnosed me with recurrent depression/ anxiety disorder and immediately prescripted me meds.,nsubj,1
3630,3630,0.9998555263060672,0.00014447369395218648,0.13,0.87,0.0,"Or is it just a problem in my head, maybe caused by how meds were demonized by people around me?",nsubjpass,1
3636,3636,0.9995280463632052,0.0004719536368125707,0.0,0.96,0.04,"My psychologist (only made it to one appointment this year) can't prescribe and the last time I saw her, she did tell me medicine might be beneficial, but was in a hurry because our session was running late and didn't refer me for the med doctor at the counseling center.",nsubj,1
3639,3639,0.9988090689262792,0.0011909310737201848,0.0,0.805,0.195,"New meds, went to bed at 11ish, sleeping in a place I know is safe.",nsubj,1
3641,3641,0.9990274523020012,0.0009725476979927091,0.086,0.914,0.0,"Also, there's no other real treatment for my hearing issues, but anti-anxiety meds are a common things for us.",nsubj,1
3671,3671,0.999703493331963,0.00029650666805348486,0.07400000000000001,0.816,0.11,He told me that therapy wouldn't work well for me and it would only help after I got on meds/for the long run.,nsubj,1
3675,3675,0.998291380822528,0.0017086191774742599,0.0,0.7390000000000001,0.261,"I'm now 19, the medicine works well for me and I've changed my doses a few times but it's been steady for the past few years and I've been perfectly fine.",nsubj,1
3684,3684,0.999792149321049,0.00020785067893178076,0.0,1.0,0.0,"The only medication I would consider would be for ADHD, because everything else tends to cloud my brain, and I have enough of that as it is.",nsubj,1
3690,3690,0.999001179605744,0.0009988203942434438,0.174,0.596,0.23,"I have avoided medication up until now, but now I am at the point where my fears about medication no longer outweigh my desire to try it in the hopes that it will help me function.",nsubj,1
3700,3700,0.9997387087409444,0.00026129125906764844,0.46,0.54,0.0,"These meds have worked WONDERS for my daily symptoms, but I still frequently have panic attacks that I simply can't come down with, or I have bad days where I have several severe panic attacks throughout the entire day.",nsubj,1
3707,3707,0.9995614263400202,0.00043857365997156594,0.081,0.853,0.067,I told my manager I was having anxiety and I was really dizzy and almost fainted and he let me sit in the office til my meds kicked in and my other manager volunteered to take care of my food running that I was supposed to be doing.,nsubj,1
3722,3722,0.9999323261663648,6.76738336359114e-05,0.53,0.47,0.0,"Therapy didn't, help medication didn't help.",nsubj,1
3726,3726,0.9999710406721644,2.895932784266855e-05,0.0,1.0,0.0,What SSRI/medicine helped you the most?,nsubj,1
3738,3738,0.9999769682854898,2.303171451963584e-05,0.149,0.628,0.223,"I know my meds needed to be changed anyways, but it could have been handled way better without me having to suffer like this.",nsubj,1
3739,3739,0.9995378794818768,0.0004621205181142968,0.07,0.93,0.0,"The only medication I have here is lorazepam and I can't think well enough after taking it to do any work, something I realized at a really inopportune time.",nsubj,1
3740,3740,0.9999925460860699,7.453913924897992e-06,0.0,0.9059999999999999,0.094,I know medication and therapy should be long term solutions but what about short term?,nsubj,1
3744,3744,0.9997469013666892,0.0002530986333012822,0.10300000000000001,0.778,0.11900000000000001,"My medication doesn't seem to help, and I'm almost afraid to get put on something stronger, or change meds.",nsubj_dobj,1
3751,3751,0.9998807328517004,0.00011926714830728472,0.23399999999999999,0.636,0.13,"Growing up when I would have a panic attack I was always told things like ""if you don't calm down we'll have to get medicine for you"", so medication for me is always difficult because I've come to view it as a bad thing, or along the lines of admitting ""I'm weak, because I need medicine to help me"" for a better explanation I guess??",dobj_nsubj,1
3752,3752,0.9999301180235016,6.988197647830714e-05,0.14,0.821,0.039,"Either way, my medicine (Buspirone) so far helps, but I always have anxiety over taking the thing that is supposed to REDUCE my anxiety so I end up either taking forever to swallow it, or dont take it at all, which doesn't help me in any way.",nsubj,1
3753,3753,0.999968866594933,3.113340505217122e-05,0.0,0.7809999999999999,0.21899999999999997,"Does anyone have any tips on what I can do to help out with this, or would getting a daily medication be a better option?",nsubj,1
3778,3778,0.9999369606581096,6.303934189355943e-05,0.0,1.0,0.0,"My medication helped at first but now, not so much.",nsubj,1
3786,3786,0.9982683067403852,0.0017316932596007787,0.10099999999999999,0.899,0.0,"I've been to my GP several times, where they put me on different kinds of medication and I had at least four blood tests in the past year, but nothing came back and the medication only made things worse.",nsubj,1
3792,3792,0.9998515249938408,0.00014847500617075232,0.13,0.87,0.0,"However the pollen count is low, and asthma medication does not alleviate the symptoms whatsoever.",nsubj,1
3794,3794,0.9999834718792358,1.652812076408033e-05,0.196,0.7120000000000001,0.092,"I live alone and I'm afraid that this medicine could end up doing more harm than anything else, and I won't be able to get help.",nsubj,1
3798,3798,0.9999840313786048,1.5968621379453334e-05,0.0,1.0,0.0,what does medication actually do?,nsubj,1
3812,3812,0.9995162171559612,0.0004837828440439517,0.25,0.75,0.0,"I don't want this medication to make everything worse, and I'm really afraid of that happening.",nsubj,1
3814,3814,0.9999824600931788,1.753990683331957e-05,0.0,0.5720000000000001,0.428,Would medication even really help?,nsubj,1
3823,3823,0.9999189007661872,8.109923383286921e-05,0.24100000000000002,0.595,0.16399999999999998,im having all thee irrational thoughts like I'll have an allergic reaction to it or I'll fall asleep and die because the medicine is too strong.,nsubj,1
3831,3831,0.9999696449218622,3.0355078143035577e-05,0.0,0.748,0.252,I did *not* think that medication would help so much.,nsubj,1
3842,3842,0.9999699111556016,3.0088844404172358e-05,0.0,1.0,0.0,"However, if medicine is an only option I'd rather over the counter.",nsubj,1
3868,3868,0.9999383246970944,6.167530290870499e-05,0.213,0.787,0.0,Specific meds may be different here but I'm not sure.,nsubj,1
3871,3871,0.9997870312667152,0.00021296873328844435,0.261,0.7390000000000001,0.0,I'm scared that anxiety medications would end the hobby that has greatly enriched my life.,nsubj,1
3873,3873,0.9999444379894091,5.5562010578266074e-05,0.273,0.727,0.0,The meds don't seem to help this.,nsubj,1
3877,3877,0.999932733035053,6.726696494776281e-05,0.32799999999999996,0.672,0.0,That is so frustrating the fact that the medication makes me feel worse than i was before.,nsubj,1
3883,3883,0.9952868761519544,0.004713123848031484,0.086,0.914,0.0,"Each time I recieve a new medication, I have fairly severe side-effects almost immediately and after a phone call, he will tell me to stop taking said medication but will not try anything else until I come back into his office 2 months later.",nsubj,1
3887,3887,0.9999929526749708,7.047325043035243e-06,0.141,0.705,0.154,Has anybody regretted starting medication because they realized their medication wasnt that bad after all?,nsubj,1
3888,3888,0.9999043092640166,9.569073599642556e-05,0.0,0.769,0.231,"I thought the medicine would help me focus, and it did.",nsubj,1
3904,3904,0.9999680475927016,3.195240728341902e-05,0.096,0.904,0.0,I know you aren't supposed to use Xanax regularly and I know different medication is required for general anxiety.,nsubjpass,1
3922,3922,0.9999934819955546,6.518004427950901e-06,0.203,0.6509999999999999,0.146,"**

To be honest, and I know this is going to sound really stupid, I just want someone to talk to, and maybe some medication that'll make the dread go away and calm me down when I'm in panic mode.",nsubj,1
3926,3926,0.9999958867942482,4.1132057653699055e-06,0.0,1.0,0.0,They have this stigma that any medication is 'bad' and you should not be on it.,nsubj,1
3936,3936,0.99975005321364,0.0002499467863749433,0.107,0.821,0.07200000000000001,"Could i go on without meds (uh, no, not if i can help it), could i start making enough money online to leave my boyfriend (sure, after meds kicked in again, but then his ways won't upset me), am i hurting my kids by being distant (yes, but not as much as if i were not protecting them).",nsubj,1
3940,3940,0.9998184497325456,0.0001815502674457125,0.0,0.494,0.506,And the meds are great.,nsubj,1
3962,3962,0.9997301303441609,0.000269869655841698,0.0,0.7809999999999999,0.21899999999999997,I'm scheduled for a doctor's appointment next week where I hope I can get some anti-anxiety meds prescribed to help me get this under control.,nsubj,1
3964,3964,0.9997972058315959,0.0002027941683872505,0.0,0.856,0.14400000000000002,How can I illustrate that these medications could help me without coming off as a benzo fiend or whatever?,nsubj,1
3965,3965,0.9999586880850808,4.131191493096133e-05,0.0,1.0,0.0,What if the meds dont work?,nsubj,1
3986,3986,0.9996426333164072,0.0003573666835863313,0.09,0.794,0.11599999999999999,"Once the meds are changed and my moods are stable, she's going to re-evaluate the anxiety component.",nsubjpass,1
3990,3990,0.9997302925536616,0.00026970744634604747,0.0,1.0,0.0,But the meds might not of been the only thing that helped me.,nsubj,1
4002,4002,0.995677663264108,0.00432233673590299,0.086,0.867,0.047,"I thought I might be able to adjust to these, but the medication has also increased my anxiety to an unbearable level-- so much so that it has made my birth control pill stop working (I have bleeding and cramps where I should never have bleeding; it is a 365 day pill and I take it perfectly).",nsubj,1
4028,4028,0.9999838708488572,1.6129151128029546e-05,0.0,0.853,0.147,My question is: If you have taken meds are they worth it?,nsubj,1
4033,4033,0.9999316031414608,6.839685854881124e-05,0.223,0.6609999999999999,0.11699999999999999,"I'm heavily ANTI benzos, and really want this medication to work.",nsubj,1
4036,4036,0.9825096005077008,0.017490399492297713,0.08800000000000001,0.812,0.1,"Personally, I think medication is a wonderful tool in the process of self-healing, but you know... logic is not always equal to anxiety.",nsubj,1
4048,4048,0.9984193805574124,0.0015806194426005186,0.025,0.9059999999999999,0.069,"So all my tests said I was ok, and it's still anxiety...well I thought I could do it with no medication but I have come to terms with the fact that some people just have it so extreme that medication is just something I may have to take for the rest of my life, and at this point, if it works, I am ok with taking it.",nsubj,1
4049,4049,0.9999952151204112,4.784879582301249e-06,0.18600000000000003,0.654,0.16,I can't stand having this problem and I am wondering if therapy/ medicine can help.,nsubj,1
4064,4064,0.9999697713804752,3.0228619514155934e-05,0.231,0.722,0.047,"I guess it would be nice to know if anyone else here gets actual pain from their anxiety, I'm so confused, medication doesn't help because I don't think there's anything wrong with me but it feels real!",nsubj,1
4075,4075,0.999068061443708,0.0009319385562750946,0.133,0.867,0.0,"So unfortunately, the doctors thought the meds were working when they weren't, and they called me to justify myself in front of a jury of five doctors why I wanted to ""stop complying with the treatment.""",nsubj,1
4079,4079,0.9999364887948364,6.351120517736457e-05,0.10800000000000001,0.892,0.0,I made the appointment because I recently relocated and needed to get my performance anxiety medicine filled.,nsubj,1
4081,4081,0.9995187335445156,0.0004812664554754755,0.156,0.8440000000000001,0.0,"medication is out of the question, and i really struggle with the techniques ppl tell me.",nsubj,1
4091,4091,0.9999387567247984,6.12432751846417e-05,0.0,1.0,0.0,Are meds the answer or can I beat this without it?,nsubj,1
4096,4096,0.9628336589444509,0.0371663410555624,0.042,0.895,0.063,I've talked to my therapist about it and he is very so so about giving it to a 17 year old as he isn't sure of what would happen based on the fact that the medication is tested on adults and not teenagers or children.,nsubjpass,1
4099,4099,0.997914224056758,0.0020857759432230485,0.08,0.853,0.067,"You were forced to sit on a couch all day, and could not move aside from walking to get your medication which was like, 5 steps away, walking to the dining hall, or walking to bed/bathroom.",nsubj,1
4109,4109,0.9987698814823998,0.0012301185175986932,0.151,0.8490000000000001,0.0,"Unfortunately for me, one of the big sources of anxiety for me is my health, and I know that prescription medications are detrimental to your health.",nsubj,1
4118,4118,0.9997247275687522,0.0002752724312303877,0.175,0.825,0.0,"The most recent meds in that regard did not work and I had to stop taking them because they were making me worse, which I didn't think was possible.",nsubj,1
4129,4129,0.9998998506639438,0.00010014933606682108,0.16699999999999998,0.833,0.0,"No medication has worked and we have never found the ""right"" therapist.",nsubj,1
4154,4154,0.9995729573648388,0.00042704263517450813,0.16699999999999998,0.6729999999999999,0.16,"I don't want to blame anyone, but in a way, I feel wronged, like someone should have led me toward therapy first and meds should have waited.",nsubj,1
4157,4157,0.9996175886687898,0.00038241133122003895,0.0,1.0,0.0,The medication has helped a little.,nsubj,1
4160,4160,0.9996133498413238,0.000386650158658381,0.0,0.927,0.073,I visited the ER and they informed me that it's highly unlikely the medication had anything to do with that feeling.,nsubj,1
4162,4162,0.9963772557150667,0.003622744284929711,0.0,1.0,0.0,"I can tell the medication has helped, especially as of recently.",nsubj,1
4164,4164,0.9999517566226194,4.824337737190901e-05,0.149,0.851,0.0,He said that meloxicam (the medication I thought was causing the trouble) can aggravate asthma (I have excercise and heat/cold induced asthma).,nsubj,1
4172,4172,0.9999412231059552,5.877689406290493e-05,0.355,0.645,0.0,"No medications, never diagnosed, etc.",nsubjpass,1
4174,4174,0.9999743030145066,2.5696985493208092e-05,0.405,0.595,0.0,My meds make my stomach hurt.,nsubj,1
4178,4178,0.9999392100598092,6.0789940205452756e-05,0.0,1.0,0.0,"I don't think meds are an option since I'm still nursing and we're trying for another baby (I would take Xanax before I was pregnant, but haven't had them since).",nsubj,1
4193,4193,0.9999679736824496,3.202631756406317e-05,0.0,1.0,0.0,Since then the medicine hasn't done much for me..,nsubj,1
4196,4196,0.999947674531772,5.232546824872354e-05,0.0,0.879,0.121,"How can I tell whether its the medication helping me, or if I have actually developed the coping skills?",nsubj,1
4198,4198,0.9992152798912959,0.0007847201086983619,0.0,1.0,0.0,I can't take medication because I'm afraid meds will affect my body in a harmful way.,dobj_nsubj,1
4204,4204,0.999928993651626,7.100634836277655e-05,0.0,1.0,0.0,Which medication has the fewest side-effects?,nsubj,1
4206,4206,0.9687455298608526,0.0312544701391551,0.156,0.7809999999999999,0.063,"I haven't dealt with it in a long time, as meds have definitely gotten rid of it, but here it is creeping back again - quite badly today.",nsubj,1
4211,4211,0.9995582813702286,0.0004417186297833114,0.11800000000000001,0.6940000000000001,0.188,I got given a script for medication to try help with my anxiety today.,nsubj,1
4215,4215,0.9794026501552742,0.020597349844709296,0.08199999999999999,0.7929999999999999,0.125,"My medication seemed to really help with anxiety, in just taking the edge off of everything and making life more manageable.",nsubj,1
4217,4217,0.9995501993916012,0.00044980060837995246,0.0,0.909,0.091,About 6 years ago I had an episode where my ability to breath was greatly reduced and the standard allergy meds weren't doing it for me.,nsubj,1
4224,4224,0.9995789549114592,0.0004210450885537218,0.0,0.9,0.1,"I started going to see my university counselor, and after a few sessions she set me up with an appointment to see a psychiatrist and said medication may be beneficial.",nsubj,1
4235,4235,0.9986625204499914,0.0013374795500232695,0.0,1.0,0.0,"the meds have helped a little, but not all that much.",nsubj,1
4236,4236,0.9996896219567084,0.00031037804328018666,0.0,0.8490000000000001,0.151,"I'm not as freaked out, i guess, and going to school is a little easier, but i know meds take time and stuff.",nsubj,1
4239,4239,0.9999471628388464,5.283716113780592e-05,0.0,1.0,0.0,"Anyway, currently, my daily medications are 300mg Effexor XR (yes 300mg), Wellbutrin 300mg, 2-6mg Xanax as needed, and 30-60mg Adderall as needed.",nsubj,1
4241,4241,0.9997435780286276,0.0002564219713533273,0.25,0.636,0.114,"My doctor told me that while there's no treatment for DPD alone, anxiety medications could help with the symptoms.",nsubj,1
4243,4243,0.996256851167343,0.0037431488326527037,0.063,0.893,0.045,"She prescribed me with a medication that I was only to take on an as-needed basis... On the ""bad days"" 

So, we're just about caught up to now, the medication has helped the episodes some, and I feel as though the meds in combination with self-help techniques are really helping me work through some issues.",nsubj_nsubj,1
4257,4257,0.999989942867034,1.0057132946877713e-05,0.0,0.69,0.31,I'm wondering if medication would help any?,nsubj,1
4264,4264,0.9999707139867664,2.9286013250854553e-05,0.258,0.53,0.212,This explains why no medication ever made the anxiety completely better.,nsubj,1
4268,4268,0.9850704400991044,0.014929559900893888,0.155,0.81,0.035,"I hadn't noticed any significant changes in my anxiety, and though it hasn't been a long enough period to make a definite decision about if the meds work for me, it has been long enough that there should've been some progress... in fact, I was experiencing heightened anxiety before falling asleep that made it more difficult to fall/stay asleep.",nsubj,1
4276,4276,0.9999678085390664,3.2191460931352945e-05,0.174,0.826,0.0,"I've tried taking anti-depressants and anti-anxiety medication, but the anti-depressants never seemed to work, and the anti-anxiety meds (xanax and klonopin) led me to abuse the medicine, so I stopped taking prescription medicine altogether--the only time I take medicine now is if it's an antibiotic or something.",conj_nsubj_dobj,1
4284,4284,0.9999059403192521,9.40596807496698e-05,0.0,1.0,0.0,"bottom line, these meds take time to work.",nsubj,1
4290,4290,0.9999533817076988,4.661829230155249e-05,0.132,0.685,0.183,I have been feeling really uncomfortable around people and my medication for SPD seems like it isn't working anymore.,nsubj,1
4305,4305,0.9996544644841142,0.00034553551588180587,0.0,1.0,0.0,"The meds seem to be working, but there are some side effects that are fairly minor, but I am concerned none the less.",nsubj,1
4323,4323,0.9999455180161766,5.448198383232924e-05,0.0,1.0,0.0,**edit**  We have an appointment for 10am tomorrow morning to get his medication changed.,nsubj,1
4338,4338,0.9999117894845864,8.821051540137529e-05,0.21100000000000002,0.687,0.10099999999999999,"), triggered at night thinking of tomorrow, thinking of lost friends, no meds, US

What I've done so far:
Googled anxiety, came out with webmd.com.",nsubjpass,1
4340,4340,0.9999551031363858,4.489686360635518e-05,0.102,0.512,0.386,I feel like I would stop trying to get better once the meds make me feel better.,nsubj,1
