,Unnamed: 0,neg_prob,pos_prob,neg_vader,neu_vader,pos_vader,sentence,dict,identifier
968,968,0.9999083019632864,9.169803670802048e-05,0.0,1.0,0.0,"I'm also wondering about your guys' medication stories--BuSpar, ADs.",['compound'],0
977,977,0.999393075097886,0.0006069249021085343,0.0,1.0,0.0,"I have taken Kavinace and it done wonders last year for me, for a herbal medicine alternative.",['compound'],0
981,981,0.9990032190158812,0.0009967809841085332,0.152,0.758,0.09,"I started 20 mg Viibryd 1 month ago today, after over 10 years of unsuccessful treatment, over 7 different medications, and almost no hope remaining in my soul.",['advcl'],0
1009,1009,0.9996477024461512,0.0003522975538385392,0.0,1.0,0.0,"I scheduled myself to see the same therapist and plan to follow through on everything she says, yet i don't know if i should go back medication.",['conj'],0
1022,1022,0.9998370578283275,0.00016294217168812608,0.15,0.67,0.18,I feel more relaxed being off medication than on it as I worry about medication side effects.,['compound'],0
1024,1024,0.9999960271230192,3.972876996049364e-06,0.09699999999999999,0.778,0.125,TL:DR ENT says Eustachian Tubes (previous doctor said I probably have ETD) are pretty finicky and don't respond to medicine/there's really no treatment.,['poss'],0
1032,1032,0.9999287281210436,7.127187893994794e-05,0.0,0.755,0.245,"tl;dr: Tried meds and therapy, but I'm ready to try again.",['appos'],0
1037,1037,0.9866493826084649,0.013350617391540129,0.157,0.7829999999999999,0.061,"About a month ago, I was put on 75 mg of Effexor for generalized and social anxiety, as well as minor depression, and it's proven to not be the medicine for me.",['attr'],0
1039,1039,0.9998136453054922,0.00018635469450646887,0.0,1.0,0.0,I've had bouts of therapy and medications throughout my teens and early 20's.,['conj'],0
1042,1042,0.9994197637322748,0.0005802362677050888,0.0,0.7659999999999999,0.23399999999999999,I started it 14 days ago and I felt like it is the right medication to help me quit lorazepam completely.,['attr'],0
1057,1057,0.999440031409374,0.000559968590620241,0.0,1.0,0.0,There's not a direct medication that can be prescribed for everyone.,['attr'],0
1058,1058,0.9999721590623688,2.7840937636579413e-05,0.0,1.0,0.0,What meds plug that mental hole for you?,['aux'],0
1059,1059,0.9999520952811588,4.790471885745899e-05,0.0,1.0,0.0,"Celexa and Seroquel, are my current meds...",['attr'],0
1065,1065,0.9999743254561452,2.567454385499165e-05,0.0,1.0,0.0,I've had benzos in my medicine drawer for 5 years.,['compound'],0
1073,1073,0.9989115711117696,0.0010884288882153426,0.0,0.9279999999999999,0.07200000000000001,"I am not a 12 year old, I am a 30 year old who was just diagnosed with GAD and have been working through it with a variety of methods, therapy, medicine, breathing exercises and stuff like that.",['conj'],0
1076,1076,0.999973173524636,2.6826475350132527e-05,0.0,1.0,0.0,"I've tried ginger root, drinking flat 7up, antinausea meds, and antacids.",['conj'],0
1083,1083,0.9998787114397616,0.00012128856022193699,0.0,0.838,0.162,"They've tried everything to help me, therapists, ADHD medication (even though I feel  I don't have it).",['appos'],0
1085,1085,0.999971823713941,2.8176286056372673e-05,0.0,0.706,0.294,Any specific medications that are all natural?,['ROOT'],0
1088,1088,0.9997196321786509,0.0002803678213549663,0.078,0.922,0.0,I had a breakdown at work so I am in therapy along with on a medicine regime to try and control my OCD and anxiety.,['compound'],0
1093,1093,0.9999672311255576,3.276887442965131e-05,0.0,1.0,0.0,I do not take birth control or any medications.,['conj'],0
1108,1108,0.9994304059041011,0.0005695940959038972,0.0,1.0,0.0,"Asides the medication side effects, they are afraid that might it affect their employment record.",['compound'],0
1114,1114,0.9976438139293218,0.0023561860706595586,0.0,1.0,0.0,"I've tried many meds to control it over the years, along with counseling, but I continue to spiral downward.",['npadvmod'],0
1119,1119,0.9999887826615712,1.1217338412552992e-05,0.0,0.698,0.302,"Any medicine, teas, powders?",['ROOT'],0
1137,1137,0.9999790986070564,2.090139293796092e-05,0.0,0.6759999999999999,0.324,"So please, if you'd be willing, share your experience coming off meds?",['advmod'],0
1143,1143,0.9999836479842956,1.6352015698978987e-05,0.124,0.7909999999999999,0.085,I have no idea if the way I'm feeling is because the meds or if it's unrelated.,['nsubjpass'],0
1149,1149,0.9999605468171648,3.94531828434459e-05,0.0,1.0,0.0,"I mean, I know how meds are supposed to work, but then sometimes it is discovered how they actually work.",['nsubjpass'],0
1170,1170,0.9999248080644244,7.519193559512559e-05,0.109,0.815,0.075,"I basically went to my school counsellor, who told me there's 'take as needed' medication for anxiety (which I wanted, my anxiety was never that bad), I went to my doctor, he told me it's too addictive and gave me Effexor XR which I took gladly because like I said, my anxiety was topical; I'd feel anxious before presenting, or before meeting someone new.",['attr'],0
1173,1173,0.9999949449110676,5.055088917482893e-06,0.474,0.526,0.0,I have memory problems and I'm on anxiety and clinical depression medicine aswell.,['conj'],0
1174,1174,0.998892485507347,0.0011075144926394418,0.0,0.8009999999999999,0.19899999999999998,"But I just wanted to make a post saying that for the last 4 or 5 days I've felt pretty much like the old me, the pre-medication, pre-seizure me.",['appos'],0
1175,1175,0.9999634939365432,3.650606343865211e-05,0.162,0.6940000000000001,0.145,TLDR: Starting to feel like me again after struggling with my diagnosis and medication.,['conj'],0
1176,1176,0.999778828522698,0.00022117147728936744,0.0,0.787,0.213,I have considered all other things that involve someone with a phD prescribing me meds that I can't pronounce and talking to a councellor but first I would like to gain some perspective on my situation.,['mark'],0
1180,1180,0.999802723206406,0.0001972767936035329,0.0,1.0,0.0,Anyway me and my doctor decided to try a medication swap as I just wasn't functioning.,['compound'],0
1182,1182,0.9999408162851884,5.918371482468503e-05,0.264,0.636,0.1,"(no meds because doctors suck so hard) I'm not afraid of flying, I'm just worried that with this increased anxiety things that didn't bother me are suddenly going to make me have an anxiety attack.",['dep'],0
1194,1194,0.9994078279631464,0.0005921720368654465,0.16699999999999998,0.833,0.0,Lexipro...Buspar (both anxiety medications) stomach medication (due to the anxiety I was producing too much stomach acid) I was in HELL...,"['appos', 'ROOT']",0
1195,1195,0.9999640406788584,3.595932113835158e-05,0.0,0.8109999999999999,0.18899999999999997,Fast forward to 3 therepists and 4 medications later I met someone who saved my life.,['conj'],0
1208,1208,0.9999094260633375,9.057393665384128e-05,0.0,1.0,0.0,I was taking several anti-depressants and anti-anxiety medications for years.,['conj'],0
1218,1218,0.9999462612555634,5.3738744429071805e-05,0.142,0.858,0.0,"(Quick info: F, 21, stressed about school and being around others + their expectations, no medication now but previously on Wellbutrin and Ritalin)",['attr'],0
1223,1223,0.9999894049489808,1.0595051034563993e-05,0.0,1.0,0.0,Pro tip: don't read medicine side-effect pamphlets,['compound'],0
1224,1224,0.9999348733997198,6.512660027362884e-05,0.0,1.0,0.0,"This goes for any other type of product (toothpaste, pop, lotion, medicine, etc.)",['conj'],0
1246,1246,0.9997867406232072,0.00021325937678398301,0.0,1.0,0.0,"For example: I have now finished my exams with marks over 90% , I'm in the last year of medicine school.",['compound'],0
1247,1247,0.9999947386127588,5.26138723034774e-06,0.23399999999999999,0.7659999999999999,0.0,I don't want psychotherapy or meds.,['conj'],0
1255,1255,0.9795283808760974,0.020471619123908474,0.12,0.8390000000000001,0.04,So unless I find a job real soon I’ll be in a world of pain once I run out of Cipralex and the withdrawal from my medication kicks in.,['compound'],0
1261,1261,0.9992085225448726,0.0007914774551462557,0.0,1.0,0.0,Finding myself taking the Clonazepam that just sits in the medicine cabinet most of the year.,['compound'],0
1267,1267,0.999986197024556,1.3802975432179889e-05,0.36200000000000004,0.638,0.0,Unfortunately when I was about 15 (23 now) my anxiety problems climaxed because I was overprescribed medications.,['attr'],0
1281,1281,0.9995541227498448,0.00044587725014446885,0.0,0.8170000000000001,0.183,"This is the original: http://www.reddit.com/r/Anxiety/comments/2h9b8o/meds_stories_about_zoloft/ 
If it doesnt work go to my profile I don't have alot of posts you'll easily see which i meant.",['acl'],0
1296,1296,0.9998954062363984,0.00010459376359366559,0.0,0.5,0.5,"If it is medication, I want help.",['attr'],0
1297,1297,0.999597426232922,0.0004025737670751592,0.141,0.8590000000000001,0.0,"But I'm afraid that if I were to be prescribed medication, it might change me in ways I'd regret.",['attr'],0
1312,1312,0.9999398975503742,6.01024496280322e-05,0.054000000000000006,0.892,0.054000000000000006,"Most medications they suggest for this tend to make you into high functioning zombies in my experience  so to avoid that if you can, all you can do is learn your triggers and practice coping mechanisms - like chamomile tea or meditation for me.",['ROOT'],0
1335,1335,0.9999466504810136,5.334951899414781e-05,0.0,1.0,0.0,"So now the medication that I NEED, and they were supposed to have, they haven't refilled.",['nsubjpass'],0
1336,1336,0.9994935979463192,0.0005064020536916751,0.0,1.0,0.0,This is the exact same medication that I have gotten from this exact pharmacy for almost a decade now.,['attr'],0
1338,1338,0.9998539095978359,0.00014609040214863978,0.127,0.873,0.0,Its gotten to the point where I've been prescribed Zofran (vomiting/nausea medication given to pregnant women) for whenever these attacks happen.,['parataxis'],0
1350,1350,0.9999720014982946,2.7998501712932384e-05,0.198,0.802,0.0,I'm not really interested in therapy or medication at this point.,['conj'],0
1351,1351,0.9999762175019922,2.3782497997714176e-05,0.0,1.0,0.0,He has been diagnosed and prescribed meds but I have not.,['conj'],0
1357,1357,0.9999024514883884,9.7548511612628e-05,0.0,1.0,0.0,"Food, alcohol, medication, social situations...name it.",['conj'],0
1371,1371,0.9995812531495052,0.0004187468504843593,0.0,0.738,0.262,I've definitely improved myself through therapy and medication but there's a long road ahead.,['conj'],0
1388,1388,0.9997519229108152,0.0002480770891810957,0.318,0.682,0.0,"My problem is I'm very wary of medication changes, I worry about side effects etc.",['compound'],0
1392,1392,0.9999288738467096,7.112615327876957e-05,0.244,0.7559999999999999,0.0,I'm hesitant because I have no health insurance (and never previously prescribed medication because of that).,['conj'],0
1395,1395,0.9999382923245118,6.170767548691038e-05,0.069,0.8220000000000001,0.109,Can anyone help is there any maybe other medication you recommend I went to the hospital and they claim this is anxiety disorder but they didn't keep me in the mental health ward what is going on with me I just want my life back.,['attr'],0
1427,1427,0.9999760839319436,2.3916068063019213e-05,0.0,1.0,0.0,Or maybe there's other medications I don't know of besides benzos that have helped you guys?,['attr'],0
1429,1429,0.9999567825975364,4.321740246680258e-05,0.069,0.9309999999999999,0.0,I find it hard to find somewhere to go and I don't really know what I can be doing beyond therapy and medication.,['conj'],0
1435,1435,0.9997392117916549,0.00026078820835087233,0.0,1.0,0.0,"I've recently started the medication shuffle and right now I'm on 112.5 mg effexor and 100 mg zoloft nightly, with the effexor scheduled to go up and the zoloft down at my next psych appointment.",['compound'],0
1441,1441,0.9997985034871908,0.0002014965128153154,0.0,1.0,0.0,(even things that aren't medically related or on a medication level),['compound'],0
1454,1454,0.9993072650710282,0.0006927349289818289,0.163,0.727,0.111,I know depression is a disease like others and need to keep in treatment and maybe I will never will be like other people BUT medicines no more for me.,['conj'],0
1472,1472,0.9999560249886792,4.397501131192949e-05,0.162,0.532,0.306,"Please, I don't want therapy or medication.",['conj'],0
1473,1473,0.99981670761971,0.00018329238029567006,0.0,1.0,0.0,"As a guy, I can't talk to anyone about this and when I mention this elsewhere they say I should seek therapy and medication.",['conj'],0
1488,1488,0.9998609792936412,0.00013902070634628258,0.0,1.0,0.0,"Also, the first thing she pushed was medication.",['attr'],0
1516,1516,0.9988390662880041,0.0011609337119943546,0.067,0.8420000000000001,0.092,"I was put on medication months ago to help with the anxiety, but found I kept forgetting to take it regularly.",['compound'],0
1533,1533,0.9998146487463038,0.00018535125369571395,0.38,0.62,0.0,My biggest fear is the medication people take for Anxiety.,['compound'],0
1538,1538,0.9994109487602784,0.0005890512397040865,0.064,0.9359999999999999,0.0,"Hey everyone,
Just thought I'd come onto this subreddit to offer my time and experiences with taking Lexapro to those of you who might be contemplating going the medication route or therapy route or whatever might be bothering you.",['compound'],0
1540,1540,0.9998535033921724,0.00014649660781050633,0.134,0.748,0.11800000000000001,I'm not good at telling people when I need help but I am afraid of going through another medicine change... My therapist says I would do better on Abilify but I've heard bad things about it... Should I expect the issues to go away?,['compound'],0
1542,1542,0.9998886065023704,0.0001113934976291352,0.0,0.47100000000000003,0.529,"2) Watch Comedy TV Shows - make yourself laugh, as everyone knows laughing is the best medicine.",['attr'],0
1552,1552,0.9999539278961688,4.607210383698096e-05,0.0,0.722,0.278,Is there a medicine that can actually help me?,['attr'],0
1555,1555,0.9981185441120032,0.001881455887978996,0.159,0.74,0.10099999999999999,"I realize with my rational mind that it is probably because I weaned myself off my meds two months ago, but with my anxiety riddled mind I feel positive that I'm going to feel this bad for the rest of my life.",['npadvmod'],0
1557,1557,0.9997853912016476,0.00021460879836141612,0.048,0.904,0.048,"I'll be going to my family doctor to discuss my problem and hopefully get a referral to a psychiatrist in order to begin some form of therapy, perhaps medication (though, preferably not, but I guess we'll see), and whatever else.",['appos'],0
1563,1563,0.9985339840549929,0.0014660159450162352,0.129,0.746,0.124,I got meds the other day and adjusting to the lexipro has me nauseated and even more panicked for a good 45 minutes.,['prep'],0
1575,1575,0.9998375720632109,0.0001624279367812998,0.14400000000000002,0.856,0.0,"After I told him, and I quote ""fuck the new doctor, this is between you and me"" he finally stopped going off about it and we got down to talking about my treatment, directions, and meds.",['conj'],0
1577,1577,0.9994723317223776,0.0005276682776295708,0.0,0.821,0.179,"After giving me a list, I was tasked with picking a new med or meds.",['conj'],0
1584,1584,0.999963903367096,3.60966329180092e-05,0.0,1.0,0.0,The first two were zombie meds.,['attr'],0
1585,1585,0.9999726190962224,2.738090377113361e-05,0.0,1.0,0.0,and shouldn't I be on another medication aswell as the one I am currently on if this is happening?,['compound'],0
1605,1605,0.9996034494453484,0.00039655055466939284,0.214,0.7859999999999999,0.0,I have been to three different Dr's in regards to this and two of them prescribed different anti anxiety/anti depressant meds.,['npadvmod'],0
1607,1607,0.9999027700054808,9.722999452609715e-05,0.099,0.9009999999999999,0.0,"So I stopped and explained the situation with my doctor and my medication to which she just said, ""Well, that's not good.""",['conj'],0
1608,1608,0.9999805260922736,1.9473907736331107e-05,0.434,0.5660000000000001,0.0,"What are some other anti anxiety meds, and should I worry about addiction?",['attr'],0
1613,1613,0.9974684948032648,0.0025315051967347607,0.205,0.795,0.0,I'm not sure if that was the medicine getting me into a pattern or if that's just the nature of my miserable life.,['attr'],0
1632,1632,0.999173240755376,0.0008267592446142978,0.0,0.852,0.14800000000000002,"With a ton of practice, a xanax or two, and my regular medication, this isn't a problem.",['conj'],0
1635,1635,0.9999778933783374,2.2106621675881653e-05,0.059000000000000004,0.8590000000000001,0.08199999999999999,(I know there are other medications that aren't so bad- like wellbutrin- but I'm breastfeeding my son and none of them are known to be safe.),['attr'],0
1641,1641,0.9906290132160768,0.00937098678391902,0.174,0.826,0.0,So the first class begins and I am on edge despite the propranolol I took (this is basically a heart medication which tries to reduce the adrenalin dump we experience during stressful situations).,['attr'],0
1662,1662,0.9980233528893188,0.001976647110695398,0.0,1.0,0.0,I am due to see a psychiatrist for medication in a few days after talking about it (medication) with my therapist.,['npadvmod'],0
1666,1666,0.9996717751278368,0.0003282248721523893,0.086,0.914,0.0,"age: 18

gender: male

type of anxiety: unknown

trigger examples: School, emotion, change

medications: none

country: US

insurance: parents",['appos'],0
1667,1667,0.99999386172,6.138280012164539e-06,0.298,0.583,0.12,the past month i was diagnosed with hypothyroidism and my medicine is not regulated at all so I'm still having super bad panic attacks.,['conj'],0
1671,1671,0.9999472931582574,5.2706841736892576e-05,0.259,0.6809999999999999,0.06,"I'm 90% sure it was just the anxiety of taking medicine making me have the bad reaction, and the medicine dosage was just so low that it didn't calm me down.",['compound'],0
1686,1686,0.9996426891752452,0.00035731082474505817,0.0,0.7979999999999999,0.20199999999999999,"In middle school, I was on 4 mg of Klonopin daily, plus numerous other strong medications.",['conj'],0
1687,1687,0.9999035607350032,9.643926501050436e-05,0.095,0.905,0.0,"Since then, I have weened my way down to just 20 mg of Prozac daily, no other meds... And I recently went off that.",['npadvmod'],0
1698,1698,0.999931339728782,6.8660271234632e-05,0.095,0.687,0.218,It just sucks that this medicine that actually works and makes me feel like a normal person is a pretty heavy duty narcotic.,['dative'],0
1706,1706,0.9998919542692444,0.00010804573075419305,0.0,1.0,0.0,"I was wondering if you could provide advice on this, is there a particular medication that has worked for you?",['attr'],0
1712,1712,0.999102005857884,0.0008979941421310008,0.18100000000000002,0.8190000000000001,0.0,But for as long as I can remember ...I've felt constantly tired and just overall sluggish so I've been kind of wondering if this could be the paxil as it is the only anxiety medication I've taken.,['attr'],0
1715,1715,0.999755605706562,0.00024439429344098,0.0,0.593,0.40700000000000003,Do I sound like someone who would benefit from a medication change?,['compound'],0
1741,1741,0.9999928158715246,7.184128477210512e-06,0.0,1.0,0.0,Does anyone else on similar SSRI medication use the Pill and if so have there been any complications for you?,['compound'],0
1744,1744,0.999975946630505,2.4053369494460315e-05,0.0,0.838,0.162,"I assume because this is 10 years later, their might be some better medications with less side-effects.",['attr'],0
1749,1749,0.997131384610514,0.0028686153894989484,0.033,0.7759999999999999,0.191,"How long should I expect for a diagnosis to result in some form of treatment or medication (a lot of what I'm experiencing causes me harm on a daily basis – not to say that there's a huge rush for getting help as I'm not at risk for self-harm whatsoever, but obviously I would like to start moving in a positive direction as soon as possible).",['conj'],0
1750,1750,0.996283210265615,0.0037167897343842256,0.38,0.575,0.046,"I have a mild panic disorder and have made real progress in the past few years with therapy and meds, but I did have another panic attack last night after fighting with family.",['conj'],0
1756,1756,0.9999647737716386,3.522622834603305e-05,0.08900000000000001,0.9109999999999999,0.0,"I can't get professional help since my parents would kick me out if I tried, they are very much against psychiatrists and medication for psychological issues.",['conj'],0
1771,1771,0.9998538986313434,0.00014610136866142646,0.0,1.0,0.0,"This was the first time I realized I may be manic, my weekend doctor observed this in me but didn't know if I was bipolar or it was the meds.",['attr'],0
1774,1774,0.999951860936558,4.8139063426296944e-05,0.139,0.6559999999999999,0.205,"Background info: Girl, teenager, started like anxiety meds 2 years ago.",['advcl'],0
1784,1784,0.9983825915983198,0.001617408401680708,0.0,0.6,0.4,"9 Months later im meds free,smoke free and im living a healthy life.",['attr'],0
1788,1788,0.9950671962095948,0.004932803790413964,0.336,0.599,0.065,"I feel like a fool in front of my parents for causing this scene, even though my mom, aunt, and grandmother all take anti- anxiety and anti depression medication including xanax.",['conj'],0
1789,1789,0.9967282918082532,0.003271708191747359,0.0,0.682,0.318,"I've been through a handful a meds, and thankfully,  Celexa was the one that worked best for my biochemist.",['npadvmod'],0
1794,1794,0.9999152244343432,8.477556565087239e-05,0.11599999999999999,0.795,0.08900000000000001,I usually have to vomit if the nausea is really bad because it is the only thing besides my dwindling supply of Zofran (anti-nausea medication) that makes it better.,['parataxis'],0
1811,1811,0.9999763818530132,2.3618146985131115e-05,0.0,1.0,0.0,Any tips or meds that have worked for you.,['conj'],0
1815,1815,0.9999893077491292,1.069225087093638e-05,0.0,0.7609999999999999,0.239,"My meds, my doctor, my therapist...nothing is helping.",['npadvmod'],0
1816,1816,0.9999720900636228,2.7909936384786133e-05,0.22,0.78,0.0,My doctor wasn't much help; just prescribed more meds.,['ROOT'],0
1825,1825,0.999807855934272,0.00019214406573173635,0.0,0.86,0.14,"I really want to be on beta blockers or something similar because I've heard they help with the physical symptoms, but I also really want to be able to drink on whatever meds I have to take.",['dep'],0
1833,1833,0.9999301467555134,6.985324448628129e-05,0.0,1.0,0.0,"I know every med acts differently on different people, but are there meds that don't cause these issues?",['attr'],0
1845,1845,0.9810580610675664,0.018941938932415373,0.0,1.0,0.0,"It has taken therapy, medication and a lot of willpower on my behalf to make even the smallest changes in my communicative and cognitive behavioral habits.",['conj'],0
1854,1854,0.9968587090352709,0.0031412909647331923,0.0,0.878,0.122,"And on top of that, the meds I've been using for the last 8 years?",['ROOT'],0
1859,1859,0.9899117781708852,0.010088221829104505,0.113,0.887,0.0,"Have you thought of harming yourself daily because the idea of leaving your house and dealing with a job, something that apparently everyone else in the world can deal with without psych meds, therapy and tears, is too much to deal with at least 3 times a week?",['appos'],0
1862,1862,0.999971532143063,2.8467856924108e-05,0.174,0.638,0.188,Hello I have just been given medication for my anxiety and the medication has been giving pretty bad side effects while in at work.,['conj'],0
1866,1866,0.9994634801359104,0.0005365198641023778,0.292,0.708,0.0,She told me that it's medicine and no different than taking a blood pressure pill daily to lower your bp.,['attr'],0
1871,1871,0.9996668176661077,0.0003331823338896597,0.0,0.517,0.483,"It could be a video that will just make you giggle a tiny bit, laughter truly is the best medicine.",['attr'],0
1891,1891,0.9995692187434086,0.00043078125660442557,0.0,1.0,0.0,"I only took the meds one more night, and called it quits.",['dative'],0
1900,1900,0.9989894044650752,0.0010105955349140328,0.095,0.905,0.0,"They refused to give me a medication consult, stating that because I was getting out, they wouldn't be able to monitor the effects properly.",['compound'],0
1901,1901,0.9964234831908808,0.00357651680910355,0.0,1.0,0.0,The earliest they could see me for a medication consult was the end of October.,['compound'],0
1902,1902,0.9994972972838484,0.0005027027161573529,0.0,1.0,0.0,Then I had a break; I got an appointment with a PCM for tomorrow afternoon for a medication consult.,['compound'],0
1922,1922,0.9999252021715528,7.479782844398466e-05,0.075,0.925,0.0,"But then again, all of this could be psychosomatic and linked to my newfound anxiety and dramatic medicine changes as of late.",['compound'],0
1936,1936,0.9999281512886076,7.184871139995909e-05,0.23199999999999998,0.768,0.0,I'm never too sure if the anxiety went away because I ended and completely cut off the relationship or if it was the medication.,['attr'],0
1946,1946,0.9996073591794732,0.0003926408205361939,0.16699999999999998,0.833,0.0,I finished up the last year of college with no counseling or meds.,['conj'],0
1952,1952,0.9961215909297368,0.003878409070243777,0.162,0.787,0.051,"I've been taking lexapro for around 4 months now, it has been the most effective medication i've taken for my anxiety but the worst side effect is anorgasmia, decreased sex drive and just a general disconnection with my sexuality.",['attr'],0
1961,1961,0.9998726893380856,0.00012731066191849834,0.0,1.0,0.0,Is there really a medication out there that won't give me these side effects?,['attr'],0
1970,1970,0.999761423545683,0.00023857645433090772,0.0,1.0,0.0,After that I went to a clinic and began medicine management.,['compound'],0
