,Unnamed: 0,neg_prob,pos_prob,neg_vader,neu_vader,pos_vader,sentence,dict,identifier
0,0,0.9993578434150746,0.0006421565849434352,0.22699999999999998,0.7240000000000001,0.049,I have a feeling that this will only get worse from now on since she's also looking up all sorts of alternative medicine bullshit for OCD now...,['compound'],0
9,9,0.999170802003095,0.0008291979969083492,0.251,0.7490000000000001,0.0,I scheduled a GP appointment last week and he diagnosed me with anxiety and panic disorder and referred me to a psych for further evaluation and medication and a therapist.,['conj'],0
10,10,0.9996599191318702,0.00034008086814398854,0.0,1.0,0.0,I can't afford a consular right now or medication.,['conj'],0
21,21,0.999499384865806,0.0005006151342118719,0.0,1.0,0.0,Though recently I heard that some people on anti-depressant medication experience a similar symptom.,['compound'],0
27,27,0.9999715644434776,2.843555650430106e-05,0.0,1.0,0.0,"Hey guys,

I just got prescribed new meds Lexapro and lorazepam.",['compound'],0
38,38,0.9997842137624094,0.0002157862375943604,0.29600000000000004,0.6459999999999999,0.057999999999999996,The ER doctor gave me muscle relaxants and some pain meds and referred me to a neurologist because they suspect I have some nerve damage.,['conj'],0
47,47,0.9999816397331962,1.836026680321117e-05,0.0,1.0,0.0,Topical medications?,['ROOT'],0
48,48,0.9999816397331962,1.836026680321117e-05,0.0,1.0,0.0,Oral meds?,['ROOT'],0
52,52,0.9999969099079292,3.0900920671462085e-06,0.23399999999999999,0.677,0.08900000000000001,I just feel like I am too scared and crippled to do anything now and I'm not sure if I should give anxiety medicine another try.,['dative'],0
61,61,0.999986167273184,1.3832726821929788e-05,0.0,1.0,0.0,She was an alternative-medicine type therapist and helped me talk some things out and give me some coping strategies.,['compound'],0
62,62,0.999912739487101,8.726051288769172e-05,0.29100000000000004,0.5820000000000001,0.127,im excited to see how the meds are gonna kick ass over my anxiety!,['nsubjpass'],0
77,77,0.9944481169008192,0.005551883099161669,0.12,0.7170000000000001,0.163,"I always feel the need to make them feel better, its as though my brain just picks up all the uneasiness of others, makes them feel better and in return i end up stuck with all these shit feelings...

i dont know what to do and am honestly considering therapy or some medications that will just calm me down.",['conj'],0
78,78,0.9983784420173092,0.0016215579826954374,0.0,1.0,0.0,"Things were really looking up for a while, since the medication was prescribed.",['nsubjpass'],0
79,79,0.999873012442366,0.00012698755762133432,0.0,0.884,0.11599999999999999,"But does anyone maybe have any tips for dealing with things like I've described, short of therapy or more/different medication?",['conj'],0
80,80,0.999916658140461,8.334185953752666e-05,0.0,0.885,0.115,Anyways I cannot think of any solutions aside from breaking up with her which is the last thing I want to do and want to ask for any ideas on how to cope with this (no meds please).,['appos'],0
81,81,0.9999564224508132,4.357754918326602e-05,0.121,0.879,0.0,"Other general info if needed: Age: 16 (Junior in High School), No meds or any drug use.",['conj'],0
83,83,0.999891855595662,0.00010814440434398786,0.0,0.7,0.3,I recently had to take some melatonin to improve my sleep quality as well as other medication to calm myself down.,['conj'],0
94,94,0.9999106246459796,8.937535401939163e-05,0.268,0.635,0.09699999999999999,I am just exhausted emotionally and wanted to hear some POV of fellow anxious redditors who may have good / bad experiences with medication therapy.,['compound'],0
106,106,0.9996984647399529,0.0003015352600414415,0.071,0.843,0.086,And I also have anxieties about psychoactive substances like my medication having control over my mind and making me unable to exercise free will over my thoughts and emotions and instead making me into someone that is unhappy but still functional in society.,['npadvmod'],0
110,110,0.9999844111349612,1.558886502032838e-05,0.10800000000000001,0.892,0.0,I've been off any &amp; all anxiety meds &amp; antidepressants for going on 4 years now.,['ccomp'],0
116,116,0.999491299191504,0.0005087008084882226,0.0,0.785,0.215,"Meditation and talk therapy are also part of my regiment, but this is one medicine change I've been very happy with.",['compound'],0
117,117,0.9997158293014036,0.00028417069861472384,0.384,0.616,0.0,Then I had a massive panic attack so I took 1mg Lorazepam (my first time taking any anxiety meds).,['conj'],0
137,137,0.9999626768428844,3.732315710677738e-05,0.13,0.713,0.157,"I think I'm going to mention this to my doctor and see what she says about it, because if there are other medications I could try that dull the anxiety but don't necessarily dull the happiness as much then I'd like to try them.",['attr'],0
144,144,0.9977966080071696,0.0022033919928105693,0.146,0.774,0.08,"Are there any meds that help with nausea, bloating and loss of appetite because Im losing lots of weight ever since my life has begun to get more social.",['attr'],0
162,162,0.9998111453542904,0.0001888546457259136,0.043,0.894,0.064,"Also, I obviously need a job to have money to pay for treatment and medication but until I get that, are there any medications I can get without a prescription for anxiety?","['conj', 'attr']",0
174,174,0.9989516258625264,0.0010483741374851564,0.129,0.6559999999999999,0.215,"So, here I am, not talking to anyone but my family and one single best friend, being angry and confused since I can’t find a way to be more talkative and not shy again (even though I am on Atarax, the medicine one doctor prescribed me to use against the anxiety, it doesn’t seem to help much so far).",['nmod'],0
175,175,0.9990228472617809,0.000977152738214636,0.166,0.618,0.21600000000000003,"We've tried counselling and medication, but we gradually lost hope in finding a 'cure'.",['conj'],0
186,186,0.9999814378796418,1.8562120370437507e-05,0.159,0.841,0.0,Could it just be morning anxiety or possiblly medication related?,['npadvmod'],0
195,195,0.9999721361131524,2.7863886860868164e-05,0.0,0.69,0.31,And did medication help (beta-blockers in partciular)?,['compound'],0
202,202,0.9982012039954742,0.001798796004535746,0.203,0.7440000000000001,0.053,"Before you mention it I've tried the medication route with horrendous results, Zoloft made me have extreme Akathasia, so much so I was almost committed, one of the worst experiences of my life.",['compound'],0
225,225,0.9999024831527524,9.751684722921043e-05,0.09300000000000001,0.768,0.138,My counselor suggested it because I want to try to get over my anxiety without and serious medication.,['conj'],0
228,228,0.9999656405362672,3.435946372006577e-05,0.0,0.726,0.27399999999999997,"Recently, my symptoms have greatly improved with therapy and meds.",['conj'],0
233,233,0.9995770440935804,0.000422955906401562,0.09699999999999999,0.6859999999999999,0.217,Is there a medication (for daily use) that has been successful for you with anxiety?,['attr'],0
237,237,0.9925853260802012,0.007414673919794602,0.07200000000000001,0.8170000000000001,0.111,"After a year of doc visits and multiple medications,  I'm turning to the collective wisdom of reddit, if for no other reason than to find some common ground.",['conj'],0
240,240,0.9999749101592984,2.5089840709117763e-05,0.19399999999999998,0.8059999999999999,0.0,"The first 3 medications I gave up after 1-6 weeks, depending on how shitty they made me feel.",['ROOT'],0
260,260,0.9995054124719313,0.0004945875280745631,0.0,0.929,0.071,"I've been on a number or medications such as citalopram, fluoxetine and pregabalin but nothing has worked.",['conj'],0
261,261,0.9997597656732412,0.00024023432675763959,0.161,0.8390000000000001,0.0,"I have an appointment with a psychologist next week, but I know she can't help me with medication management.",['compound'],0
272,272,0.999962194360418,3.780563956240463e-05,0.0,1.0,0.0,I cannot afford therapy or medication.,['conj'],0
274,274,0.9999887263026304,1.1273697369717725e-05,0.0,1.0,0.0,"You would probably tell me something about ""*It'll be fine*"" or ""*You have all your life before you*"" or even ""*There is medication for this*"".",['attr'],0
293,293,0.9980983230066608,0.001901676993339788,0.0,1.0,0.0,"The patient must go through a series of Cognitive therapy practices and medication must be supplemented to overcome these harmful thoughts.""",['conj'],0
313,313,0.9999060497242752,9.395027572904624e-05,0.447,0.483,0.07,I have nausea meds incase I do feel nauseous but I'm tired of constantly feeling sick and worried.,['compound'],0
317,317,0.998734993368294,0.0012650066317120518,0.0,1.0,0.0,"Due to a mix up at the clinic pharmacy, my medication wasn't filled and now i'm out.",['nsubjpass'],0
336,336,0.9999576964854134,4.230351458882414e-05,0.122,0.718,0.16,"and im no good with keeping up with meds long term, so SSRIs are out.",['amod'],0
344,344,0.999954706232352,4.529376764180548e-05,0.0,1.0,0.0,I know that meds effect everyone differently.,['ccomp'],0
359,359,0.9986396845089596,0.0013603154910446745,0.2,0.8,0.0,I had a bad experience with benzodiazepines and it's put me off of the whole medication thing.,['compound'],0
361,361,0.9998236802896808,0.00017631971029976579,0.0,0.785,0.215,"Girlfriend is leaving me because she can't ""be there for me"" through this positive process of change and growth I'm going through due to therapy and medication.",['conj'],0
367,367,0.9998478834407662,0.00015211655922776478,0.145,0.855,0.0,"i've seen doctors, all who refused to refer me to mental health specialists and reccomended me antidepressants/anti anxiety meds which i am vehemently opposed to taking.",['conj'],0
370,370,0.9999896457353704,1.0354264616839275e-05,0.38,0.17300000000000001,0.44799999999999995,No medication please!,['ROOT'],0
382,382,0.9999856759132936,1.4324086724707196e-05,0.0,1.0,0.0,"So guys, I was wondering what medicines are prescribed and how dependent you are on them?",['nsubjpass'],0
384,384,0.999458052010642,0.0005419479893573364,0.0,1.0,0.0,"I've been on and off anti-depressants and/or anti-anxiety meds for the past six years, each to varying effects: Paxil, Lexapro, Zoloft, Wellbutrin, Klonopin, Effexor, Remeron, Trazadone, Abilify.",['conj'],0
408,408,0.9999817224636663,1.8277536316489803e-05,0.0,1.0,0.0,I have health insurance that covers what I would need to see someone about therapy or medication.,['conj'],0
414,414,0.9998109988369958,0.0001890011629888124,0.10400000000000001,0.8959999999999999,0.0,"I know this did not happen on its own, I did years of therapy, studying, and medications (I am no longer on.)",['conj'],0
436,436,0.998742510013794,0.0012574899862015645,0.18100000000000002,0.73,0.08900000000000001,"I feel like i have the right tools through therapy and medication to stop the anxiety/panic but it just steam rolls over me.I try to read, go for a walk, talk to someone but it feels like if a panic attack wants to get me, its going to get me.",['conj'],0
439,439,0.7445757642269344,0.25542423577305623,0.18899999999999997,0.659,0.152,"I took an oxycodone to help ease it and am waiting for it to kick in fully, but I know it may not help the headache itself since different pain medication types work on different kinds of pain.",['compound'],0
440,440,0.9992054127918693,0.0007945872081164072,0.0,0.794,0.20600000000000002,"Therapy and medication are not to be overlooked, despite the unfair stigma that may surround them.",['conj'],0
457,457,0.9996977714360994,0.00030222856390084424,0.115,0.885,0.0,"When I first developed this anxiety I went to this doctor S. Doctor S prescribed me Ativan and a sleeping medication and sent me on my way, but he made me feel a little uncomfortable and I wanted to try someone new.",['conj'],0
461,461,0.9987014915901572,0.0012985084098591554,0.0,0.816,0.184,"This, by the way, is with the help of anti-depressants and anti-anxiety medication.",['conj'],0
478,478,0.9997974572364604,0.00020254276353270432,0.203,0.639,0.158,I feel the best thing for me is medication because I've been living my whole life with depression and social anxiety.,['attr'],0
490,490,0.9998191279767086,0.0001808720232906228,0.0,0.899,0.10099999999999999,"Found out in my first visit that three meds I am currently on (two psychotropics,  and one to treat my migraines) all leach away Vit B's.",['npadvmod'],0
499,499,0.998926509733827,0.0010734902661567775,0.0,0.9390000000000001,0.061,"I am calling my mothers social worker tomorrow to organise daily care for her, a social worker for my dad is supposed to call me tomorrow morning
and i will also call his own doctor to see if there is some type of monitoring that can be done, or medication to settle him.",['conj'],0
500,500,0.9999493428661456,5.065713386787e-05,0.213,0.787,0.0,"My tools, my medication, my stubborn attitude aren't enough this time.",['conj'],0
501,501,0.9944572889719122,0.005542711028085994,0.07200000000000001,0.804,0.124,"He then suggested that I can try Ciprolex, which he said about 40% of his patients suffer from decreased libido, but is also a good medication and much cheaper.",['attr'],0
504,504,0.999989214672936,1.0785327062434863e-05,0.0,0.797,0.203,Would pursuing drugs or medications be helpful or am I just being wishful?,['conj'],0
505,505,0.9977070968456634,0.002292903154345982,0.09699999999999999,0.903,0.0,I also don't have a lot of money to try to pay for therapy or medication.,['conj'],0
515,515,0.9999594661553995,4.0533844596845566e-05,0.292,0.708,0.0,"Is it me, my failing relationship or my meds?",['conj'],0
525,525,0.9999974522489324,2.547751071313373e-06,0.23399999999999999,0.68,0.086,"I never thought my anxiety would get this bad, and xanex is an addictive medicine.",['attr'],0
538,538,0.9999605103240752,3.948967594428699e-05,0.19699999999999998,0.8029999999999999,0.0,"I'm not sure what - therapy, counseling, medications, whatever ...",['conj'],0
564,564,0.9999961379926128,3.862007382266784e-06,0.239,0.7609999999999999,0.0,Are there medications that I should flat out avoid?,['attr'],0
572,572,0.9998020925879564,0.00019790741205282086,0.11,0.6709999999999999,0.218,"Basically I'm schizophrenic, and while my psychiatrist and care worker will give me help and meds for the psychosis, they don't seem to care about the anxiety attacks that I experience daily, and everywhere.",['conj'],0
574,574,0.9999289217304346,7.107826956344615e-05,0.0,0.9159999999999999,0.084,"I try to do all the stuff I'm supposed to do to calm myself and change my thinking (therapy, changing self talk, mindfulness, meditation, medication, exercise, etc.).",['conj'],0
580,580,0.9998814684183142,0.00011853158168247815,0.0,1.0,0.0,I have meds but meds are meds (in other words I still feel this anxiety) &amp; I don't have enough ativans to keep popping them over the next 10 days or so.,['attr'],0
612,612,0.9993600699816912,0.0006399300183057892,0.7070000000000001,0.293,0.0,"Here I am, no anxiety, no panic attacks, no medication, just a normal dude.",['conj'],0
616,616,0.9999895258800828,1.047411991272532e-05,0.0,1.0,0.0,Should I seek out medical attention and maybe medication?,['conj'],0
619,619,0.9992683377929096,0.0007316622070822739,0.091,0.8690000000000001,0.04,"I wasn't able to fight through it over the past few weeks to have my records sent from old doc to new one, and now I'm worried that the new doc won't trust me when I tell her what meds to put me on (because I already know what works and what doesn't).",['ccomp'],0
637,637,0.9996411312102744,0.00035886878971808176,0.09699999999999999,0.903,0.0,"As of yesterday, back on therapy, and meds (I hate that I'm on them, but we dicussed that they are for short term.)",['npadvmod'],0
639,639,0.999939450249006,6.054975099764789e-05,0.0,1.0,0.0,A glass of water and medicine.,['conj'],0
652,652,0.9970121258064664,0.002987874193525084,0.091,0.871,0.038,"But recently I've discovered that my dad has anxiety too, and even was prescribed medication (my mom made it seem like it wasn't a huge deal) but after a while quit taking it because he ""didn't want to be propped up on it his whole life"".",['dep'],0
656,656,0.9997099630520796,0.0002900369479080793,0.0,0.5770000000000001,0.423,Reassurance that its okay to give meds a try?,['dative'],0
661,661,0.9999436373173856,5.636268261440599e-05,0.14,0.86,0.0,"I had started taking medication weeks before this and it has completely made my thinking worse, and how I feel about things.",['compound'],0
662,662,0.999886831189958,0.00011316881004532678,0.092,0.826,0.083,"I panicked every single day and ended up texting her to remind her this isn't me, and it's the medicine that she even wanted me to take to help myself.",['attr'],0
665,665,0.9995338180680736,0.0004661819319383424,0.151,0.8490000000000001,0.0,"He doesn't realise it but he's very naturally against mental illness or medicine/tablets such as anti-depressants, it's just kinda of sub-conscious.",['conj'],0
674,674,0.9999252345021468,7.476549783730284e-05,0.086,0.914,0.0,This has been going on consistently through therapy and various anxiety medications for essentially as long as I can remember.,['conj'],0
679,679,0.9995114460370852,0.0004885539629101496,0.0,0.902,0.098,"So, long story short, I want to get off of SSRIs and all medication.",['conj'],0
687,687,0.9999314774979372,6.852250204729114e-05,0.124,0.585,0.29100000000000004,If needed though I will incorporate actual anxiety meds but im currently optimistic that Passionflower and CBT will help me overcome anxiety.,['conj'],0
694,694,0.9919464976082684,0.008053502391725994,0.069,0.745,0.18600000000000003,"I've also been curious about trying shrooms, but don't know if my anxiety (or new medication) would get in the way of having a good experience.",['conj'],0
696,696,0.9973935091205473,0.0026064908794707466,0.161,0.8390000000000001,0.0,"Anyway, I know the medication isn't fully in my system yet, I just worry about my anxiety being at an all time high since I've started taking it.",['nsubjpass'],0
697,697,0.9999338434774696,6.615652254180333e-05,0.102,0.898,0.0,TL;DR when do signs and symptoms of anxiety start to fade with combined therapy and medication?,['conj'],0
700,700,0.999837311680902,0.00016268831910133522,0.0,1.0,0.0,I was being prescribed a benzodiazepine by a doctor at this clinic but this medication has been blacklisted from being prescribed.,['nsubjpass'],0
702,702,0.9997640952629372,0.0002359047370735522,0.0,1.0,0.0,"I know that psychiatrists charge per visit and I'm not looking for psychiatric counseling, so I'm wondering how often a psychiatrist expects someone to come in if they're just doing medication management.",['compound'],0
704,704,0.999948435230262,5.156476971902564e-05,0.0,0.9470000000000001,0.053,"(if you want the link just ask) Is there some medication I can take that makes it just go away, and I keep my sex drive?",['attr'],0
713,713,0.9999513790060492,4.862099394092498e-05,0.085,0.7440000000000001,0.171,My partner wants me off the meds badly but I don't know if I shouldgo back on something to get some relief.,['npadvmod'],0
718,718,0.9992787243296529,0.0007212756703503242,0.073,0.7070000000000001,0.22,"I've noticed that the best combination is when I remember to take my meds AND I have about 2 cups of coffee, but the second best is no meds with 2 cups of coffee.",['attr'],0
728,728,0.999981600466986,1.839953302534171e-05,0.0,1.0,0.0,Or any other medication?,['ROOT'],0
733,733,0.9998956319753785,0.00010436802463214001,0.0,0.856,0.14400000000000002,"I was assisting in surgeries, euthanasia, office work, janitor work, grooming, animal care, medication dispensing, and going to multiple unpaid meetings.",['compound'],0
743,743,0.9999788712194508,2.112878056919829e-05,0.18100000000000002,0.745,0.075,"My friends all said that it wasn't healthy to mess with my medication and constantly be going on and off, but none of them had any problems (or so I had thought), medication, therapists, so I would get in arguments and have breakdowns.",['conj'],0
751,751,0.9994951211194016,0.0005048788806062851,0.193,0.807,0.0,"So I went over to the meds sheet and read it, and I read it wrong.",['compound'],0
766,766,0.9997984789043176,0.00020152109569653278,0.0,1.0,0.0,"I have an appointment with a psychiatrist for next week, but I don't think any non-medicine things will make a difference.",['compound'],0
771,771,0.999993294314248,6.705685760027247e-06,0.0,0.92,0.08,I'm going back to my doctor soon and want to ask her about some medicine combinations.,['compound'],0
772,772,0.9999171504457446,8.284955425890954e-05,0.0,1.0,0.0,Once I go back to work I won't be able to return to the doctor every month to adjust my dosage or the medication I'm on.,['conj'],0
773,773,0.9999123730192864,8.762698072185783e-05,0.272,0.728,0.0,TL; DR- The medications I've been prescribed thus far have been limited in effectiveness but have crappy side effects.,['nsubjpass'],0
777,777,0.9998456989467628,0.00015430105323167295,0.08900000000000001,0.9109999999999999,0.0,I know 5-HTP isn't a 'real' medication like SSRIs but it's my last line before I approach a doctor for them.,['attr'],0
790,790,0.9999689411248496,3.105887515511585e-05,0.0,1.0,0.0,I only left to do groceries and pick up prescriptions and medications.,['conj'],0
794,794,0.9996348383629836,0.0003651616370046208,0.0,0.736,0.264,"Not just medication, but in anything that offers you some kind of peace.",['ROOT'],0
801,801,0.9998095093295952,0.00019049067039619749,0.0,0.909,0.091,"Nothing feels okay, I've been seeking different forms of treatment for years and nothing has paid off, not even medicine.",['conj'],0
808,808,0.9980680891363509,0.0019319108636403647,0.0,1.0,0.0,"**The owner knows I'm a hypochondriac,** so I usually just ask her about these things (I've had a lot of dog related hypochondria scares), and she'll tell me what the dog has done, what vaccines it has, meds it has taken, and so on - but what if she hasn't followed the tapeworm medicine regimen?","['dep', 'compound']",0
811,811,0.9994917678258004,0.0005082321742146508,0.096,0.904,0.0,"I was in therapy (cognitive behavioral, no meds) for around a year but haven't been seeing anyone recently.",['appos'],0
830,830,0.9909878228035464,0.009012177196447308,0.127,0.718,0.155,"It just goes to show that sometimes hard work, a good support system, a therapist, and medication (looking at you Xanax &amp; Wellbutrin) can get you through even the darkest of days.",['conj'],0
831,831,0.9999428579060412,5.7142093962072683e-05,0.0,0.5670000000000001,0.433,"So far we've gone over medication discussion, healthy eating, relaxation.",['compound'],0
837,837,0.99916161914834,0.000838380851661875,0.32799999999999996,0.672,0.0,"Benzodiazepines as Treatment for Generalized Anxiety Disorder

Benzodiazepine medications are commonly prescribed in Northport as part of treatment for generalized anxiety disorder.",['nsubjpass'],0
851,851,0.9999698705414376,3.012945855832817e-05,0.0,1.0,0.0,"Is there any medication that works in the long term that you take, that you think I should ask my doctor about?",['attr'],0
863,863,0.9998696490091462,0.0001303509908415559,0.147,0.853,0.0,I'm off meds now and stopped seeing the therapist I saw for 4 years.,['npadvmod'],0
864,864,0.9997018545578359,0.0002981454421522973,0.0,1.0,0.0,I began a D supplement and thyroid meds.,['conj'],0
876,876,0.9999723251205056,2.7674879493631084e-05,0.0,1.0,0.0,Came off meds.,['npadvmod'],0
888,888,0.9997789419649412,0.00022105803506447183,0.423,0.5770000000000001,0.0,"And no meds, no way of getting them.",['ROOT'],0
894,894,0.999976989973664,2.301002633959785e-05,0.306,0.6940000000000001,0.0,"Male, 20 y/o, no psychiatric diagnoses/medications.",['appos'],0
895,895,0.999922421309,7.757869099145415e-05,0.0,1.0,0.0,"She told them she takes klonopin and paxil, which are, if you don't know, anti-anxiety and anti-depressant meds.",['appos'],0
903,903,0.9923014949479304,0.007698505052078689,0.064,0.9359999999999999,0.0,"With therapy and medication, I've come to realize that those kinds of thoughts were caused by the anxiety, and were not an actual reflection of reality.",['conj'],0
914,914,0.9999268180425354,7.318195747307347e-05,0.209,0.7909999999999999,0.0,"Meanwhile, Mum's sister has been diagnosed with depression and has been on therapy and medications.",['conj'],0
919,919,0.9996703110057552,0.0003296889942367819,0.14,0.86,0.0,I don't feel like I need therapy or meds on a general basis as I am still functional.,['conj'],0
929,929,0.994939109143658,0.005060890856333827,0.174,0.581,0.245,&gt;(Now of course the medication available for mental illness are a godsend.,['conj'],0
930,930,0.9982497620391262,0.0017502379608749067,0.344,0.6559999999999999,0.0,"I will state that not everyone with a mental illness has access to either therapy or medications, which I believe is a crying shame.",['conj'],0
936,936,0.9993409345545264,0.0006590654454815221,0.21600000000000003,0.784,0.0,The first long-term medication we tried actually made me depressed as a side effect.,['ROOT'],0
945,945,0.9999348489858214,6.515101416293294e-05,0.0,1.0,0.0,**UPDATE:** I ought to add that BuSpar isn't my first medication.,['attr'],0
949,949,0.999968925879714,3.1074120291302616e-05,0.0,1.0,0.0,"I have tried therapy, medication etc.",['compound'],0
963,963,0.9999542609010492,4.573909895554273e-05,0.0,0.526,0.474,My SO is super supportive and was pretty much responsible for my finally getting the right doctors and meds.,['conj'],0
965,965,0.9954519225407013,0.004548077459305629,0.08199999999999999,0.857,0.061,"I told my friend about this though and she was making a big deal out of it asking how do I know that it's from the anxiety and meds, it could be something serious and I need to talk to my doctor because even if it is a side effect, it's a serious side effect.",['conj'],0
