,Unnamed: 0,neg_prob,pos_prob,neg_vader,neu_vader,pos_vader,sentence,dict,identifier
1115,1115,0.9999387298301612,6.127016983556514e-05,0.0,0.7040000000000001,0.29600000000000004,What medication worked best for you that had minimal side effects?,nsubj,1
1125,1125,0.9993149040465276,0.000685095953454409,0.125,0.6729999999999999,0.20199999999999999,and what type of things do the medications normally do to help fight the feeling of depersonalization?,nsubj,1
1134,1134,0.9997310673088704,0.00026893269112014754,0.0,0.865,0.135,"Over the last 4 or 5 months, however, I feel like the meds have been having *more* of an effect.",nsubj,1
1142,1142,0.999733992320876,0.0002660076791178349,0.0,0.932,0.068,Is it possible that the meds are still in my system and I'm going through withdrawal?,nsubj,1
1143,1143,0.9999836479842956,1.6352015698978987e-05,0.124,0.7909999999999999,0.085,I have no idea if the way I'm feeling is because the meds or if it's unrelated.,nsubjpass,1
1149,1149,0.9999605468171648,3.94531828434459e-05,0.0,1.0,0.0,"I mean, I know how meds are supposed to work, but then sometimes it is discovered how they actually work.",nsubjpass,1
1150,1150,0.9997960928276188,0.00020390717239814716,0.0,0.649,0.35100000000000003,I know that the medication may help.,nsubj,1
1152,1152,0.9998667510942332,0.00013324890577440414,0.0,0.87,0.13,More and more the answer to that question has been that meds may help so I should at least TRY.,nsubj,1
1153,1153,0.9995910459031598,0.00040895409684240096,0.326,0.557,0.11599999999999999,Blah blah it sounds melodramatic but going to 3 different professionals and being told 3 different medications will help me does not inspire confidence.,nsubj,1
1167,1167,0.9995185067489442,0.0004814932510442606,0.075,0.785,0.14,"**TODAY:** About 1.5 or 2 years later now, the medication is working great, no side effects, and the majority of my symptoms have gone away now.",nsubj,1
1168,1168,0.9974788643621596,0.002521135637849473,0.10300000000000001,0.687,0.21,I work in the creative field and I think one of those go-to arguments was that meds may affect your creativity and such.,nsubj,1
1178,1178,0.9999912714000638,8.728599942505338e-06,0.33799999999999997,0.662,0.0,Is there any way the medicine could hurt my anxiety even more?,nsubj,1
1184,1184,0.998844954281068,0.0011550457189370845,0.105,0.7959999999999999,0.099,"I don't feel like the medication was helping (especially considering the amount of anxiety I still feel about getting refills despite being medicated), but the withdrawal is unbearable.",nsubj,1
1192,1192,0.9998437187246536,0.00015628127535913776,0.195,0.805,0.0,"My question is, has anyone else been skeptical about ""Mild"" anxiety meds, given it a try and it actually made a difference??",nsubj,1
1210,1210,0.999965983060622,3.4016939393795825e-05,0.457,0.5429999999999999,0.0,Problem is this medication is making me extremely tired.,nsubj,1
1215,1215,0.9813826138723214,0.018617386127679984,0.17800000000000002,0.8220000000000001,0.0,"I was diagnosed with clinical depression in high school, which, combined with several family related issues, caused me to fail out and generally be in a daze until a couple of years ago when my meds started working and I was able to get (mostly) back on track.",nsubj,1
1221,1221,0.9997813625005898,0.00021863749941037619,0.09699999999999999,0.5710000000000001,0.331,It's like the anxiety is getting too strong for the meds to handle.,nsubj,1
1253,1253,0.999969048205096,3.095179490626289e-05,0.247,0.449,0.303,No meds have seemed to help.,nsubj,1
1276,1276,0.99502307438509,0.00497692561491345,0.316,0.5579999999999999,0.126,"People who are suffering from different kinds of anxiety and depression, which medication was the most effective for you.",nsubj,1
1283,1283,0.99997743327819,2.2566721827678376e-05,0.299,0.299,0.40299999999999997,Does medication help paranoia?,nsubj,1
1284,1284,0.9990553966235888,0.0009446033764181284,0.294,0.604,0.102,"Ultimately, I am scared, as always, that I will regress and not make progress with my anxiety, that the meds will stop working or I will get worse with each anxious episode I have - and I am also terrified that my anxiety is going to drive away the person I love, the person I am engaged to marry.",nsubj,1
1292,1292,0.9996271585739622,0.0003728414260468805,0.10099999999999999,0.8340000000000001,0.066,"I started it on Feb 3rd and have been feeling more anxious, which she told me might happen while the meds regulate.",nsubj,1
1316,1316,0.9959840707337556,0.00401592926623304,0.0,0.649,0.35100000000000003,The meds aren't making much of a difference and I want to try something natural to help.,nsubj,1
1325,1325,0.999915620115014,8.437988497093394e-05,0.087,0.9129999999999999,0.0,"I am just wondering maybe I should lower my dose because now that the medication is at its full effect, maybe it is just too much.",nsubj,1
1331,1331,0.9999832338991932,1.6766100788812814e-05,0.092,0.595,0.314,Hopefully my anxiety meds actually work tonight when I’m hanging out with my friends.,nsubj,1
1333,1333,0.9998798613391356,0.00012013866087303552,0.0,1.0,0.0,I have also recently had my meds changed after being on the same ones for 2 years.,nsubj,1
1335,1335,0.9999466504810136,5.334951899414781e-05,0.0,1.0,0.0,"So now the medication that I NEED, and they were supposed to have, they haven't refilled.",nsubjpass,1
1341,1341,0.9984455514373248,0.0015544485626729449,0.467,0.5329999999999999,0.0,"**TL;DR** I have panic problems, the medications I've tried aren't great, and I want to give benzos a shot.",nsubj,1
1360,1360,0.9999882454051626,1.175459482387442e-05,0.0,0.58,0.42,What medication would be good?,nsubj,1
1368,1368,0.993530472409724,0.006469527590291542,0.262,0.682,0.055999999999999994,I've struggled with anxiety/OCD thoughts for a couple years and recently attempted to take medication (zoloft) for it prescribed by my doctor but after 3 days I was convinced and paranoid that the medication was making it worse or would make it worse if I kept taking it and I would fully lose control.,nsubj,1
1381,1381,0.99255355081301,0.007446449186976022,0.222,0.486,0.292,"It's not really direct pain, it's almost like a very irritating pressure that pain medication cannot help, like my mind is tying itself in knots.",nsubj,1
1382,1382,0.9999956703481382,4.3296518449638486e-06,0.503,0.49700000000000005,0.0,"Would medicine effect someone who is anxious about illness, disease, cancer, etc.",nsubj,1
1385,1385,0.999008735016636,0.0009912649833837988,0.209,0.7909999999999999,0.0,"It's not a stimulant, like many other ADD/ADHD medications are.",nsubj,1
1394,1394,0.9995627028424212,0.00043729715758218483,0.183,0.8170000000000001,0.0,"It's been three days since and I still have chest pains and mini attacks with shaking and hyperventilating despite medication, all the meds really do is sedate me to the point of where my brain is mush.",pobj_nsubj,1
1399,1399,0.9992029905908384,0.0007970094091483971,0.078,0.752,0.16899999999999998,i also get reinforcement from my bf to the same end: that antidepressants/anti-anxiety medications mess with your natural brain chemistry and it's probably better to find a different outlet.,nsubj,1
1412,1412,0.9999512960243996,4.8703975598996775e-05,0.0,1.0,0.0,Just meds on their own do not work.,nsubj,1
1413,1413,0.9992319848632568,0.0007680151367252267,0.087,0.7040000000000001,0.21,"I was just sort of feeling so comfortable in my ability to control my anxiety that I got too cocky and just let the meds do everything, and I expected them to do everything.",nsubj,1
1416,1416,0.9999031982302308,9.680176976102948e-05,0.0,1.0,0.0,"The meds I've tried haven't helped much, and I've been rather resistant to therapy.",nsubj,1
1425,1425,0.9891040488899372,0.010895951110081592,0.0,1.0,0.0,She also said highly unlikely the meds had a thing to do with it.,nsubj,1
1449,1449,0.9999588078222962,4.119217770443531e-05,0.196,0.693,0.111,"Or I could try to be treated for my anxiety, and risk wasting precious time that I don't have right now figuring out what medications work for me, etc.",nsubj,1
1456,1456,0.9964006035133108,0.003599396486696154,0.19,0.81,0.0,I have heard that many anxiety meds do not mix well with someone who has a history of seizures.,nsubj,1
1458,1458,0.9999914210586236,8.578941372975047e-06,0.22,0.78,0.0,But my acne makes me feel worse than any medicine ever could.....,nsubj,1
1469,1469,0.9989905446066608,0.0010094553933361478,0.0,1.0,0.0,"They tweaked my meds (upped my beta blocker, metaprolol, from 25 to 50, and added in daily baby aspirin), gave me a holter monitor, and sent me on my way.",nsubj,1
1477,1477,0.9997725616116993,0.00022743838830705502,0.28800000000000003,0.648,0.064,"I am pretty good with mental health, I have an anxiety myself, but my girlfriend has anxiety and depression, she recently had her anti-depressant meds doubles, since then she has been terrified about going to work, she can't get up in the mornings, even getting out of bed seems scary.",nsubj,1
1484,1484,0.999987002726188,1.2997273810941767e-05,0.368,0.632,0.0,Did the medicine permanently fuck me up?,nsubj,1
1491,1491,0.9999803563091128,1.9643690882055678e-05,0.0,1.0,0.0,This is an update on how my medication is working for me.,nsubj,1
1494,1494,0.999970722131985,2.9277867999727312e-05,0.195,0.805,0.0,"I know however how meds and alcohol don't mix well, but I was wondering: if I don't take my 5 mg Escitalopram on that particular morning, would there be no problem with me drinking alcohol later in the day?",nsubj,1
1510,1510,0.997665932914776,0.002334067085226673,0.184,0.816,0.0,"My mom thinks that medication is the only answer, I think its a waste of time, I stay on them mostly to keep her from worrying too much.",nsubj,1
1512,1512,0.9999296857328048,7.031426721385643e-05,0.451,0.423,0.127,"My meds make me irritable, crazy and irrational which try to help my anxiety.",nsubj,1
1518,1518,0.9918364725498108,0.00816352745018464,0.039,0.917,0.044000000000000004,"ADHD meds have not been working for me and I'm starting to wonder if treating anxiety first, which was a surprise diagnosis for me but actually makes a lot of sense, is the way to go.",nsubj,1
1527,1527,0.9999842218513344,1.577814865894566e-05,0.179,0.767,0.054000000000000006,I feel like my anxiety is progressively getting worse but I am not sure if it is from chronic marijuana use or if my medicine isn't right for me or what.,nsubj,1
1553,1553,0.9997987334428152,0.0002012665571948894,0.183,0.596,0.22,": I've heard anxiety meds usually make you gain weight--but if it makes me feel better, and helps me relax and not sleep so much anymore (I sleep to avoid the day and avoid feeling anxious), couldn't it actually help me to get up and lose weight?",nsubj,1
1558,1558,0.9991046001856824,0.0008953998143052672,0.149,0.755,0.096,"I tried medication (which kind of helped, but not really - crappy side effects, and never really solved the problem, and of course you have to keep amping up the doses to get the same effect over time).",nsubj,1
1569,1569,0.9998756974678285,0.0001243025321728479,0.0,0.6559999999999999,0.344,Does medication help the what ifs and the feeling small?,nsubj,1
1570,1570,0.999907109336778,9.289066322553264e-05,0.316,0.526,0.158,Does medication take away the choking feeling?,nsubj,1
1572,1572,0.9997725616116993,0.00022743838830705502,0.28800000000000003,0.648,0.064,"I am pretty good with mental health, I have an anxiety myself, but my girlfriend has anxiety and depression, she recently had her anti-depressant meds doubles, since then she has been terrified about going to work, she can't get up in the mornings, even getting out of bed seems scary.",nsubj,1
1576,1576,0.997936816135803,0.002063183864211537,0.0,1.0,0.0,"He seemed to scramble and gave me a list of meds, telling me that ""we can try anything"" since my current meds aren't working.",nsubj,1
1582,1582,0.999935655040104,6.434495987898072e-05,0.179,0.821,0.0,"And personally I've found medications just mess up my mindset even more, seeing as though drugs got me into this mess in the first place.",nsubj,1
1599,1599,0.9970802503227836,0.002919749677222145,0.15,0.7490000000000001,0.102,B. I've read that most mood medications have a negative impact on sex-drive/performance and can cause serious weight gain - have you found this to be the case for you?,nsubj,1
1617,1617,0.9986467169252756,0.001353283074720282,0.09699999999999999,0.903,0.0,There years later after medication and therapy I tried to go back and finish only to have a miscarriage in the bathrooms there and start the attacks all over again.,nsubj,1
1620,1620,0.9999715104959432,2.848950404593517e-05,0.293,0.7070000000000001,0.0,"My worry is, will medication make studying harder?",nsubj,1
1622,1622,0.9999611744311672,3.882556882845831e-05,0.0,1.0,0.0,What's your experience with medication been?,nsubj,1
1627,1627,0.9995180964239776,0.00048190357603680576,0.193,0.807,0.0,"* I *want* the medicine to work, badly, so I'm afraid of that clouding my judgement.",nsubj,1
1628,1628,0.9999626276973144,3.737230269035279e-05,0.14400000000000002,0.7190000000000001,0.13699999999999998,"Well, my meds are in at Costco...but I have no way to get there.",nsubj,1
1638,1638,0.9999517709692758,4.822903071114334e-05,0.251,0.6409999999999999,0.10800000000000001,The only anti-anxiety meds to help are benzos.. but those motherfuckers scare me.,nsubj,1
1645,1645,0.9926648245284756,0.007335175471531938,0.21600000000000003,0.708,0.075,"In the beginning, I felt great, but now with a sudden move I am starting to feel extremely anxious and helpless, and I don't feel my medication is doing a suitable job.",nsubj,1
1647,1647,0.9998215650651996,0.0001784349347979402,0.0,0.8759999999999999,0.124,"I've been to the doctor and they prescribed me with Buspar, but I have yet to take it because I feel like meds aren't the answer.",nsubj,1
1672,1672,0.9988352939937396,0.0011647060062634931,0.308,0.6920000000000001,0.0,"I see a therapist and take some SSRIs, but I spent my last therapy session crying my eyes out because i was so scared, and the medication doesn't really help when I'm this on edge.",nsubj,1
1673,1673,0.9999641734334636,3.582656652655263e-05,0.33299999999999996,0.667,0.0,My meds dont make me happy anymore.,nsubj,1
1676,1676,0.9999682784251148,3.172157486735245e-05,0.0,0.867,0.133,But I'm curious how this or similar medication has effected your day to day physical symptoms?,nsubj,1
1696,1696,0.9999717416094456,2.825839055823409e-05,0.0,1.0,0.0,Only medication I am on is birth control pills.,nsubj,1
1724,1724,0.9999708507634704,2.914923651197705e-05,0.146,0.662,0.192,Since then I have been worried that my meds are working as good.,nsubj,1
1725,1725,0.9998739828519452,0.00012601714805395933,0.179,0.821,0.0,I know the meds aren't going to completely take away anxiety.,nsubj,1
1748,1748,0.999942575778666,5.742422132432878e-05,0.0,0.789,0.21100000000000002,"I can’t help but think about a therapist sitting there listening to me and thinking “SNOOOOOOORE” while I blather on, and medicine is last resort for me, so I really want to start with some good reading.",nsubj,1
1753,1753,0.9999823426921612,1.765730783739617e-05,0.0,1.0,0.0,What anti-anxiety medication (long-term) are people put on usually?,nsubj,1
1759,1759,0.9999904790412354,9.520958760009288e-06,0.29100000000000004,0.7090000000000001,0.0,I hate that I can't tell if my medicine works or doesn't.,nsubj,1
1760,1760,0.9999907061958656,9.293804117552986e-06,0.353,0.47600000000000003,0.171,"The pain medicine makes me want to puke, no idea how people get addicted to those, haha.",nsubj,1
1782,1782,0.9881415167702412,0.011858483229778177,0.214,0.711,0.075,"2 weeks after the meds started to take place and finally i could go back to collage and start working out again(had a panic attack in the gym) and the anxiety calmed a little on me but the panics attack ofcourse hit everyday, i tried meditating and taking long walks but it didn't make any big improvements.",nsubj,1
1814,1814,0.9998241629890688,0.00017583701093918617,0.24100000000000002,0.569,0.191,"I'm worried, because my anxiety has actually been better and I'm hoping this isn't a sign that my meds are failing or something.",nsubj,1
1838,1838,0.9998550230685588,0.00014497693145411355,0.16,0.691,0.149,"The reason I said anxiety meds weren't for me is because I know once I can be relaxed in situations that make me uneasy, I won't be scared of them anymore, therefore controlling my anxiety.",nsubj,1
1864,1864,0.9999827082737028,1.729172628175015e-05,0.341,0.659,0.0,Can otc cold meds make derealization worse?,nsubj,1
1872,1872,0.9999691510358264,3.084896415562105e-05,0.0,1.0,0.0,"The medication never really helped at all, so these are things I experience at least weekly anyway.",nsubj,1
1874,1874,0.9998308272056688,0.00016917279433519244,0.065,0.878,0.057,"Some background

After just ""getting by"" with medications I started to do some research and found that the medications can actually cause the anxiety I was feeling.",nsubj,1
1880,1880,0.9999043622054666,9.56377945365857e-05,0.0,1.0,0.0,and I'm getting the thyroid medication adjusted.,nsubj,1
1883,1883,0.9996119069030284,0.0003880930969560864,0.0,0.873,0.127,"I feel like the medication isn't working, but I'm afraid to come off it.",nsubj,1
1887,1887,0.9998488796349352,0.00015112036508197534,0.253,0.747,0.0,"Anyhow, I feel the meds are killing my marriage and I don't know what to do.",nsubj,1
1889,1889,0.9997025081191904,0.00029749188081050005,0.068,0.932,0.0,I've been on prozac for 20 days now and haven't seen much improvement but I know it takes time for some medication to start fully working.,nsubj,1
1907,1907,0.9999244887620462,7.55112379455146e-05,0.158,0.642,0.2,I'm not sure how much the medication is really helping.,nsubj,1
1916,1916,0.9999513036328465,4.8696367165528276e-05,0.259,0.741,0.0,"My meds are useless, journaling doesnt help, excersize does nothing for me, I'm falling apart and I just don't know what to do.",nsubj,1
1939,1939,0.999982234757478,1.7765242520317044e-05,0.151,0.8490000000000001,0.0,After considering everything he suggested I might have General Anxiety Disorder but said medication wouldn't be his recommendation at this time.,nsubj,1
1943,1943,0.9972341495671856,0.002765850432802775,0.0,1.0,0.0,Or is this one of those drugs that must be taken everyday for the the medication to continue working?,nsubj,1
1950,1950,0.9999870383376374,1.2961662366620716e-05,0.204,0.7959999999999999,0.0,When this medication after 6 or so months failed to do anything I was put on Effexor.,nsubj,1
1957,1957,0.9997323579276508,0.0002676420723428043,0.243,0.757,0.0,"But now that I see that my depression isn't going anywhere but instead manifesting itself into other horrors, maybe medication is the right route to take.",nsubj,1
1963,1963,0.9903117410338989,0.009688258966087871,0.064,0.8959999999999999,0.040999999999999995,"I've done a lot of research and I thought I had social anxiety, driving anxiety, I thought I was a hypochondriac, I thought I had claustrophobia, I always think if I've drank the night before that I'm having alcohol withdrawals or I'm super unhealthy, that my ADHD medication is the reason for anxiousness (even though it's never ever been a problem in my 10 years of being on it)... but because I've thought ALL of those things and I relate to each and every single one of those and I know it's unlikely it's ALL of them, I've discovered that it might just be more specific than that.",nsubj,1
1971,1971,0.9996810309226428,0.000318969077368219,0.073,0.86,0.066,"I haven't had a full panic attack since I started taking benzos, but I still feel it and I am wondering if my medication should be changed; if I possibly have epilepsy.",nsubjpass,1
1980,1980,0.9663601894907392,0.03363981050927321,0.337,0.621,0.043,"On top of all my worries about air travel, I'm also worried that the medication won't work and I'll be stuck in a metal tube for over 4 hours each way uncontrollably weeping and shaking.",nsubj,1
2004,2004,0.9999309254863936,6.907451360006086e-05,0.0,0.789,0.21100000000000002,"** My doctor says I need a psychologist or counsellor to work through my issues, and that medicine only helps so much, which I agree.",nsubj,1
2009,2009,0.9999638728937232,3.612710628859038e-05,0.0,0.861,0.139,I googled and some websites said that certain vitamins can affect how the medicine works.,nsubj,1
2043,2043,0.9999954661900822,4.53380990164663e-06,0.0,1.0,0.0,Or is my medicine not working?,nsubj,1
2067,2067,0.9758328504228762,0.02416714957712079,0.0,1.0,0.0,Another checkup is scheduled in 3 weeks to see if the meds have also helped with the ADD since a lot of the symptoms overlap for both conditions.,nsubjpass,1
2072,2072,0.9999807622340512,1.9237765967880488e-05,0.0,0.863,0.13699999999999998,Is it okay if I ask you how your medication is working for you?,nsubj,1
2091,2091,0.9999652207744972,3.477922549792174e-05,0.20199999999999999,0.7979999999999999,0.0,"-----

-----

###Story

So far, every medication I've tried has been an utter failure.",nsubj,1
2092,2092,0.9997729626072002,0.00022703739278159179,0.0,1.0,0.0,"These medications are:

* Effexor
* Zoloft
* Xanax
* Prozac
* Lexapro

I took the maximum allowed dosage for each.",nsubj,1
2097,2097,0.9999938030253016,6.1969746877481456e-06,0.18,0.82,0.0,Is this the reason the medications have no effect on me?,nsubj,1
2102,2102,0.9952403486382658,0.004759651361725322,0.239,0.535,0.226,I'm not depressed and I'm getting the meds thanks for anxiety and being able to eat solid food because I'm scared of choking.,nsubj,1
2104,2104,0.9999809292876024,1.9070712413701364e-05,0.262,0.738,0.0,"Hah, worried my anxiety meds won't work, I just realized how cliche that is.",nsubj,1
2109,2109,0.999994930997238,5.069002780281887e-06,0.0,1.0,0.0,Any ideas what this medication would be?,nsubj,1
2113,2113,0.9997524981284596,0.00024750187155830536,0.371,0.629,0.0,"As a disclaimer, I don't want to say that medication is bad.",nsubj,1
2117,2117,0.9986405680932235,0.0013594319067938051,0.055,0.945,0.0,"I don't want to just take a pill and be done with it, I know that meds won't cure anything, they just make things manageable.",nsubj,1
2121,2121,0.999955551764311,4.444823567048523e-05,0.209,0.6940000000000001,0.09699999999999999,"If you have really bad anxiety, yes, sometimes medication is useful but medication doesn't change your thoughts which means you are more likely to relapse when you go off and you will have more trouble with withdrawal symptoms just because it will freak you out more.",nsubj,1
2123,2123,0.9998799072990464,0.00012009270094905264,0.0,0.804,0.196,"Some medications are ok to take with CBT, some aren't.",nsubj,1
2128,2128,0.9928251763666572,0.007174823633332421,0.39399999999999996,0.5710000000000001,0.034,"The medication used for the depression has a side effect when coming off of it...major depression and suicidal thought/tendencies, which has happened before and is a terrible feeling I wouldn't wish upon anyone else.",nsubj,1
2129,2129,0.9998170379938034,0.00018296200617912405,0.36,0.5479999999999999,0.092,"My other medication, allows me to function 'normally' by calming me and keeping me from experiencing severe anxiety and/or panic attacks.",nsubj,1
2161,2161,0.9994948332939094,0.0005051667060768177,0.264,0.736,0.0,My dad has since scheduled a psych evaluation so hopfully I can get properly medicated because the medicine i take now is always a tossup between crippling fear or crushing sadness.,nsubj,1
2162,2162,0.9997307353245896,0.00026926467541891217,0.0,0.67,0.33,"'Normal', happy, carefree, invigorated... until the medication wears off again.. Until my next prescribed doseage.",nsubj,1
2165,2165,0.9999214932462528,7.850675373465798e-05,0.157,0.7070000000000001,0.136,So medication is unfortunately necessary for the time being to calm my body down.,nsubj,1
2166,2166,0.9999857593783614,1.42406216298104e-05,0.0,0.674,0.326,Any suggestions on what I should do or what medications or therapies have worked best for you I would love to hear!,nsubj,1
2191,2191,0.9955112194298442,0.004488780570146696,0.138,0.716,0.146,"Hey reddit,

I felt like sharing my experience, because I postponed taking meds for very long due to fear of side effects and because psycho meds are ""evil"" in my eyes anyway.",nsubj,1
2193,2193,0.9999561739662296,4.382603377334383e-05,0.0,0.795,0.205,That's awesome though because in 2-3 weeks I should feel *even better* when the meds finally do their thing!,nsubj,1
2199,2199,0.9888459468459198,0.011154053154060636,0.079,0.9209999999999999,0.0,I was sat down with a PA who told me medication isn't the solution and that I need to be in group therapy 5 days a week 8 hours a day.,nsubj,1
2200,2200,0.998653495249766,0.0013465047502431266,0.06,0.94,0.0,"I know medication isn't the solution, I told her I wanted to use it temporarily to get my life back on track but she just repeated herself.",nsubj,1
2221,2221,0.9999829465619658,1.705343803098906e-05,0.0,1.0,0.0,And would you think medication is necessary for someone extremely high functioning?,nsubj,1
2225,2225,0.9994928393046644,0.0005071606953188231,0.18,0.82,0.0,Is this common for meds to suddenly stop working after a while?,nsubj,1
2226,2226,0.9999509816591916,4.901834081983622e-05,0.0,1.0,0.0,It took me about five years to get my medications correct.,nsubj,1
2238,2238,0.9995997949134904,0.00040020508649092547,0.135,0.865,0.0,"The medication has made things manageable day to day, but it really affected things sexually now.",nsubj,1
2241,2241,0.9998886432229902,0.00011135677701906116,0.187,0.7509999999999999,0.062,I talked to my psych about this and said I was ravenous all the time and was gaining weight but she said anxiety meds don't cause weight gain.,nsubj,1
2255,2255,0.9988347773541308,0.0011652226458744126,0.16699999999999998,0.833,0.0,Im afraid that I will be a hopeless boyfriend because the medication I take makes my sex preformance unpridictable.,nsubj,1
