,neg_prob,pos_prob,neg_vader,neu_vader,pos_vader,sentence
426,0.9979057907233149,0.0020942092766772476,0.0,0.758,0.242,I know medication isn't going to be a miracle cure but I'd like to know how long it normally takes to kick in to see how well it's working for me.
427,0.9981408665568172,0.001859133443169496,0.164,0.836,0.0,"My doctor told me that a side-effect of the medication is anxiety, and I expressed myself probably a little too hostile-- ""NO, I don't need MORE anxiety, THAT makes me feel anxious, just thinking about it!"
428,0.995698196481062,0.0043018035189338055,0.137,0.863,0.0,"This is the first time I've ever been on any kind of medication, and I suppose it's a bit worrisome."
429,0.9997308842384026,0.00026911576158642847,0.0,0.861,0.139,"Edit: just thought i'd add, I haven't been on any medication for probably a year now, and I've been a lot better."
430,0.999892830309607,0.00010716969040991777,0.0,1.0,0.0,I was going to a doctor and got some meds.
431,0.9986517104501288,0.0013482895498726903,0.103,0.829,0.068,"i go to bed panicking i won't wake up the next day..  and go throughout my day checking my temperature with my thermometer i carry with me if i'm feeling particularly anxious about my temp..  (probably should stop doing that)..  

i have smallish pains in my body..  

i wonder how much of it is my head making the issue out and how much are actual issues..  i know a decent bit can be caused by anxiety, but i don't know how much..

my nurse practitioner told me it was okay i take myself off the anti-depressants i was on if they were making it weird..  increased panic and weird dreams = taking myself off..  

only thing is that's the 3rd time i've ""failed"" a particular class of medication, and she's told me that she can't do anything for me if that's the case."
432,0.9998667249968906,0.00013327500312398084,0.0,1.0,0.0,Foundation of my therapy was samatha and vipassana meditation + cognitive behavioral therapy rather than taking meds.
433,0.9997534296811486,0.00024657031886685755,0.095,0.632,0.273,"Met an amazing girl, made new friends, went on some trips - made the mistake of going off my medicine."
434,0.9999775480502592,2.2451949753214533e-05,0.0,0.674,0.326,I am confident and hopeful that returning to my medication and potentially going back to therapy will help me get back into recovery.
435,0.9998546120216483,0.00014538797833335774,0.0,1.0,0.0,I see a therapist and psychiatrist every month and take my daily medications every morning.
436,0.9991216421725205,0.0008783578274619402,0.181,0.73,0.089,"I feel like i have the right tools through therapy and medication to stop the anxiety/panic but it just steam rolls over me.I try to read, go for a walk, talk to someone but it feels like if a panic attack wants to get me, its going to get me."
437,0.9986334856551446,0.0013665143448733192,0.0,1.0,0.0,I am wondering if anyone has any advice for temporary meds with a short half life and minimal withdrawals to take during a withdrawl from venlafaxine .
438,0.9981659681280506,0.0018340318719449761,0.119,0.82,0.06,"Well a few weeks ago,  the doctor decided to check my prostate, but instead of stick his fingers up my ass, he decided to stick a giant stick up there to take pictures of my prostate and bladder (Was not a pleasant experience) Well all came back normal and he said I have an overactive bladder and gave me this medicine to take for 2 months."
439,0.9142799538445775,0.08572004615542331,0.189,0.659,0.152,"I took an oxycodone to help ease it and am waiting for it to kick in fully, but I know it may not help the headache itself since different pain medication types work on different kinds of pain."
440,0.9995422541482756,0.00045774585172479086,0.0,0.794,0.206,"Therapy and medication are not to be overlooked, despite the unfair stigma that may surround them."
441,0.9995695365297218,0.0004304634702837385,0.052,0.948,0.0,"This past month he's been going to a psychologist and a psychiatrist because he decided that he wants to stop using medication (the Parotexine, which he has been using without any supervision from either a psychologist or a psychiatrist for about eight years now, I think)."
442,0.9999823124518691,1.768754814162093e-05,0.332,0.461,0.208,"I am on medication, so I no longer actively have outward panic attacks...but my fear inside is just as strong."
443,0.9998958890333703,0.00010411096664502301,0.0,1.0,0.0,I pushed through it as I am not on any medication.
444,0.9999744836076435,2.5516392367732788e-05,0.0,1.0,0.0,"Im not against taking medicine again, but im not exactly looking forward to it."
445,0.996657440209062,0.0033425597909542792,0.171,0.829,0.0,"I just started a low does of Lexapro (for anxiety, social anxiety and depression, may be adding more meds later but psych wants to do one at a time to see how i react) and I've had some side effects."
446,0.999899781220235,0.0001002187797610489,0.0,0.868,0.132,"I haven't been on anxiety medicine for a long time, probably for 5 years."
447,0.9999510795161957,4.892048380150178e-05,0.245,0.755,0.0,I think these are things that would make normal people freak out so I'm not sure if it's reason to get back on anxiety medicine.
448,0.9974849849656785,0.0025150150343012634,0.208,0.743,0.049,"If I do need to get back on medicine I worry about the doctors appointment, hospitals and doctor offices stress me out and it embarrasses me a lot to cry with a room full of people in a waiting room, does anyone have any suggestions to help me out with that?"
449,0.999267104822095,0.0007328951779157733,0.124,0.876,0.0,"TL;DR: If I have a reason to have a lot of anxiety, do I still need medicine?"
450,0.9992517655346331,0.0007482344653776259,0.0,0.894,0.106,"If I do need medicine, is there a way for me to not embarrass myself at the doctors office?"
451,0.9999411916498072,5.880835017775586e-05,0.231,0.769,0.0,I have trouble breathing and writing and I'm out of medication.
452,0.9999251101082582,7.488989173606138e-05,0.116,0.884,0.0,"Is it possible to try out anxiety medication without it ""rewiring"" your brain forever?"
453,0.995814331275985,0.004185668724007131,0.275,0.69,0.035,"But also wanted suggestions of some meds that don't cause weight gain due to struggling with that from Paxil and finally losing all of that, I want to avoid it coming back."
454,0.9996939447027191,0.000306055297299915,0.0,0.818,0.182,"She is on medication, something along the lines of Prozac, and seeing therapy but I don't think she is completely honest with the therapist."
455,0.9999603331755023,3.9666824489624586e-05,0.221,0.779,0.0,I used to be on medication for anxiety.
456,0.9999788493774966,2.1150622506730895e-05,0.178,0.667,0.156,I have anxiety disorder and I've taken my medicine but it doesn't seem to be helping.
457,0.9998775637468635,0.00012243625315195376,0.115,0.885,0.0,"When I first developed this anxiety I went to this doctor S. Doctor S prescribed me Ativan and a sleeping medication and sent me on my way, but he made me feel a little uncomfortable and I wanted to try someone new."
458,0.9997768830400979,0.0002231169599006782,0.0,0.865,0.135,"I am moving out of state soon, I don't have the time to be trying new medicines like this."
459,0.9995032674129222,0.0004967325870941016,0.0,0.916,0.084,"Last time I told him to please just let me start taking the prozac again, side effects were minimal compared to these new meds and it works."
460,0.9999165381522874,8.346184773033843e-05,0.0,0.649,0.351,I would like to get on a good medication now so I can think straight and sort this stuff out.
461,0.9993416005481363,0.000658399451866212,0.0,0.816,0.184,"This, by the way, is with the help of anti-depressants and anti-anxiety medication."
462,0.9999855565184801,1.4443481536516237e-05,0.199,0.801,0.0,"Now I don't like psych meds and I don't like homone replacement therapy, so I started doing some research on my own."
463,0.9999522048042286,4.7795195775144427e-05,0.092,0.679,0.229,I'm confused as to why I'm still feeling like this and why is it still so intense even when on meds.
464,0.9998564811574655,0.0001435188425282902,0.0,0.89,0.11,"Do you suggest asking to change my meds, or have I just not stuck with the citalopram long enough??"
465,0.9999548261157338,4.517388425030267e-05,0.114,0.743,0.143,I'm hesitant about changing meds and it would feel like I'm starting all over again.
466,0.9853370083197349,0.014662991680267265,0.0,1.0,0.0,"I'm on meds, I've tried a million different types, I've been through countless hours of therapy and was even inpatient once in the hospital for behavioral health."
467,0.9994082765581369,0.0005917234418603735,0.054,0.796,0.15,Last week I was told by my doctor that I could remove my daily dose of Buspar from my medications due to my new abilities to help control my anxiety.
468,0.9967859506601701,0.0032140493398338504,0.0,0.887,0.113,"I was on this medication for years, so to be finally able to come off of it was a huge accomplishment."
469,0.9997555771929081,0.00024442280710761067,0.15,0.85,0.0,"It's still a daily struggle, but coming off these meds is a big step!"
470,0.9998501166702276,0.00014988332975791058,0.0,1.0,0.0,"However, I have talked about my therapist about the possibility of going on medication."
471,0.9991032639914608,0.0008967360085410767,0.0,1.0,0.0,The option I was given was the kind of medication that you take regularly and the kind you take as needed.
472,0.9985012026536162,0.001498797346401144,0.0,0.84,0.16,that's just a guess off the top of my head) and am wondering if anyone would share their experiences with those types of medication.
473,0.9984963078416282,0.0015036921583756354,0.108,0.892,0.0,"I'm a student of psychology at university and, particularly lately, studies have shown that cognitive therapy can be equally, if not more, effective as medication."
474,0.9990386985508015,0.0009613014491871098,0.201,0.669,0.13,I've also tried 3 daily anxiety meds to no success as my body absolutely does not react well to changed in the serotonin levels.
475,0.9995606484220404,0.00043935157794741436,0.137,0.731,0.132,2) For the meds - has anyone found good daily medicine to control anxiety outside of the serotonin inhibitor family?
476,0.999994057657813,5.94234219106284e-06,0.109,0.705,0.186,I am wondering if anxiety medication could be useful for when I have these episodes.
477,0.9999884272663582,1.1572733643832244e-05,0.206,0.673,0.121,"Technically, if I asked him ""I think I have anxiety attacks and I think anti-anxiety meds would help"" that is drug-seeking."
478,0.9997974572364604,0.00020254276353273625,0.203,0.639,0.158,I feel the best thing for me is medication because I've been living my whole life with depression and social anxiety.
479,0.9999069228107338,9.30771892769973e-05,0.0,0.865,0.135,"Basically the point of this post is to get this stuff off my chest and also, how can I convince my mom to allow me to get medication?"
480,0.9991285444362239,0.0008714555637768032,0.0,0.857,0.143,She is on a lot of medication and not eaten will obviously make her feel like that.
481,0.9999752886732615,2.4711326729079025e-05,0.0,1.0,0.0,Did you try counseling + medication?
482,0.999934060206039,6.593979397553653e-05,0.175,0.663,0.163,I was able to go without any meds and didn't have many panic attacks.
483,0.9999178556547594,8.214434525814533e-05,0.046,0.869,0.085,"i have anxiety as it is (it's normally manageable so i don't take medication for it, and it really hasn't been bad at all for the past few months), so right now it's through the roof."
484,0.9988692243742119,0.0011307756258007236,0.162,0.838,0.0,"After 18 years of dealing with panic disorder I'm at the end of my rope so to speak, so I have found a place that focuses on functional medicine and getting to the root cause."
485,0.9999122781252877,8.772187472222241e-05,0.1,0.9,0.0,"I've posted about it again and again whenever I get anxious, and I've received feedback telling me to try medication."
486,0.9999636823054895,3.6317694503547606e-05,0.0,1.0,0.0,But I was just wondering about medication and how it actually worked.
487,0.9984010117106261,0.0015989882893881102,0.0,1.0,0.0,"But to give him and *myself* a piece of mind, I've been thinking about going to therapy and asking for medication."
488,0.9998565355677546,0.000143464432237053,0.0,1.0,0.0,Let me know your past experiences with the medication.
489,0.9999317474628433,6.825253717226686e-05,0.0,1.0,0.0,I have to get some kind of medicine or see some kind of therapist because my life is being controlled by this.
490,0.9998711346266566,0.0001288653733348886,0.0,0.899,0.101,"Found out in my first visit that three meds I am currently on (two psychotropics,  and one to treat my migraines) all leach away Vit B's."
491,0.9999565242576406,4.3475742366324805e-05,0.41,0.59,0.0,I don't want to boost my meds again.
492,0.9999956730969269,4.326903051330372e-06,0.0,0.634,0.366,Thank you if you guys know any medicine can help me.
493,0.999278717595549,0.0007212824044411937,0.0,1.0,0.0,What are your views of taking the medication Lexapro.
494,0.9999467581669137,5.3241833092832235e-05,0.466,0.534,0.0,I am on medication for depression and have emergency medication for panic attacks/severe mood swings.
495,0.9999672222190102,3.2777781002075994e-05,0.05,0.877,0.073,"Anxiety medication is the last resort (again), and I'm kind of hoping they end up putting me on some type of mild sedative, so I can at least do some type of work."
496,0.9980419905989808,0.001958009401024014,0.206,0.717,0.078,"I was beginning to feel like I'd gone in a kind of remission to my anxiety/panic attacks and depression, so I wanted to see how I'd do off medication."
497,0.999924673210686,7.532678931948177e-05,0.194,0.806,0.0,"I've quickly realized I wasn't any better, the medication just suppressed it..."
498,0.9999637349309477,3.6265069050857926e-05,0.0,1.0,0.0,"I need to know that if I'm going to be on medication forever, there's one out there that doesn't cause SO many long term side effects."
499,0.9996016021527395,0.00039839784725020623,0.0,0.939,0.061,"I am calling my mothers social worker tomorrow to organise daily care for her, a social worker for my dad is supposed to call me tomorrow morning
and i will also call his own doctor to see if there is some type of monitoring that can be done, or medication to settle him."
