,Unnamed: 0,neg_prob,pos_prob,neg_vader,neu_vader,pos_vader,sentence,dict,identifier
4019,4019,0.9999861726168512,1.3827383161988306e-05,0.0,1.0,0.0,I understand if I was hospitalized/prescribed medication I would include that.,['attr'],0
4023,4023,0.999478458410102,0.0005215415898978592,0.316,0.684,0.0,"I haven't told them for this exact reason and I heard them arguing of how ""everyone has stress"" and ""you're in school, you don't have real stress"" and ""your aunt had panic attacks and meds didn't work for her"".",['conj'],0
4027,4027,0.9998863078821256,0.00011369211786619324,0.073,0.927,0.0,I have been throwing the idea around of going to see my PCP about it but I think the only thing he can do is prescribe me anxiety meds.,['conj'],0
4032,4032,0.9999878198355868,1.2180164426904359e-05,0.0,1.0,0.0,Does anyone have experience (success or failures) with Zoloft or any other meds?,['conj'],0
4040,4040,0.9985853996427362,0.001414600357279694,0.061,0.9390000000000001,0.0,"It's been over 5 years since then, and after doing some soul searching and reading I've realized I need to deal with my anxiety with a therapist and possibly medication.",['conj'],0
4041,4041,0.992977293631334,0.007022706368666238,0.077,0.747,0.17600000000000002,"Obviously I can't tell you how much of it is the hypnotherapy, or the meds, but day to day life is so much easier now and I feel so much calmer, so I am able to tackle uncomfortable situations.",['conj'],0
4045,4045,0.9999888526963604,1.1147303622452457e-05,0.284,0.716,0.0,"I've tried therapy and medicine, but nothing helps.",['conj'],0
4047,4047,0.9988851658964192,0.0011148341035868029,0.049,0.865,0.085,"Trying to make a long story short, but I have been through everything possible when it comes to anxiety and have tried everything I could to help it (therapy, medication, meditation, reflexology, reike, homeopathy, chiropractic specialist, hypno therapy, breathing techniques etc).",['conj'],0
4057,4057,0.9997680731637908,0.0002319268361959556,0.094,0.81,0.096,I currently take the Levlen contraception pill (for four years and have never experienced problems with it) and no other prescription medication.,['conj'],0
4080,4080,0.9996716287981678,0.0003283712018414453,0.0,1.0,0.0,The medicine box has been filling up quite a lot these years.,['compound'],0
4094,4094,0.997570494098368,0.0024295059016214444,0.095,0.905,0.0,I missed a medication check with my psychiatrist and won't be able to get a refill (if he authorizes it) until later in the week.,['compound'],0
4096,4096,0.9628336589444509,0.0371663410555624,0.042,0.895,0.063,I've talked to my therapist about it and he is very so so about giving it to a 17 year old as he isn't sure of what would happen based on the fact that the medication is tested on adults and not teenagers or children.,['nsubjpass'],0
4098,4098,0.9999091627700044,9.083722999155188e-05,0.102,0.898,0.0,"My question was, is there any meds that have a similar effect on anxiety that alcohol does?",['attr'],0
4105,4105,0.9999430426612024,5.695733880147273e-05,0.0,0.877,0.12300000000000001,"I was on *way too many* medications, yadda yadda, nothing worked, I began smoking marijuana, nothing has helped me quite like marijuana has.",['attr'],0
4106,4106,0.9999289135495468,7.108645044381882e-05,0.0,1.0,0.0,"One medicine for each and every issue, it's incredible.",['npadvmod'],0
4116,4116,0.9995136988363988,0.00048630116359394434,0.0,1.0,0.0,"I have to scrape money just for an appt, which runs me around $50 for a medication visit.",['compound'],0
4121,4121,0.9999873078164896,1.2692183511411275e-05,0.0,1.0,0.0,Was this medication related or not?,['npadvmod'],0
4122,4122,0.9999563174363152,4.368256370089347e-05,0.0,0.763,0.237,"She up-ed her meds, but nothing seems to be helping.",['ROOT'],0
4125,4125,0.9997112688498844,0.0002887311501108656,0.23,0.69,0.08,"I don't know if it's the meds or just a coincidence, but I'm scared to up my dosage like I'm supposed to, because if it is the meds I don't want to make it worse.",['attr'],0
4126,4126,0.9996304017680526,0.0003695982319503434,0.0,1.0,0.0,I am going to a GP tomorrow to talk about medication options.,['compound'],0
4133,4133,0.9996737639360666,0.0003262360639230965,0.12,0.88,0.0,"Should I tough it out until it ""kicks in"" or get a medicine change?",['compound'],0
4135,4135,0.9995025463068654,0.0004974536931224671,0.0,0.902,0.098,"I have the atarax (primarily an allergy medicine, I've discovered) a fair chance, but it does nothing for me whatsoever but knock me out and cure my runny nose that leaks all winter.",['appos'],0
4137,4137,0.9999023113766282,9.768862338706444e-05,0.0,1.0,0.0,I'm a scientist and know/read/watch a lot about biology and medicine.,['conj'],0
4138,4138,0.9999947729399044,5.227060090941716e-06,0.086,0.8320000000000001,0.08199999999999999,"How many ""there is nothing wrong"" diagnoses can you get, despite real, physical, constant problems before your doctor (who prescribes your psych meds) thinks you have an issue?",['npadvmod'],0
4145,4145,0.9998120994668686,0.0001879005331237864,0.0,1.0,0.0,One thing I was told in CBT is meds target your emotions and physical symptoms but not the thoughts and behavior.,['amod'],0
4172,4172,0.9999412231059552,5.877689406290493e-05,0.355,0.645,0.0,"No medications, never diagnosed, etc.",['nsubjpass'],0
4182,4182,0.9996926784295314,0.0003073215704872636,0.0,0.9159999999999999,0.084,Well one day before she came over I decided enough was enough went to the medicine cabinet and took one of my dads 100mg viagra.,['compound'],0
4194,4194,0.9999815452645676,1.8454735422364418e-05,0.0,1.0,0.0,"I'm willing to try anything, even constant medicine at this point.",['advcl'],0
4201,4201,0.9979632866210744,0.002036713378918844,0.0,1.0,0.0,"I've lived with derealization and depersonalization for a few years now, since withdrawing from benzos and other psych meds.",['conj'],0
4208,4208,0.9995381154365396,0.00046188456345908535,0.14,0.86,0.0,"For myself, however, I don't like the idea of being on antidepressants or anti-anxiety medications.",['conj'],0
4222,4222,0.9946693747507064,0.005330625249275312,0.141,0.8590000000000001,0.0,"I'm unmedicated, because the thought of having to find a doctor, tell him my problems, and go through the trial-and-error process of getting on medication freaks me out.",['compound'],0
4223,4223,0.9999563901207078,4.360987928442898e-05,0.21100000000000002,0.789,0.0,"Can't take meds cause they make me have an anxiety attack, and if I had to take them night, forget that, I'd force myself to throw them back up.",['dep'],0
4226,4226,0.9999310030606526,6.899693935428109e-05,0.0,1.0,0.0,"Links about the drug:

[Wikipedia - Propranolol](http://en.wikipedia.org/wiki/Propranolol)

[Patient.co.uk - Propranolol](http://www.patient.co.uk/medicine/Propranolol.htm)",['appos'],0
4227,4227,0.9999739181238576,2.6081876124691737e-05,0.0,0.799,0.201,"Now I am sitting at home without any anxiety meds, and found out my favorite Doctor is on vacay for 2 weeks.",['advcl'],0
4244,4244,0.9957422288597448,0.004257771140242245,0.095,0.905,0.0,"Every doctor I've ever seen has refused to comment on the tics, aside from the occasional ""it might be a medication side effect.""",['compound'],0
4245,4245,0.9923076281116636,0.007692371888348932,0.071,0.841,0.087,"No sorts of therapy or medication are of any help whatsoever, aside from the benzos every now and then and only for a few minutes after they've kicked in.",['conj'],0
4246,4246,0.9996905593301592,0.00030944066982301424,0.0,1.0,0.0,She immediately suggested I meet with a psychologist who can prescribe me anti-anxiety medication.,['conj'],0
4252,4252,0.9999588442929844,4.115570700859588e-05,0.72,0.28,0.0,I self harm and abuse medication.,['conj'],0
4266,4266,0.9933959607414932,0.006604039258514581,0.03,0.97,0.0,"I called to leave a message and ask for a prescription refill, called to schedule an appointment, called back because I realized I needed to reschedule, and then just now answered a call from the medication nurse, who told me she's calling in my prescription now.",['compound'],0
4275,4275,0.9998370609995011,0.00016293900049883754,0.0,0.8390000000000001,0.161,"I haven't been takings meds like I should, and school has always been the biggest trigger.",['attr'],0
4282,4282,0.9998139223552226,0.00018607764475907186,0.0,0.5589999999999999,0.441,Can anyone recommend a solution or a medication I can take to calm myself down?,['conj'],0
4296,4296,0.9999625128081684,3.748719184571302e-05,0.0,0.8220000000000001,0.17800000000000002,"I spoke with my doctor and we agreed that I would cope just fine with ""as needed"" meds (Ativan, Klonopin and Xanax).",['appos'],0
4328,4328,0.931304629275606,0.0686953707243869,0.052000000000000005,0.948,0.0,"as she still hasn't really found a way to deal with her condition (no meds, and currently no therapy - she has tried a couple of therapists but they weren't the ""right fit"").",['appos'],0
4331,4331,0.9999573066417063,4.269335829542687e-05,0.0,0.925,0.075,I don't pay for treatment or medication and I've never had the same psychiatrist for more than 2 appointments.,['conj'],0
4338,4338,0.9999117894845864,8.821051540137529e-05,0.21100000000000002,0.687,0.10099999999999999,"), triggered at night thinking of tomorrow, thinking of lost friends, no meds, US

What I've done so far:
Googled anxiety, came out with webmd.com.",['nsubjpass'],0
4342,4342,0.9995890106190336,0.00041098938096681187,0.047,0.917,0.036000000000000004,"Looking forward to your thoughts and experience on this... 

Just wanted to add, I have tried:

Depression meds

Bipolar meds

ADD (just vyvanse)

CBT and/or DBT (works a little bit)

Exercise (it helps some, but only temporarily)

Vedic meditation (helps a little, but is very time consuming - 40 minutes a day)

Psychotherapy",['conj'],0
4349,4349,0.9999605018536986,3.9498146318048295e-05,0.0,1.0,0.0,"However, there are other meds out there.",['attr'],0
4354,4354,0.9999665527512192,3.344724877447587e-05,0.0,1.0,0.0,I've tried so many non-medicine routes and nothing has helped.,['compound'],0
4366,4366,0.999897481954668,0.00010251804532089784,0.084,0.7140000000000001,0.201,"I am on anti deppressants and anti-anxiety medication, but they didn't really seem to help last year.",['conj'],0
4374,4374,0.9997176432474201,0.00028235675258047796,0.0,1.0,0.0,"I always thought it would go away on it's own, so I didn't seek therapy or meds for years.",['conj'],0
4375,4375,0.998557214200606,0.001442785799405237,0.168,0.7170000000000001,0.115,I've been working with therapists and medication(s) over the past couple years to come to terms with my depression and anxiety with varying levels of success.,['conj'],0
4376,4376,0.9997692224761456,0.0002307775238340564,0.27699999999999997,0.723,0.0,(Bonus points for really bad fear of failure) I've got an appointment with my meds doc tomorrow morning and a therapist appt.,['compound'],0
4382,4382,0.9999673999801668,3.26000198518006e-05,0.0,1.0,0.0,I'm not meds because they don't work.,['attr'],0
4388,4388,0.99129742482431,0.0087025751756896,0.12,0.88,0.0,"I started Cipralex a few days ago and I've been getting massive headaches which are causing me even more anxiety because I didn't want to be on the medication in the first thing place...basically I'm not sure if I'm causing myself all this anxiety and thus these headaches because I keep telling myself that this medication causes headaches but after researching it,  it mihht be the actual medication that does cause headaches so I'm really confused in all...",['attr'],0
4413,4413,0.9999630066450648,3.699335493205119e-05,0.0,1.0,0.0,"I'm willing to try everything, except paying or medicine.",['conj'],0
4415,4415,0.9997637114659932,0.0002362885340184212,0.0,1.0,0.0,"breathing techniques, thoughts, meds...
Also, if you didn't have any of these and you stayed in the area when you were having the symptoms(panic attack) what happened to you?",['appos'],0
4420,4420,0.9994985694250056,0.0005014305750073836,0.102,0.898,0.0,"He was my medicine, and the sheer idea of losing that, and then it happening, sent me over to the realm of the unfeeling.",['attr'],0
4438,4438,0.9999577126898272,4.228731015914693e-05,0.0,1.0,0.0,What I'm more concerned about is how people manage to stay off medication long-term.,['amod'],0
4463,4463,0.9989715039893042,0.0010284960106790382,0.094,0.787,0.12,This round of exams in particular is pretty difficult because I *need* to pass everything to keep my provisional place in a graduate medicine program.,['compound'],0
4464,4464,0.9999787106292644,2.1289370715693426e-05,0.0,1.0,0.0,How do you guys keep your head about you when you don't know if you are really messing up or if it is just the meds?,['attr'],0
4479,4479,0.9999053485135704,9.465148641757813e-05,0.0,0.861,0.139,"There will be guest speakers for relevant topics: medication, relationships, fitness, mindfulness, finances, etc.",['conj'],0
4480,4480,0.9887209187874704,0.011279081212542936,0.0,0.7170000000000001,0.28300000000000003,"With support, 1:1 counseling, independent learning and (in the past) multiple medications, I am now confident and getting up in front of groups like a rock-star nurse!",['appos'],0
4483,4483,0.9997153923236516,0.00028460767633848287,0.065,0.8029999999999999,0.132,"and as a result.... just stay inside as long you can?~ What worked for you medication-wise because I feel like I've tried everything?~





(It might not help that I cancelled my last 3 appointments too.)",['npadvmod'],0
4484,4484,0.9978887426175128,0.002111257382494004,0.049,0.951,0.0,Uhhhh feel a little bit lightheaded... kinda woozy... maybe it was those meds I took... maybe it was my breakfast... maybe its low blood sugar... maybe its high blood pressure... maybe it's a stroke... maybe it's a heart attacks... my mind and heart start to race.,['attr'],0
4486,4486,0.9991869175398926,0.0008130824601230187,0.09,0.873,0.038,"i often worry (even post meds) that the chefs in a restaurant will mess with my food, or that certain food isnt cooked properly, or that some people are out to get me (not to an extreme but to a nuisance degree)",['parataxis'],0
4509,4509,0.9999578652760436,4.213472396035752e-05,0.0,0.7559999999999999,0.244,Not sure what's happening but I get soft easy now (I'm usually always rock hard) and I know it's the medicine.,['attr'],0
4510,4510,0.9999523248538108,4.76751462089766e-05,0.272,0.728,0.0,"Girlfriend stuff, work, medicine issues... and I don't 100% know what's actual stress and stress from the klonopin.",['compound'],0
4522,4522,0.9997630371078171,0.00023696289218091558,0.0,0.838,0.162,"Don't wait as long as I did to get help, whether it be therapy/medication/or something else.",['attr'],0
4526,4526,0.999859188205462,0.00014081179454980474,0.08800000000000001,0.912,0.0,"As ridiculous as it seems, I am very anti-medication (I was on some for five years, which helped form my opinion), so I haven't considered the option just yet.",['attr'],0
4531,4531,0.9895878335384942,0.010412166461511385,0.217,0.691,0.09300000000000001,"I just started treatment (meds + therapy) for depression and GAD, and a new major source of anxiety for me is that my health care providers don't believe me -- I worry that I'm just whiny, it's just first world problems, I'm somehow faking it, I'm not sick enough, it's all in my head, etc.",['amod'],0
4542,4542,0.9973395915241102,0.0026604084758732327,0.126,0.8740000000000001,0.0,"The CBT I feel helped but I finished that at the end of October and I feel my anxiety may just be returning to normal again due to life stress (baby on the way, work, etc....)

I guess my questions are: what medications are usually prescribed?",['nsubjpass'],0
4558,4558,0.9998810235618892,0.00011897643811585433,0.107,0.893,0.0,"Is this a ""hey powertape33 grow some balls and nut up"" kind of thing, a ""you're just a little insecure, go exercise"" kind of thing,  or is this a ""hey, you should see a therapist or consider anxiety medication"" kind of thing?",['ccomp'],0
4560,4560,0.9999940223694744,5.9776305349708355e-06,0.0,0.7140000000000001,0.28600000000000003,Any tips or maybe some herb or relaxing medication?,['conj'],0
4561,4561,0.9996400476270508,0.0003599523729511697,0.0,0.838,0.162,"I know all the ways that should fix it - exposure, CBT, meds - and in some ways, I have improved.",['dep'],0
4565,4565,0.9999080412765337,9.195872347381971e-05,0.0,0.816,0.184,For others who have OCD - are there any meds that help with it?,['attr'],0
4573,4573,0.999505621771048,0.0004943782289556971,0.0,0.882,0.11800000000000001,"I still take Venlafaxine (pls google it up, it's too complex to explain it here for me) and I almost got none side-effects, it's a very good medication for me(!).",['attr'],0
4587,4587,0.9999684789845328,3.1521015481003136e-05,0.0,1.0,0.0,This experience and switching meds made me realise how much they affect me.,['conj'],0
4588,4588,0.990349591749334,0.009650408250673143,0.081,0.7190000000000001,0.201,"I feel like I view the world differently, some of my behaviour is very un-me and the carefree feeling the meds give me have gotten me into trouble a few times.",['conj'],0
4595,4595,0.9999680359173404,3.196408265254505e-05,0.0,0.7979999999999999,0.20199999999999999,But he did say he was exited about getting to know meds free me.,['ccomp'],0
4601,4601,0.9999750896407986,2.491035921107578e-05,0.0,1.0,0.0,medicine = take as directed.,['compound'],0
4604,4604,0.9999055532312232,9.444676879003116e-05,0.0,0.759,0.24100000000000002,"Actually, the not taking my medication part wasn't that bad.",['compound'],0
4610,4610,0.9993309447114336,0.0006690552885551343,0.1,0.8540000000000001,0.046,"My mom was prescribed anti-anxiety meds herself just a few months ago, but I don't want my parents to pay for a therapist we can't afford if it's not a serious issue.",['oprd'],0
4620,4620,0.9957146235617528,0.004285376438250754,0.0,0.8290000000000001,0.171,"Friends, it took me 6 years of therapy and medicine experimentation to find the most fitting treatment.",['compound'],0
4631,4631,0.9968394896570812,0.003160510342905143,0.067,0.9329999999999999,0.0,"I can't think of anything else I was exposed to that is different than normal, so it's most likely the meds.",['attr'],0
4636,4636,0.9999805342081798,1.9465791836288566e-05,0.163,0.706,0.132,I'm wondering if this medication is supposed to work by giving depressed and anxious people delusions that everything is going to be okay when it is not.,['nsubjpass'],0
4642,4642,0.999980302011074,1.969798890746539e-05,0.0,1.0,0.0,-Why am I not on meds?,['attr'],0
4648,4648,0.9999876566960992,1.234330388524062e-05,0.0,1.0,0.0,"Are there medications you take only when you need them, or are they usually an every day thing?",['attr'],0
4651,4651,0.9995759065033044,0.0004240934967067533,0.301,0.6990000000000001,0.0,"I've never tried any antidepressants or anxiety medications before, so I'm not really sure what to expect and I'm kind of terrified.",['conj'],0
4654,4654,0.9965248748841056,0.003475125115892615,0.24,0.521,0.24,So I know the meds route can be scary for some for many reasons but I think it's a great tool to help people with anxiety and depression.,['compound'],0
4663,4663,0.9998637197269136,0.00013628027307547536,0.172,0.645,0.183,"After shakily explaining my symptoms to my GP, he determined that I was suffering from acid reflux disease and prescribed medication to help.",['conj'],0
4664,4664,0.9999704743349188,2.9525665094445392e-05,0.0,1.0,0.0,I've been through therapy/meds/partial hospitalization etc.,['amod'],0
4669,4669,0.9985864902271976,0.0014135097728144985,0.24600000000000002,0.6990000000000001,0.054000000000000006,"I've mentioned this to my Psych and Therapist, but I don't want to play ""medication bingo' again with all the side effects it entails, and my therapist, while well meaning is no match for the anxiety and pessimism in my head.",['compound'],0
4676,4676,0.9999875042305116,1.2495769498778063e-05,0.175,0.825,0.0,Has treating your anxiety (meds/therapy) helped this at all?,['appos'],0
4688,4688,0.9999449401602084,5.505983979358204e-05,0.0,1.0,0.0,"Therapy, medication, hospitalization.",['conj'],0
4690,4690,0.9993240699686377,0.0006759300313584072,0.0,1.0,0.0,"I don't remember what the medicine was called, but I didn't have to take it daily - it was a situational type thing.",['nsubjpass'],0
4695,4695,0.9999849608708404,1.5039129148335236e-05,0.078,0.83,0.092,"-sigh- any help would be appreciated, any medications you take that seem to help...(my doctor recently prescribed me effexor xr but my anxiety is so situational that I don't want to be taking something every day that changes my brain chemistry).",['relcl'],0
4698,4698,0.999922816134592,7.718386541366923e-05,0.26,0.74,0.0,I have tried so many strategies and meds and it feels so hopeless.,['conj'],0
4704,4704,0.9999919769863688,8.023013625812027e-06,0.306,0.6940000000000001,0.0,Anyone have problems with dehydration causing anxiety while on (or off) meds?,['appos'],0
4710,4710,0.99945822950262,0.0005417704973954079,0.285,0.635,0.08,"A few notes that may or may not be helpful:

-I have depression but it is pretty much under control and I have been off meds for about a year now

-my mother suffers from anxiety and depression 

-I recently started smoking marijuana.",['attr'],0
4711,4711,0.9999835168957432,1.648310425730926e-05,0.11599999999999999,0.884,0.0,I'm not sure if it's my medication (Lexapro) or if I'm just having an off day.,['attr'],0
4713,4713,0.9823450632226934,0.017654936777287925,0.0,1.0,0.0,"I have some familiarity with the subject, as my SO has gone through a long process of taming her own beast (GAD) with a combination of therapy and meds.",['conj'],0
4716,4716,0.99997255371789,2.7446282099694832e-05,0.0,1.0,0.0,"""...except for some reason the deflector shields(meds) aren't working.",['appos'],0
4719,4719,0.9999348318993354,6.516810065784351e-05,0.26,0.564,0.17600000000000002,The only option I can see left now is anti-anxiety medication but I can't see them being strong enough to prevent my panic attacks.,['attr'],0
4724,4724,0.9999900345574624,9.965442526497743e-06,0.105,0.773,0.12300000000000001,I guess I am just lost and I am looking for some advice on therapy and medication or just some comforting words.,['conj'],0
4743,4743,0.9976042004638452,0.002395799536169836,0.0,1.0,0.0,Since it takes a long time apparently to get an appointment to see one (almost three months apparently) I opted to have my doctor prescribe me medication (50mg of Zoloft).,['ccomp'],0
4749,4749,0.9996876395193016,0.00031236048068509294,0.0,1.0,0.0,"Whether it be a medicine, stuffed animal, person, etc.",['attr'],0
4760,4760,0.9968226846113458,0.0031773153886635232,0.266,0.657,0.077,"However, I hadn't had good luck at finding a psychiatrist who is good at both the therapy side as well as the medication side.",['compound'],0
4761,4761,0.9999660980188794,3.3901981110154246e-05,0.0,1.0,0.0,"However, they specifically mention they would make medication recommendations.",['compound'],0
4762,4762,0.9999248759032252,7.512409675630243e-05,0.0,1.0,0.0,"(Also, I'm not an any medication except Xanax, which I take as needed.)",['attr'],0
4767,4767,0.9997174981773379,0.000282501822656531,0.0,1.0,0.0,Maybe for some of you therapy or medication hasnt been working and isnt the answer.,['conj'],0
4787,4787,0.999942347728486,5.765227150311324e-05,0.12300000000000001,0.877,0.0,"So, this is my first post on /r/anxiety, I was up until 4am last night jumping out of my skin, worrying I was going to jump out of my house or die in my sleep from halving my anti-anxiety meds that I've been on for (no joke) FIFTEEN years.",['ROOT'],0
4795,4795,0.9999352611105212,6.473888947138888e-05,0.363,0.5760000000000001,0.061,"My hugest stressors right now are: Work, anxiety, discomfort (generally speaking), money, medication, sleep (or lack thereof), and it all originates from my god damn head.",['conj'],0
4804,4804,0.9999243824433656,7.561755664340721e-05,0.0,1.0,0.0,Is it the smoking causing this or the medication?,['conj'],0
4808,4808,0.999969247151056,3.0752848953511195e-05,0.0,1.0,0.0,"(no medications, prefferably).",['ROOT'],0
4818,4818,0.999981857029716,1.8142970292973155e-05,0.0,0.615,0.385,"Original post here: http://www.reddit.com/r/Anxiety/comments/1wu2d9/meds_klonopin_has_turned_my_anxiety_around/

I wish I had never started on benzos.",['appos'],0
4840,4840,0.9999276954186992,7.230458129570237e-05,0.133,0.765,0.102,"This is the medicine I took right here FYI: 

http://www.drugs.com/sfx/azithromycin-side-effects.html

&gt; Psychiatric side effects have included aggressive reaction and anxiety during postmarketing experience.",['attr'],0
4853,4853,0.9998568390121084,0.00014316098789087257,0.272,0.728,0.0,"Went back to school, needed meds again but now properly dosed towards anxiety, problem went away again.",['npadvmod'],0
4867,4867,0.9989629046405962,0.0010370953594193463,0.0,1.0,0.0,I have a lifetime history of mental disorders and medication starting with PTSD and Zoloft at 16.,['conj'],0
4885,4885,0.999942498955116,5.750104488475739e-05,0.0,1.0,0.0,"Current meds I'm on are Venlafaxine (225mg/day), Quetiapine (300mg/day) and Gabapentin (900mg/day).",['npadvmod'],0
4892,4892,0.9994707144123398,0.0005292855876688277,0.0,1.0,0.0,"Last week, we took a medication math test.",['compound'],0
4919,4919,0.9995681917496946,0.00043180825030902356,0.039,0.9179999999999999,0.043,"An important thing to notice is that **the sample you're** (partially) **basing your medication ideas off of is biased** (being /r/anxiety and /r/depression or related subreddits):

* People are more likely to post about something if it has affected them negatively.",['compound'],0
4938,4938,0.9989977049343376,0.0010022950656523317,0.0,0.88,0.12,"I'm going to start seeing a new therapist and want to talk to him/her about medication options, and I want to be informed.",['compound'],0
