,neg_prob,pos_prob,neg_vader,neu_vader,pos_vader,sentence
280,0.9980251121761855,0.001974887823812811,0.106,0.75,0.144,"I developed a drinking problem after my boyfriend lied and left me for slutsherface and didn't see a way out, and I had refused medication all my life saying there was ""another way"" but needed a helping hand other than my therapist and took the pill route."
281,0.9998123556792349,0.00018764432076227226,0.136,0.864,0.0,"I had no sex drive, before and during the meds after starting birth control in 2008."
282,0.9999540912010275,4.590879898632359e-05,0.279,0.721,0.0,I've had panic attacks my whole life and was treated with medication from 6th grade through early college.
283,0.9999017941106528,9.82058893531376e-05,0.0,1.0,0.0,Should I go back on the medication?
284,0.9958748008701311,0.004125199129862945,0.0,1.0,0.0,I thought it would of came back as the meds kicked in but still nothing.
285,0.9999333252367809,6.667476323656528e-05,0.098,0.727,0.175,"this might be a dumb question, but is there a definitive moment when i can truly know the meds are working ?"
286,0.9999166567219515,8.334327803882213e-05,0.168,0.832,0.0,ive never taken meds before so im not sure what to expect
287,0.999992458810047,7.5411899548120535e-06,0.371,0.629,0.0,I KNOW they suck and I KNOW how bad they feel to go through but fuck that we are all gonna get through this together without meds or doctor bullshit.
288,0.9993323670396216,0.0006676329603776388,0.0,1.0,0.0,I'm currently on Lexapro (Cipralex in Canada) and I'm worreid about the sexual side effects of this medication.
289,0.9996874569976699,0.0003125430023448774,0.0,1.0,0.0,I'm on my first week of taking medication and i'm already starting to notice these effects.
290,0.9999451622512175,5.483774879509029e-05,0.06,0.94,0.0,Last year I decided that I didn't want to rely on medication for this anymore and prompted instead for finding other ways.
291,0.9998416088577956,0.0001583911421979827,0.241,0.759,0.0,I have been off Paxil for my anxiety and depression for a few days because my psychiatrist office and my insurance company screwed me out of coverage and no longer taking appointments and I ran out of meds a few days ago.
292,0.9999694542195303,3.054578048839775e-05,0.0,1.0,0.0,"EDIT: Also, I've never been to therapy, or been on any medication."
293,0.9978717710849764,0.002128228915012739,0.0,1.0,0.0,"The patient must go through a series of Cognitive therapy practices and medication must be supplemented to overcome these harmful thoughts."""
294,0.9998503850798369,0.00014961492017974691,0.257,0.641,0.103,"I don't know how to talk to my doctor about pain medication, I've been taking tylenol extra strength and it only barely numbs the pain."
295,0.9999644313432811,3.556865672778014e-05,0.0,0.93,0.07,"I haven't been on any medication because I can't afford to go back to my doctor, and I really can't miss as much work as I have been."
296,0.9999427654452439,5.723455474340337e-05,0.0,0.787,0.213,Or is it okay to try this medicine?
297,0.9999831187907818,1.6881209198113178e-05,0.0,1.0,0.0,"&gt; 
&gt; I've been on countless medications and few things have helped."
298,0.9999848985149616,1.51014850270419e-05,0.0,0.789,0.211,"&gt; 
&gt; I'm on medications now and they barely help."
299,0.9999796012995041,2.039870050731275e-05,0.0,0.862,0.138,My family and I determined it was caused by this medicine I had been taking for my acne.
300,0.9999774305985588,2.2569401444463182e-05,0.154,0.738,0.108,I have been off the medicine for 3 days but yesterday the anxious feeling came back.
301,0.9848411361865721,0.01515886381342275,0.0,1.0,0.0,Will it take a little time for the medicine to get out of my system before I feel normal all the time again?
302,0.9999618840687502,3.8115931229784836e-05,0.347,0.653,0.0,I'm so scared to tweak my meds.
303,0.9996340013179053,0.0003659986820967204,0.0,1.0,0.0,This mostly went away after I started my meds until about a month ago.
304,0.9999782369193511,2.176308064529785e-05,0.0,1.0,0.0,Perhaps talk to my psychiatrist and switch meds?
305,0.9997279803179587,0.00027201968205497676,0.0,1.0,0.0,I've been off my meds for a really long time- almost two years.
306,0.999379506014851,0.0006204939851469402,0.0,0.87,0.13,"During those two years, I was out of school and didn't really need the medications to help me through it."
307,0.9999340978802295,6.590211978866085e-05,0.0,0.781,0.219,"Well, I decided to go back to school this summer, and realized that I would need meds as well."
308,0.9999788612603464,2.1138739648225185e-05,0.204,0.796,0.0,"I was worried that my doctor would judge me for quitting them, and wouldn't want to give me any more meds because I would stop taking them."
309,0.9999052900449668,9.470995504157423e-05,0.0,1.0,0.0,"She helped me get the medications that I do need, the ones I feel actually work for me."
310,0.9996838917719761,0.00031610822801374667,0.0,1.0,0.0,I started a new medication and my appetite has completely gone away.
311,0.9954452469967973,0.004554753003209627,0.085,0.808,0.108,I know this can be a side effect of the medication and I'm hoping it will even out in a few days but... should I be worried?
312,0.9999770027388931,2.2997261113947918e-05,0.0,1.0,0.0,I'm on meds (effexor) and have seen two separate psychologists.
313,0.9999130963945542,8.690360544879389e-05,0.447,0.483,0.07,I have nausea meds incase I do feel nauseous but I'm tired of constantly feeling sick and worried.
314,0.9990711931300317,0.0009288068699594945,0.124,0.793,0.083,I haven't had attacks like this since 2.5 years ago before I started taking medication and the only way I had of dealing with it then was cutting myself.
315,0.9998999984220639,0.0001000015779539614,0.0,1.0,0.0,Is it even possible to do without meds?
316,0.9996591910705291,0.00034080892945664414,0.187,0.813,0.0,"I have been on meds for just over 6 months now and have been through cbt therapy, I would say i have a clearer direction in my life and a lot less depressed then before, but my anxiety is still a major problem."
317,0.9989769349560443,0.0010230650439703418,0.0,1.0,0.0,"Due to a mix up at the clinic pharmacy, my medication wasn't filled and now i'm out."
318,0.9997798952646955,0.0002201047352977509,0.053,0.947,0.0,I need that medication for my blood sugar and my anxiety meds are almost up too but now I'm afraid to go back to the clinic.
319,0.9999686589184078,3.1341081572615914e-05,0.0,1.0,0.0,"Usual questions at first, what medications do you take etc."
320,0.9995532503057252,0.00044674969427982474,0.132,0.868,0.0,I have been to the pharmacy many times to pick up medication and I never end up taking it because I am scared.
321,0.9997166749482653,0.0002833250517337959,0.198,0.802,0.0,"I have read all the negative stuff, which is why I haven't started taking this medication for a while."
322,0.9999674830363965,3.25169636065263e-05,0.0,0.545,0.455,"Please help
Im not currently on any medication"
323,0.9997033214524375,0.0002966785475625175,0.078,0.922,0.0,"I was able to deal with it when I was on anxiety meds, but I'm not on them anymore."
324,0.9998895321962541,0.00011046780373331238,0.0,0.814,0.186,I have GAD and it was pretty out of control until mid-July when I went on meds.
325,0.9998771295383184,0.00012287046166194345,0.115,0.885,0.0,Are there things the regularly happen because of the use of the medicine that I should be worried about?
326,0.9997968220569221,0.00020317794309493144,0.056,0.893,0.051,"I have taken god knows how many prescription meds (Paxil and Wellbutrin, currently) and struggled through 10 years of therapy, including DBT, but I'm not doing so hot right now."
327,0.999936453622036,6.35463779775712e-05,0.0,1.0,0.0,I cant remember putting the medication in or actually sitting there doing it.
328,0.999876771692999,0.0001232283070064458,0.0,1.0,0.0,He is really old and just started a new medicine so I don't know if it was making him feel loopy or what.
329,0.9999693550269321,3.064497307951872e-05,0.0,0.917,0.083,"The only time I go outside is to take the dog out (and chain smoke while we're out there) 

I feel like I'm unravelling everything I accomplished this year, and I know I should see my doctor, and talk about meds, but I'm too afraid/ashamed to even call."
330,0.9999614431117534,3.8556888232988146e-05,0.0,0.921,0.079,I'm close to being off as my doctor and I thought it worth an attempt to get off medicine and see how that goes.
331,0.9999880493188062,1.1950681199832333e-05,0.254,0.746,0.0,I was originally on medicine for anxiety.
332,0.9994117443020265,0.0005882556979737177,0.0,1.0,0.0,I attribute this to the phasing down of the SSRI medicine.
333,0.9999794251418881,2.0574858096916365e-05,0.0,0.909,0.091,I think I need to go back onto medicine and I want to switch to something different.
334,0.9986291174940026,0.0013708825059900536,0.044,0.858,0.098,"I have no idea what options are available to me, I've tried for a couple years to get a grasp on this mentally, but that hasn't worked so in terms of help I'm looking to medication."
335,0.9977281453476972,0.0022718546522935037,0.111,0.786,0.103,"And I'm not sure if this is a situation that deems worthy for anxiety meds, but I'd prefer not to have to take some medication that will numb me and not make me feel anything, although I'm open to anything that will help with any of these symptoms."
336,0.9999657953448013,3.4204655214773584e-05,0.122,0.718,0.16,"and im no good with keeping up with meds long term, so SSRIs are out."
337,0.9999729434949275,2.7056505084118294e-05,0.0,1.0,0.0,I'm currently unmedicated but I'm seeking medication in July (the earliest they could get me in).
338,0.9999644671407195,3.5532859261311664e-05,0.306,0.694,0.0,I will no longer judge these medications.
339,0.9991474931789338,0.0008525068210476676,0.0,0.837,0.163,"while therapy helped a little, i am starting to realize that it would be great to get a proper evaluation and try out some meds."
340,0.9998289661817059,0.0001710338183112201,0.097,0.743,0.16,"What medications, or combinations of medications, have you personally found helpful for managing your anxiety?"
341,0.999841462653124,0.0001585373468947162,0.127,0.653,0.22,"I realize all meds are ""your mileage may vary"" but it's still nice to hear from people who have had success on theirs since often you read horror stories online."
342,0.9996674256963409,0.00033257430364492776,0.276,0.599,0.124,I'm on two anti anxiety/ depression medications and they seem to help for the most part.
343,0.9957169021414957,0.004283097858487289,0.152,0.848,0.0,My mother has diagnosed anxiety and takes medication for it; but the level of anxiety appears to lessen with each generation.
344,0.9999547062323519,4.529376764180548e-05,0.0,1.0,0.0,I know that meds effect everyone differently.
345,0.9992747235260575,0.0007252764739309066,0.0,1.0,0.0,"I'm just afraid of becoming dependent on these meds, especially Xanax as I hear it can be addictive."
346,0.9999821536427657,1.7846357249714683e-05,0.0,0.847,0.153,I finally got on meds to try and help with my adhd so I can maybe finish college.
347,0.9990625311826035,0.0009374688173867232,0.235,0.702,0.063,"I have not seen a Dr. Id really like to avoid medication if possible, however with the worse it gets I'm starting to not care about what they give me as long as they can make it stop."
348,0.9998410717851687,0.00015892821484554892,0.189,0.686,0.125,"Like I lost my computer charger cable, I freaked out, and then my mom told me that if I didn't stop acting like a two year old then I would have to take medications."
349,0.9994301654054736,0.0005698345945159147,0.115,0.845,0.041,But I don't want to take medications and I don't want to see a therapist and she doesn't want to pay for it or have to drive me to a therapist so I'm not going.
350,0.9993987746265812,0.0006012253734230207,0.0,1.0,0.0,I'm on day 4 and I haven't felt exactly the same any of the 4 days I've been taking the medicine.
351,0.9831509192858761,0.01684908071411233,0.0,0.736,0.264,I've read it can take up to 2 weeks to start feeling a more positive effect of the medicine.
352,0.9951248871346349,0.004875112865348948,0.283,0.648,0.069,Or a psychiatrist who concludes medicine isn't a good fit because I'm fine most of the time and to just suck it up.
353,0.9993545387656646,0.0006454612343418231,0.156,0.796,0.048,I have had anxiety disorder for roughly three years and have managed to get it under control (with very little use of medication) but every time someone starts talking about it I start feeling anxious.
354,0.9916028159514703,0.008397184048517485,0.0,0.955,0.045,"So far I've tried/had checked:

- Careful attention to diet (Low glycemic index foods, lots of vegetables)

- Heavy cardio exercise 3-5 times a week (3km runs and soccer)

- General blood tests (Vitamin and mineral levels, e.g - iron)

- Thyroid via blood test

- Testosterone levels via blood test

- A sleep study, to rule out sleep apnoea

- 3 years of seeing a psychologist (ACT I think, some CBT)

----

Yet to check:

- Adrenal function tests (Maybe that was already tested as part of blood tests, to be confirmed)

Anything else I should check before accepting the side effects I might get from medication?"
355,0.9999265939845203,7.34060154683432e-05,0.0,1.0,0.0,It's been well-controlled for 15 years with medication.
356,0.9999357962601624,6.420373983788523e-05,0.0,1.0,0.0,Did you change your meds?
357,0.99990397355627,9.602644371475484e-05,0.087,0.913,0.0,"He also said that he would give me an anti sickness medication before I came round, and that it wouldn't make me feel woozy or sleepy."
358,0.9999756470565817,2.435294341452105e-05,0.0,1.0,0.0,I'm not on any medications at all.
359,0.9983190163913126,0.0016809836086974508,0.2,0.8,0.0,I had a bad experience with benzodiazepines and it's put me off of the whole medication thing.
360,0.9999782954152691,2.1704584720298348e-05,0.183,0.704,0.113,"On our very first date, he explained to me that he is bipolar and has pretty bad anxiety issues (on medication for both)."
361,0.9997390038009046,0.00026099619908833544,0.0,0.785,0.215,"Girlfriend is leaving me because she can't ""be there for me"" through this positive process of change and growth I'm going through due to therapy and medication."
362,0.9999903115329439,9.688467067498978e-06,0.474,0.526,0.0,I have had anxiety attacks daily which are bad enough to warrant meds.
363,0.9997390618391722,0.00026093816084008566,0.308,0.594,0.098,However the meds she likes to give me when I go through periods of extreme anxiety or depression just make me stupid.
364,0.9955392353926314,0.004460764607358383,0.106,0.824,0.07,"I finally found a medication and therapist  that works for me (the combo was a complete game changer), my life is 10 fold better and I know many of the triggers that can kick in this anxiety so I can avoid them."
365,0.9998705920329277,0.0001294079670665351,0.09,0.635,0.275,"TL;DR - need over the counter medication to help relieve my public speaking anxiety, any suggestions?"
366,0.9858023437186659,0.014197656281343743,0.0,1.0,0.0,Anyways I wanted to ask could it be a side effect of the medicine?
367,0.99992775065053,7.224934946451129e-05,0.145,0.855,0.0,"i've seen doctors, all who refused to refer me to mental health specialists and reccomended me antidepressants/anti anxiety meds which i am vehemently opposed to taking."
368,0.9999789642403091,2.103575967793471e-05,0.213,0.787,0.0,I have anxiety but I can't take meds.
369,0.9997319443813565,0.00026805561865838847,0.234,0.766,0.0,"I barely made it 2 weeks, had a 4 day long panic attack (while on medication) that made me book and early flight and come back home."
370,0.9999669964206069,3.3003579405625606e-05,0.38,0.173,0.448,No medication please!
371,0.9997322838274294,0.0002677161725619582,0.0,0.877,0.123,I've tried to tell him he needs to go to therapy and get medication but he refuses to even entertain the idea.
372,0.9999753663761355,2.4633623868342996e-05,0.0,0.73,0.27,I'm 30 and have been off meds and happy for years.
373,0.9998519062860378,0.0001480937139619498,0.109,0.841,0.05,"Well a couple weeks ago, my endocrinologist tested my TSH levels and they were low (hyperthyroidism), so he changed my medication (increased metformin and decreased levothyroxine), then I proceeded to go on vacation and LEFT MY ANXIETY MEDS AT HOME."
374,0.9995704047763393,0.00042959522366401955,0.084,0.916,0.0,All the meds I'm taking mimic some of the side effects of pregnancy and I'm sufficiently freaked every time one of them makes an appearance.
375,0.9999712853391418,2.8714660851596912e-05,0.13,0.666,0.204,"I went through some meds, none did anything beneficial, a couple had mild side effects like sleeplessness stomach stuff etc., but nothing too bad."
376,0.9996639170609463,0.0003360829390439956,0.083,0.833,0.083,"After trying three meds, my doctor decided to tell me I need to talk to a therapist about the problem and that she would not be able to help me further."
377,0.9992141900921165,0.0007858099078695131,0.092,0.908,0.0,I went back to the doctor today for an unrelated illness and mentioned that I have not been able to call the therapist and was damn near accosted for not having done so and then she begrudgingly prescribed me a new medicine with the requirement that I come back to her in 30 days and having talked to a therapist.
378,0.9999775205309952,2.2479468993619015e-05,0.0,1.0,0.0,What if medication doesn't work?
379,0.9995472747748081,0.00045272522519216864,0.0,1.0,0.0,"I'm going in today for a therapy session, and then am being diagnosed soon and put on medication soon after that."
380,0.9994013849760791,0.0005986150239166375,0.0,1.0,0.0,We made the decision that I'll try to control it on my own and not go on medication.
381,0.9996887618156705,0.00031123818432149896,0.059,0.82,0.121,I decided not to because I feel like it will change who I am and I also don't want to depend on meds.
382,0.9999813015192492,1.8698480747856657e-05,0.0,1.0,0.0,"So guys, I was wondering what medicines are prescribed and how dependent you are on them?"
383,0.9999653921181452,3.460788183511041e-05,0.138,0.652,0.21,(I stopped taking my meds because I feel better generally without them).
384,0.9996892978602501,0.00031070213974494705,0.0,1.0,0.0,"I've been on and off anti-depressants and/or anti-anxiety meds for the past six years, each to varying effects: Paxil, Lexapro, Zoloft, Wellbutrin, Klonopin, Effexor, Remeron, Trazadone, Abilify."
385,0.9988182136106595,0.0011817863893485605,0.0,1.0,0.0,"I took the first pill last night, and it's my first experience with any sort of SSRI, or any form of medication other than aspirin/tylenol/etc."
386,0.9995312585431508,0.0004687414568510959,0.095,0.905,0.0,"Now here's my question:
I'm going on a 4 day cruise in 10 days and am thinking I should stop medication until after the cruise."
387,0.9996248786068496,0.0003751213931540887,0.0,1.0,0.0,"I'm not on medications right now and can't get on any for a few months at least, so I just have to figure out a way to deal with these I guess."
388,0.99995984539721,4.015460278408848e-05,0.57,0.43,0.0,There's no shame in considering medication.
389,0.9997882864979019,0.00021171350211490457,0.0,1.0,0.0,"Taking medicine turned my life around, find the one that's right for you, I tried three before I found one that doesn't make me hazy."
390,0.9991536510964822,0.0008463489035042327,0.233,0.767,0.0,"It's been a while since I've had an attack (I don't take meds/I haven't discussed it with my family, so that's dumb on my part)."
391,0.9993175503246252,0.0006824496753696558,0.132,0.678,0.19,I don't want to go back on my anti-depressents and I am already taking a medication for my anxiety that I love.
392,0.9999792404474181,2.0759552572199994e-05,0.233,0.678,0.088,"I have never sought professional help for my anxiety, and although this is largely because my anxiety has prevented me from doing so, even when I've felt confident enough I've refused to seek help because I don't want to be put on medication."
393,0.9989462211939949,0.0010537788060040432,0.082,0.785,0.133,"Surely if one has a mental problem, allowing your brain to become reliant on medication to correct it is just going to make it impossible to function properly without it?"
394,0.9997541586068656,0.0002458413931342179,0.217,0.783,0.0,"I've never had any kinds of medicine or treatment for anxiety before, mostly because I'm too scared/embarrassed/proud to ask for any (which is stupid, I know), but I also didn't start noticing many problems with anxiety until July 2012."
395,0.999924783767626,7.52162323842466e-05,0.0,0.856,0.144,"TL;DR Currently on Wellbutrin for GAD, what are your experiences/opinions; what other medicines (preferably non-ssri/srni) may help?"
396,0.9999799612107286,2.0038789284316304e-05,0.213,0.787,0.0,I was on medication for about 2 months then stopped.
397,0.9990312870976307,0.0009687129023820939,0.136,0.73,0.133,"I had been doing so well off meds, and now have had a lot of stress in my life."
398,0.9999785031297678,2.149687022463257e-05,0.0,0.87,0.13,"So here they are again, and I will resume my meds since they did work well."
399,0.9995101972999079,0.000489802700110396,0.219,0.781,0.0,"Recently started a new medication, which was very scary for me because I don't like taking things that I don't know what they will do."
400,0.9999842874976026,1.571250238053913e-05,0.0,0.828,0.172,"Even when I started this medication, my thoughts were ""How is this going to help?"
401,0.9993713170520263,0.0006286829479818683,0.0,0.833,0.167,The medication is allowing me to get to a point where I have the resources to care for myself.
402,0.99404663932783,0.0059533606721796865,0.12,0.88,0.0,"For me medication will not be the answer, but it provides a door to a long tunnel to the other side of this mess if I'm willing to do the work."
403,0.9944107308482221,0.005589269151777044,0.305,0.695,0.0,"Now a couple of years ago, I started having extremely bad panic attacks out of the blue, to the point that I am now currently on medication (Lexapro) for it."
404,0.9998343730839011,0.0001656269160901698,0.11,0.89,0.0,"They discouraged me from seeing a therapist/taking meds, but this isn't about them, this is about me."
405,0.9999597721638133,4.022783620231432e-05,0.117,0.787,0.096,"I've also tried Lexapro and Zoloft, but I'm not keen on meds and I got off them earlier than recommended (weeks.)"
406,0.9962455907837334,0.0037544092162756122,0.15,0.766,0.084,"I'm not keen on meds for a few reasons, all of which are my personal beliefs and I don't mean to belittle or offend anyone on them."
407,0.9991715625530085,0.0008284374469817385,0.33,0.577,0.093,Just in case: I'm not on any meds (aside from some pain killers for now) and I've never been diagnosed with anxiety problems of any kind.
408,0.9999817224636665,1.8277536316492686e-05,0.0,1.0,0.0,I have health insurance that covers what I would need to see someone about therapy or medication.
409,0.999767471934531,0.00023252806547282206,0.048,0.867,0.086,"Girl in above story actually gave me some meds that helped her in similar situations (which again, I should focus on that she cares about me enough to try to help me instead of dumb phone shit) but I havent noticed any difference really."
410,0.9999263479838256,7.365201615830318e-05,0.292,0.708,0.0,I've had panic attacks all my life and I have been she people about it and taking meds.
411,0.9995252460634411,0.0004747539365558,0.366,0.593,0.041,"* - I used to eat very healthy and do a lot of cardio, but since my sleep meds has lowered my blood pressure I can't do cardio without fainting D: and I have been eating very bad unhealthy stuff lately."
412,0.9998638053747128,0.00013619462527504343,0.0,1.0,0.0,"Coincidentally, this is how long I've been taking my meds (escitalopram, 10mg once a day)."
413,0.9999250609032706,7.493909671791484e-05,0.195,0.805,0.0,Could the meds and/or anxiety be causing it?
414,0.9999073155406966,9.268445928740097e-05,0.104,0.896,0.0,"I know this did not happen on its own, I did years of therapy, studying, and medications (I am no longer on.)"
415,0.9995131792505594,0.0004868207494471545,0.072,0.928,0.0,Ive never taken any meds for my anxiety before and today was the first time I talked to somebody about it (except my mother).
416,0.9999827367467906,1.7263253215272393e-05,0.064,0.912,0.024,"I took off last week to allow myself to adjust to the medication, but also because I was scared something was going to happen go me on my way to work... Now, it's 1230M, I'm supposed to go to work tomorrow and I'm profusely sweating and have myself believing something is going to happen if I go to work tomorrow...."
417,0.9997857510759436,0.00021424892403751707,0.089,0.911,0.0,"A month before her graduation she began to take medications for the attacks- I don't remember which ones specifically, but there were two."
418,0.9998797720039417,0.00012022799605621113,0.0,1.0,0.0,"She was on the daily medication for about eight months, and closer to our wedding she got off it."
419,0.9996838799792073,0.00031612002078901534,0.424,0.576,0.0,She still has the other anxiety medication to take when the attacks get bad.
420,0.9996402477492208,0.00035975225076902454,0.0,0.862,0.138,"The medication is helping, but full-effect is still a little while away."
421,0.99998438530964,1.5614690369791075e-05,0.0,1.0,0.0,I went on medication and it's been 4 months so I've decided to re-test.
422,0.999966671033248,3.332896674911976e-05,0.221,0.779,0.0,Been on anxiety meds for about 1.5.
423,0.9998285365169045,0.00017146348309183602,0.092,0.908,0.0,I don't want to take meds because I'm trying to get off of them.
424,0.9999689351795241,3.1064820461431006e-05,0.0,0.748,0.252,should i get an anti-anxiety medication to help me sleep?
425,0.9993104562802622,0.000689543719743582,0.0,0.759,0.241,It's my first time taking any kind of medication and to begin with I was feeling very positive about it.
