,Unnamed: 0,neg_prob,pos_prob,neg_vader,neu_vader,pos_vader,sentence,dict,identifier
2266,2266,0.9998973227016396,0.00010267729836352096,0.188,0.812,0.0,-The medication is just not as effective as it used to be.,nsubj,1
2268,2268,0.9999302841647996,6.971583521029905e-05,0.272,0.728,0.0,The last medication I was on gave me lasting memory problems and I'm scared that it will interfere.,nsubj,1
2283,2283,0.99989128355747,0.00010871644254913305,0.0,1.0,0.0,I know the medication can take longer to work but it's little consolation when you feel this way.,nsubj,1
2305,2305,0.9996630050246668,0.00033699497531729846,0.145,0.855,0.0,"Every medication the was suggested, I tried for quite some time before, to no avail.",nsubjpass,1
2315,2315,0.9955380710326132,0.00446192896738244,0.0,0.6829999999999999,0.317,"I'm a firm believer that the right medication **is** a solution, contrary to popular belief.",nsubj,1
2326,2326,0.9996388775123821,0.0003611224876319886,0.105,0.833,0.062,"-I can no longer work because of its severity, and the fact that medications triple the severity of every issue I have had (and I've been trying all kinds of meds for over 10 years) 


So, all that out there... My life is pretty miserable at times.",nsubj_pobj,1
2336,2336,0.9925610928609736,0.007438907139013972,0.0,0.8,0.2,"I've played brain juice roulette with a total of 3 different medications and 1 supplement, and the 3rd medication is doing reasonably well.",pobj_nsubj,1
2348,2348,0.9997868844783104,0.00021311552170810456,0.254,0.535,0.212,"Eventually the medication started doing more harm than good, though.",nsubj,1
2383,2383,0.99996121057083,3.878942918420583e-05,0.0,1.0,0.0,"What I was wondering, however, was how affordable medication is.",nsubj,1
2384,2384,0.9999905275296742,9.472470319267401e-06,0.0,0.517,0.483,And how did meds help you get better?,nsubj,1
2401,2401,0.9999966450701796,3.3549298376917324e-06,0.135,0.635,0.23,Which anxiety medicine have you guys had good experiences with?,nsubj,1
2414,2414,0.9999194864965724,8.051350341905906e-05,0.0,0.7290000000000001,0.271,At least the medication allows me to ask other people like you folks for help now.,nsubj,1
2416,2416,0.9988914166531192,0.0011085833468606717,0.265,0.735,0.0,its one of the things my anxiety meds doesn't help with at all.,nsubj,1
2417,2417,0.9999284515744864,7.154842552370732e-05,0.0,0.637,0.363,"Just want to say that if this medication worked for you, great!",nsubj,1
2418,2418,0.9998952769163107,0.00010472308370434769,0.083,0.639,0.278,"The doctor and therapist both told me that this medication had minimal side effects, no weight gain, and withdrawal was easy.",nsubj,1
2424,2424,0.9999724041116006,2.759588841241441e-05,0.10800000000000001,0.784,0.10800000000000001,I've been looking into hypnotherapy for my anxiety/agoraphobia since no medication seems to be helping nor does CBT.,nsubj,1
2425,2425,0.9995884953295447,0.00041150467044416816,0.0,1.0,0.0,the meds i got was from a surgery on my eye.,nsubj,1
2426,2426,0.999976723644308,2.32763556811702e-05,0.43,0.452,0.11800000000000001,Every medication I have tried that helps my chronic anxiety makes me suicidal and depressed.,nsubj,1
2433,2433,0.9998261424870706,0.00017385751291155622,0.0,1.0,0.0,"The medication I take has been working for me, evening out my mood-- until recently.",nsubj,1
2445,2445,0.9984505585062372,0.0015494414937821126,0.09699999999999999,0.856,0.047,I have a prescription for prozac to help the anxiety but my psychiatrist said that the medication for ADD makes people anxious so he can't start me on that until he sees how I do with the prozac long term.,nsubj,1
2448,2448,0.9999572617588784,4.273824111422563e-05,0.0,0.597,0.40299999999999997,Did medication seem to help?,nsubj,1
2454,2454,0.9999698175098792,3.0182490120251177e-05,0.345,0.345,0.31,Can medication help with phobias?,nsubj,1
2467,2467,0.9999693580631476,3.064193685387996e-05,0.106,0.784,0.11,"Normally, my anxiety medication is fine for this, but now I'm moving.",nsubj,1
2473,2473,0.9990178377820134,0.0009821622179745978,0.0,0.743,0.257,The meds help for the most part but also don't completely stop it from happening.,nsubj,1
2478,2478,0.9999754924335142,2.4507566467327256e-05,0.18100000000000002,0.532,0.287,Is anxiety medication something that could help?,nsubj,1
2484,2484,0.9997203848978944,0.00027961510211002783,0.11699999999999999,0.619,0.263,"I'm just nervous because meds should not be the solution, but maybe they could help ease me into a full recovery?",nsubj,1
2486,2486,0.9999766185163732,2.3381483626609218e-05,0.21100000000000002,0.642,0.147,"I'm writing because my medication have an annoying side effect: When I first take them, I feel pretty dizzy.",nsubj,1
2507,2507,0.9991562897584506,0.0008437102415355473,0.0,0.759,0.24100000000000002,"My medication and calming methods have been doing really well, and I haven't had a major episode in nearly a year.",nsubj,1
2543,2543,0.9951421917206706,0.004857808279326788,0.0,0.871,0.129,3 years go by and my mother found an article in the newspaper about acid reflux medication draining naturally occurring B12 from the body and recommended I take a B12 vitamin daily.,nsubj,1
2546,2546,0.9993643189899593,0.0006356810100265157,0.142,0.597,0.261,"I just don't want to depend on them, but I think starting medication gives me anxiety and it may be for the best to calm my nerves.",nsubj,1
2547,2547,0.9999794487599696,2.055124001557406e-05,0.135,0.6679999999999999,0.19699999999999998,I have some meds prescribed but they don't work as well as I would like.,nsubj,1
2573,2573,0.99954484993447,0.00045515006552868944,0.031,0.9690000000000001,0.0,"But I'm wondering if anyone here has any ways to cope that worked during their pregnancy since obviously medication is a no-go right now (I'm prescribed Xanax as needed, but I haven't taken any since September, and don't want to take anything while pregnant).",nsubj,1
2575,2575,0.9998364283268778,0.00016357167312822172,0.0,0.585,0.415,"While I know medication helps a bit, I am more curious about what helps when medicine can't.",nsubj_nsubj,1
2576,2576,0.9999446973781664,5.5302621836541176e-05,0.0,0.7140000000000001,0.28600000000000003,"I still don't know if medication is the right route for me but honestly I don't know what else to do, I have to do something to start feeling better.",nsubj,1
2581,2581,0.9999228599152564,7.714008475456389e-05,0.0,1.0,0.0,What medications are available and what are the side effects?,nsubj,1
2584,2584,0.9956501380035744,0.004349861996438086,0.095,0.7759999999999999,0.129,"I starting seeing a psychologist in April of this year (no meds, refuse them) and the improvement i've been seeing was tremendous.",nsubj,1
2595,2595,0.9997751368697928,0.00022486313022379502,0.068,0.894,0.038,Sometimes i want to go to my DR and ask for medication so i can live normal but then i have anxiety that the medication will change me and i wont feel anything.,nsubj,1
2608,2608,0.999861738349496,0.00013826165050159338,0.185,0.627,0.188,"While medication helps to keep me from freaking out over small things, it gives me no incentive to do big things.",nsubj,1
2618,2618,0.999941242665203,5.8757334784602696e-05,0.0,0.769,0.231,"The meds did help me, I have to give him that.",nsubj,1
2625,2625,0.9997295994229132,0.000270400577068627,0.165,0.7,0.135,Not too long ago I was convinced that medication is the only way to elevate the pain.,nsubj,1
2629,2629,0.9997948239107216,0.00020517608928902688,0.062,0.764,0.174,"Medication is great to temporarily gain firm enough footing so as to build awareness, however if nothing is changed behaviorally or psychologically, ie if awareness is not being cultivated, the medication is merely masking the problem.",nsubj,1
2630,2630,0.9999856053329541,1.4394667059043097e-05,0.18899999999999997,0.8109999999999999,0.0,"Also, my meds and my stress have made my sex drive non existant.",nsubj,1
2632,2632,0.9997704781468424,0.00022952185317252089,0.0,0.7979999999999999,0.20199999999999999,"I have a psychiatrist right now, but the medicine I'm taking only does so much for me and I think it would do me good to have someone to talk to, like a therapist.",nsubj,1
2640,2640,0.9997964386019108,0.0002035613981080743,0.0,1.0,0.0,Prescription medication sometimes gets dropped to sustain the meal budget.,nsubjpass,1
2642,2642,0.9992901609668112,0.0007098390331739773,0.06,0.94,0.0,She sleeps most of the time because she can't handle reality or the way the meds make her feel and it's been hard.,nsubj,1
2653,2653,0.9997518122801824,0.00024818771980974737,0.0,1.0,0.0,"The medication was working, I was rarely taking the valium.",nsubj,1
2662,2662,0.9999794935761436,2.0506423867856656e-05,0.0,1.0,0.0,The medication I am on is Pristiq.,nsubj,1
2673,2673,0.999955892212974,4.410778703755489e-05,0.0,1.0,0.0,Maybe meds aren't always enough.,nsubj,1
2690,2690,0.9999945228412394,5.4771587687165486e-06,0.0,0.633,0.36700000000000005,What makes this medicine work better?,nsubj,1
2693,2693,0.9999217587837388,7.824121626939523e-05,0.0,1.0,0.0,And there are some for whom meds may be counter-indicated due to extenuating medical issues.,nsubj,1
2695,2695,0.9995437644119564,0.00045623558804684796,0.16399999999999998,0.836,0.0,"But at the same time, I don't want to just yet because if I do have a heart problem, the medicine can trigger an episode.",nsubj,1
2700,2700,0.9999436865164321,5.631348358194366e-05,0.0,0.69,0.31,Will the meds help this over time?,nsubj,1
2714,2714,0.9663936851210287,0.03360631487897893,0.065,0.748,0.187,"These meds are making my life worth living so I don't want to give them up, but I'd love some advice on how to deal with the issue of being... y'know... a little backed up.",nsubj,1
2733,2733,0.9997900847184162,0.00020991528157416567,0.23600000000000002,0.625,0.139,"I already feel super nauseous all the time, but the medications make it worse.",nsubj,1
2747,2747,0.9998286110304924,0.0001713889695136701,0.0,1.0,0.0,I have another appointment with my doctor in 3 weeks to see how my medication is going and will be organising seeing a counsellor then.,nsubj,1
2776,2776,0.9976391520718048,0.0023608479282078024,0.0,0.76,0.24,Any willing to share their experience ... so I can have a better understanding of how meds might affect my weight?,nsubj,1
2780,2780,0.9976569421742588,0.0023430578257292887,0.0,1.0,0.0,"I was not aware that I had never actually orgasmed wanking ever before, and I was suddenly more aware of what the medication has done to me.",nsubj,1
2781,2781,0.99983431449118,0.000165685508819076,0.113,0.747,0.14,"The medication is not known for helping with sexual issues, though it is certainly responsible for my delayed ejaculations (given premature ejaculations are what they are also prescribed for)....",nsubjpass,1
2782,2782,0.99985268373076,0.00014731626924943092,0.09699999999999999,0.628,0.275,"The medication has not fixed me, but it has allowed me to understand myself better and certainly has helped to highlight and eradicate problems I didn't know I had.",nsubj,1
2784,2784,0.9915950505491941,0.008404949450790624,0.04,0.833,0.127,"It was nothing like the terrifying experience that I had built it up to be, and I will be happy to return in the next week or two to discuss how my medication works (or if it does), and whether I need to be given a higher dosage, or try anti-depressants.",nsubj,1
2791,2791,0.9998021710029532,0.00019782899703787288,0.0,0.889,0.111,"While the medicine  seems like it is working, and with very little if any side effects, I am CONSTANTLY wanting to eat.",nsubj,1
2793,2793,0.9997935046055276,0.0002064953944766317,0.131,0.8270000000000001,0.042,"He said there's nothing to do with anxiety except increase the effexor (now 225 mg), I'm maxed out on Topamax (200mg), he doesn't want to add anything else, anxiety medication is too addictive so he won't treat it and he suggests I find other ways to cope (as though I haven't tried).",nsubj,1
2804,2804,0.9991099688145728,0.0008900311854354123,0.0,0.8,0.2,After 3 years of being on Lexapro I came off the meds feeling ready to be my old self again.,nsubj,1
2822,2822,0.999677994175458,0.0003220058245456738,0.205,0.795,0.0,I know that you tend to feel worse before the meds finally kick in.,nsubj,1
2845,2845,0.9999960639666529,3.9360333300574785e-06,0.152,0.562,0.287,I was wondering if anybody else has problems like this and if medication helps?,nsubj,1
2858,2858,0.9996947513887908,0.00030524861121441186,0.149,0.7709999999999999,0.08,"I don't even know what I would say to a psychologist, I guess I just need some feedback on if medication has truly changed peoples lives for the better... People that cope with anxiety, depression, etc.",nsubj,1
2861,2861,0.9940434194119564,0.005956580588024918,0.355,0.6,0.045,"Both medications do a little bit to help, but the anxiety, which I was able to cope with or ignore before, gets worse and worse as my classes get harder.",nsubj,1
2863,2863,0.989952930467986,0.010047069532025159,0.15,0.72,0.131,I have gained a lot of weight in the past year trying to cope with my anxiety and I don't want this medication to get in the way of my ability to lose that weight.,nsubj,1
2867,2867,0.9998719987467518,0.00012800125325773633,0.083,0.73,0.187,"I'm aware meds aren't going to be some miracle cure, but it feels like I've got as far as I can get with sheer effort alone.",nsubj,1
2885,2885,0.9996974751623278,0.00030252483765553167,0.203,0.797,0.0,"Needless to say it's all psychosematic bullshit medicine, right up there with the people in CA doing ""light therapy"" or whatever the newest unproven bullshit new age medicine is.....

Long story short, I'm out on Short Term Disability for losing it at work.",nsubj,1
2891,2891,0.9999581651433648,4.183485664237679e-05,0.0,1.0,0.0,I have an appointment on the 1st to see how the medication is working out but I just don't know.,nsubj,1
2895,2895,0.999992327494732,7.672505274388732e-06,0.0,0.846,0.154,"Hey guys, I was wondering if you had any advice about what medications have worked for you or friends.",nsubj,1
2904,2904,0.9999647133204465,3.528667953654893e-05,0.157,0.603,0.24,My current medication helps some with depression but does nothing for anxiety.,nsubj,1
2911,2911,0.9999774474262452,2.255257376170644e-05,0.0,1.0,0.0,Then I hear about how commonly prescribed my medications are.,nsubj,1
2914,2914,0.9993770806644352,0.0006229193355499228,0.354,0.35100000000000003,0.294,"Although the medication was helping a lot (no more panic attacks, yay!",nsubj,1
2917,2917,0.9976679755493528,0.002332024450636218,0.0,0.596,0.40399999999999997,"When i started, the medication felt like it was having a positive effect.",nsubj,1
2920,2920,0.9999871740990994,1.2825900893095699e-05,0.337,0.6629999999999999,0.0,I also have health anxiety and emetophobia so this has me worried that I'm sick with something... but I know some anxiety meds can cause fatigue?,nsubj,1
2926,2926,0.9922424564027548,0.007757543597255944,0.179,0.821,0.0,Is it normal for the meds to not work good for a week?,nsubj,1
2945,2945,0.999310751945038,0.0006892480549532674,0.32799999999999996,0.39299999999999996,0.27899999999999997,"Tl;dr- 7 years of anxiety, meds suck, doctors suck, Fresh air and exercise are awesome,",nsubj,1
2952,2952,0.9999967280495644,3.2719504242251176e-06,0.0,0.873,0.127,This medicine is new to me so I just wanted to see if anyone out there had any good information to contribute.,nsubj,1
2955,2955,0.9990901383936346,0.0009098616063759439,0.129,0.773,0.09699999999999999,"The counseling was helpful but the feeling usually didn't last (catharsis has always felt temporary), but the medication helped so after several months, I stopped seeing the counselor and just stuck to the meds.",nsubj_pobj,1
2964,2964,0.9995383636287124,0.00046163637127578905,0.134,0.866,0.0,"I got things sorted, as far as I know, but I'm basically useless right now, and I don't know what to do until the meds kick in again.",nsubj,1
2994,2994,0.9998215650651996,0.0001784349347979402,0.0,0.8759999999999999,0.124,"I've been to the doctor and they prescribed me with Buspar, but I have yet to take it because I feel like meds aren't the answer.",nsubj,1
3000,3000,0.9372155854783872,0.06278441452162674,0.0,1.0,0.0,"Now I was a psych major in college and have a *basic* understanding of how different meds work and the side effects, etc.",nsubj,1
3021,3021,0.9999664587961312,3.354120388688169e-05,0.0,0.526,0.474,The medication did help.,nsubj,1
3024,3024,0.9991929131320334,0.0008070868679486313,0.04,0.8059999999999999,0.154,"I really haven't felt too much anxiety with the job either, my meds seem to keep everything in check and after the first week I knew what I was doing and can keep perfectly calm on the phones with people.",nsubj,1
3026,3026,0.9955508610179558,0.004449138982024972,0.231,0.6970000000000001,0.07200000000000001,I am now so worried about taking them that I am feeling like it was a big mistake to even go to the doctor in the first place and I am worried if these medications with make my symptoms worse as I had read that Zoloft in particular can cause anxiety.,nsubj,1
3033,3033,0.9999405589098349,5.944109017568042e-05,0.0,0.764,0.23600000000000002,I just want to know how everyone else is dealing with anxiety/ocd that mainly focus on breathing and how medication could help in improving these habits.,nsubj,1
3057,3057,0.999977347639254,2.26523607451118e-05,0.0,1.0,0.0,Which specific meds worked for you?,nsubj,1
3061,3061,0.9992110422838982,0.000788957716082069,0.068,0.932,0.0,The psychiatrist told me that she has never heard a symptom like this and that the medicine should have been outta my system after the first 5 hours of not taking it.,nsubj,1
3079,3079,0.9788842500103224,0.02111574998968374,0.0,0.892,0.10800000000000001,I was finally able to stay calm for a bit and I felt the medicine working in the back right of my skull.,nsubj,1
3084,3084,0.99723651112332,0.00276348887669316,0.10800000000000001,0.722,0.17,"The thought that the meds could make me that way scares the shit out of me and starts my negative thought cycle, but after working with a therapist I got better about that.",nsubj,1
3089,3089,0.995605321249638,0.004394678750363182,0.06,0.8170000000000001,0.124,"Not that labels matter as long as the medication works but I'm curious.... well, it kind of does matter for me, because my insurance won't approve Saphris on the basis that I'm not bipolar, but yeah.",nsubj,1
3096,3096,0.9998562322932464,0.00014376770676306666,0.0,0.856,0.14400000000000002,"He's convinced it's something physiological, as am I to some extent, which is where medication should come in.",nsubj,1
3108,3108,0.9930806442484206,0.006919355751573708,0.0,1.0,0.0,He did a wide variety of tests (including stroke and other neurological tests) but the meds he gave me (propranolol 20mg) only work for a short time before the vertigo comes back.,nsubj,1
3126,3126,0.9951968121012246,0.004803187898780878,0.11699999999999999,0.883,0.0,"TL;DR haven't had meds refilled in 2+ months.. doc lowered my dosage and insisted I make it last a month, now I'm worried she sees me as an addict and I'm not.",nsubj,1
3131,3131,0.9996942671398544,0.00030573286015494826,0.263,0.56,0.177,I had no anxiety while dating her and for once in my life no meds and felt great.,nsubj,1
3133,3133,0.9999831059413948,1.6894058614065734e-05,0.0,0.659,0.341,I’m most afraid my meds aren’t effective.,nsubj,1
3142,3142,0.9999705331527116,2.946684728173125e-05,0.35600000000000004,0.644,0.0,I can't help but believe the anti-psych people who say this medicine is toxic and killing me.,nsubj,1
3151,3151,0.9998786119672336,0.00012138803274834898,0.09699999999999999,0.853,0.05,"Really really you just weren't trying hard enough before, you were just trying to be difficult and that's what made the medication not work.""",nsubj,1
3157,3157,0.999979091597712,2.090840229876432e-05,0.0,1.0,0.0,my medicine is also working wonders.,nsubj,1
3169,3169,0.9999465677311846,5.34322688068993e-05,0.109,0.8170000000000001,0.07400000000000001,Do meds help you reconnect with the authentic you that's just covered with anxiety or do they simply cover the physical symptoms and make you feel less uncomfortable without changing your thought process?,nsubj,1
3170,3170,0.9980182042254128,0.001981795774601868,0.155,0.69,0.155,"Do meds help with any of the negative personality traits i've accumulated over the years due to constant anxiety, and can they help connect with the real you?",nsubj,1
3191,3191,0.9999800950581988,1.9904941815580553e-05,0.0,1.0,0.0,"TL;DR: I may have gotten off my meds too quickly, should I consider getting back on and weening off more slowly.",nsubj,1
3192,3192,0.999966672594258,3.3327405744666186e-05,0.0,1.0,0.0,"I went to see my doctor yesterday to have my meds adjusted, etc.",nsubj,1
3197,3197,0.9998660447986838,0.00013395520131761528,0.127,0.519,0.354,"So, I'm REALLY REALLY hoping that medication will help with my inability to concentrate.",nsubj,1
3210,3210,0.9999600007355552,3.999926442434544e-05,0.456,0.544,0.0,This medication evens out my moods but it makes me depressed when before I was angry and my anxiety is worse than ever.,nsubj,1
3221,3221,0.9997811855570009,0.00021881444299797157,0.0,0.597,0.40299999999999997,The medicine does help a bit.,nsubj,1
3223,3223,0.9980573028561732,0.0019426971438387664,0.0,1.0,0.0,"The meds helped me quite a bit during the summer, but now...they just aren't enough.",nsubj,1
3226,3226,0.9999684200940504,3.157990595427326e-05,0.28800000000000003,0.7120000000000001,0.0,"All I know is I finally stopped shaking, I am at work, my meds finally kicked in and now I am no longer so tensed up I can't move.",nsubj,1
3238,3238,0.9996416665971568,0.00035833340285618137,0.0,1.0,0.0,"Now the only medication I started using for it was cannabis, that was around 16.. Wasn't until late 16/early 17 that I really started smoking regularly (on and off).",nsubj,1
3242,3242,0.99995610449887,4.389550114177465e-05,0.159,0.703,0.138,"I've tried the anxiety exercises, cognitive behavioural therapy, but only anxiety medicine (clonazepam) calms me enough to function.",nsubj,1
3251,3251,0.9998520619979412,0.00014793800205564718,0.239,0.7609999999999999,0.0,"No medication (on hand), I can't be taking these incomplete shifts every time this happens, the call outs need to stop, and no one understands.",nsubj,1
3254,3254,0.9968602937028884,0.0031397062971305944,0.094,0.9059999999999999,0.0,"I was thinking of going to a doctor for  medication but I heard that anxiety/depression medication is highly addictive, and basically once you go that route there's no getting off it.",nsubj,1
3260,3260,0.9866534946980572,0.013346505301935287,0.147,0.5920000000000001,0.261,"On one hand the medication is making everyday life easier and has brought down my anxiety levels a significant amount, on the other hand I don't feel like the person I was and emotionally numb.",nsubj,1
3263,3263,0.992556032299912,0.007443967700103961,0.068,0.725,0.207,"But I really struggle with social events, like going to parties, bars, concerts and I wouldn't dream of going anywhere like a club with everyone I know.. Was wondering if people have tried medication to help with dealing with social interaction and going to places with a lot of people and how these medicines helped or didn't help.",dobj_nsubj,1
3276,3276,0.9992052567227252,0.0007947432772600149,0.069,0.9309999999999999,0.0,I've yet to become medicated for my social anxiety for various reasons and I'm wondering how the medication makes you feel in social situations.,nsubj,1
3278,3278,0.9999884494552844,1.1550544698990546e-05,0.0,0.871,0.129,I know this story is long... but to anyone who took the time to hear me out... thanks... and if you can answer the question... will medicine really help?,nsubj,1
3279,3279,0.9999656694454157,3.433055458983441e-05,0.253,0.634,0.113,I'm really depressed thinking that the meds won't do anything and I'll be stuck like this forever.,nsubj,1
3284,3284,0.9999904860008576,9.513999125234937e-06,0.0,1.0,0.0,What meds have worked for you guys?,nsubj,1
3306,3306,0.9920923282166182,0.00790767178336912,0.183,0.63,0.187,"I suffer from alot of energy issues, as I can go from feeling like I had a sugar high to like I just ran a marathon and need to sleep within an hour..my fear is that anxiety meds will heighten this more..",nsubj,1
3311,3311,0.9991906557731304,0.0008093442268641501,0.0,1.0,0.0,"Obviously every medication affects people differently, so I guess my title is more of a rhetorical question.",nsubj,1
3314,3314,0.9887104700757456,0.011289529924248686,0.0,0.934,0.066,"I'm going to talk to my doctor about either increasing my dosage, or possibly about whether the medication has done all it can and it's time for CBT, but I like to have a little bit of an idea what I'm talking about before I go in for the appointment.",nsubj,1
3316,3316,0.9997467707590948,0.00025322924091924565,0.059000000000000004,0.8190000000000001,0.121,I used to get very shaky and physically dishevled but my meds are keeping me together physically but I feel like I'm melting on the inside.,nsubj,1
3328,3328,0.9936951792147448,0.006304820785241422,0.064,0.813,0.12300000000000001,"My background: recently started seeing a counselor (doesn't specialize in anxiety issues), no meds yet, diagnosed anxiety since I was very young, mostly homebound (leave for PT job, but don't go elsewhere unless it's with my SO), trying to realize feeling this way is OK for now and that I won't always feel like this... it took me an hour to write/send this...",nsubj,1
3333,3333,0.998891658541056,0.0011083414589554005,0.0,1.0,0.0,"By the time she got there, I was starting to feel my meds take effect and I probably looked a little loopy.",nsubj,1
3334,3334,0.9979970329525328,0.0020029670474781347,0.0,0.882,0.11800000000000001,"That is, unless my body feels a drunkish-lethargy, I will convince myself that the medication is merely a placebo.",nsubj,1
