,Unnamed: 0,neg_prob,pos_prob,neg_vader,neu_vader,pos_vader,sentence,dict,identifier
1971,1971,0.9996810309226428,0.000318969077368219,0.073,0.86,0.066,"I haven't had a full panic attack since I started taking benzos, but I still feel it and I am wondering if my medication should be changed; if I possibly have epilepsy.",['nsubjpass'],0
1972,1972,0.9999692931026648,3.0706897331773794e-05,0.222,0.778,0.0,He put me on other anti anxiety meds that just make me feel blank and nonfunctional.,['conj'],0
2000,2000,0.999886762694834,0.000113237305181466,0.0,1.0,0.0,"I tried soo many things, from meditation, counseling, medication, and self-help.",['conj'],0
2002,2002,0.9996298165327312,0.00037018346728511534,0.122,0.7559999999999999,0.122,However with therapy and medication it's gotten much better and these sorts of attacks are very rare for me now.,['conj'],0
2006,2006,0.9999045913685398,9.540863144346385e-05,0.11599999999999999,0.685,0.19899999999999998,I just thought this might be a good place for anxiety medicine related questions.,['npadvmod'],0
2008,2008,0.9999462849523288,5.371504765581298e-05,0.0,0.8390000000000001,0.161,With therapy and medicine I managed to pick everything back up and felt really stable.,['conj'],0
2010,2010,0.999813111808782,0.00018688819122354887,0.0,0.883,0.11699999999999999,"Tried numerous calming techniques, medication, breathing exercises, which helped the symptoms but not the cause.",['conj'],0
2017,2017,0.999586309002598,0.0004136909973816039,0.47700000000000004,0.523,0.0,"Here I am waking up to a terrible panic attack despite great access to regular therapy, medication and working out.",['conj'],0
2019,2019,0.9999938664903504,6.133509666395939e-06,0.174,0.64,0.18600000000000003,I have pretty serious anxiety and all medicines I have tried just knock me out cold.,['conj'],0
2023,2023,0.9999595077885968,4.049221139773975e-05,0.0,1.0,0.0,This only started happening recently which tells me it may be medication related?,['npadvmod'],0
2048,2048,0.999939726121542,6.027387847489208e-05,0.19399999999999998,0.8059999999999999,0.0,Fired my old medication doctor and went to my first appointment with my new medication doctor.,['compound'],0
2049,2049,0.948008773206532,0.051991226793463366,0.16399999999999998,0.779,0.057,"It took a while to get the right fit of counselors and medications, but he was finally put on Zoloft which lifted him out of his depression.",['conj'],0
2064,2064,0.9998706528134516,0.0001293471865321169,0.27899999999999997,0.721,0.0,I'm thinking about all the panic attacks I will get and all the medication I won't be able to afford.,['conj'],0
2067,2067,0.9758328504228762,0.02416714957712079,0.0,1.0,0.0,Another checkup is scheduled in 3 weeks to see if the meds have also helped with the ADD since a lot of the symptoms overlap for both conditions.,['nsubjpass'],0
2068,2068,0.9998689272453922,0.00013107275459350057,0.133,0.867,0.0,"Despite my personal dealings with these disorders, I struggle with counseling patients on anti-anxiety and anti-depressant medications.",['conj'],0
2074,2074,0.999907608611416,9.239138858181504e-05,0.0,0.629,0.371,"I'm doing everything I can to stay relaxed and healthy (therapy, medication, etc.",['conj'],0
2084,2084,0.9983997341058258,0.0016002658941566266,0.0,0.754,0.24600000000000002,"I'm hopeful of this option, as I feel I could get a lot better if I invested some time with competently-guided CBT or perhaps medication.",['conj'],0
2105,2105,0.99963539918682,0.00036460081318227897,0.0,1.0,0.0,And I will really really give these meds a shot.,['dative'],0
2126,2126,0.9999030230542956,9.697694568961596e-05,0.125,0.823,0.052000000000000005,"Actually, I just came back from my Target pharmacy for my anti-aniexty and depression medication, thankfully I have insurance through my mother's husband who is a raging alcoholic and drug addict, but at least has a job.",['conj'],0
2141,2141,0.9999157524527472,8.424754724954529e-05,0.222,0.778,0.0,I've seen therapists regularly and have been on and off of antidepressants and anti anxiety meds.,['conj'],0
2173,2173,0.9996831459978316,0.000316854002148538,0.113,0.887,0.0,How can I afford to pay for a therapist AND a doctor's appointment AND medication?,['conj'],0
2183,2183,0.9999577652073324,4.223479268508737e-05,0.098,0.8109999999999999,0.091,"I was lucky to stock up on my antidepressant for 2 months, but my anxiety and sleeping medication will be out.",['conj'],0
2208,2208,0.9998912705391092,0.00010872946087825984,0.0,1.0,0.0,I have since been off all prescription medications for the last 7 months.,['attr'],0
2213,2213,0.9999474491777488,5.255082225841087e-05,0.358,0.535,0.107,"I already have pretty bad depersonalization due to my Anxiety and medication, and I'm worried that it will worsen greatly, becoming debilitating.",['conj'],0
2224,2224,0.9998776133135332,0.00012238668648480424,0.0,1.0,0.0,Been seeing a psychologist and psychiatrist for some time now and have seen a douzen or so different medications.,['conj'],0
2229,2229,0.9991944861984532,0.000805513801541082,0.0,1.0,0.0,"---

**Daily meds:** 170mg Venlafaxine, 180mg Propranolol, a IBS med, an acid reflux med, a contraceptive pill, a diazepam, and a (not important) multivitamin.",['ROOT'],0
2252,2252,0.9999667237224544,3.3276277544145006e-05,0.401,0.43200000000000005,0.16699999999999998,Is there special medication to overcome simple panic and/or fear?,['attr'],0
2267,2267,0.9999919269357466,8.073064239287618e-06,0.0,0.8,0.2,Has anyone experienced anything like this after increasing their medication dosage?,['compound'],0
2299,2299,0.9764449575120586,0.02355504248793841,0.177,0.823,0.0,"There's some stuff going on in my life right now with my partner that I am focusing on, to the point where I work myself into a panic, obsessively researching medication side effects and horror stories online, and such, and I can't seem to control myself.",['compound'],0
2304,2304,0.9997102887836362,0.0002897112163769153,0.168,0.755,0.077,"Before I had friends and could go out for a drink or two and a deep convo but now it's medication, sleep, ekg's, and panic.",['attr'],0
2305,2305,0.9996630050246668,0.00033699497531729846,0.145,0.855,0.0,"Every medication the was suggested, I tried for quite some time before, to no avail.",['nsubjpass'],0
2334,2334,0.9728835195472536,0.02711648045273077,0.0,0.893,0.107,"I take Cymbalta and after months of steady improvement with therapy and medication, I've tapered my dosage down to 20mg (lowest) where it will stay for a while.",['conj'],0
2349,2349,0.9998413979454716,0.00015860205453299282,0.0,0.816,0.184,She also told me that I would definitely need to give medication another try.,['dative'],0
2353,2353,0.9999605408380844,3.945916192164963e-05,0.076,0.763,0.161,"&amp;nbsp;&amp;nbsp;&amp;nbsp;&amp;nbsp;&amp;nbsp;If anyone needs to talk about anxiety or medication or ADHD or anything, really, feel free to contact me.",['conj'],0
2355,2355,0.9999726744293492,2.7325570634934294e-05,0.677,0.32299999999999995,0.0,](http://www.medicinenet.com/mitral_valve_prolapse/page2.htm) am pissed.,['meta'],0
2358,2358,0.9988558375680974,0.0011441624319098215,0.075,0.925,0.0,"Obviously I'll talk to my doc before I make a decision, I'm just wondering if anyone has experience with non-SSRI, non-benzo meds for anxiety.",['conj'],0
2364,2364,0.9997461489608456,0.00025385103914647234,0.0,1.0,0.0,"I know it's not the other medicine, because I still had the palpitations with it.",['attr'],0
2368,2368,0.9999603240944775,3.967590552098625e-05,0.0,0.815,0.185,"""People would come to me for medication management or things like that.""",['compound'],0
2379,2379,0.9999583652712636,4.1634728731623685e-05,0.107,0.777,0.11699999999999999,"Although I tend to be way over worried about job security (probably unnecessarily), I probably wouldn't have thought I'd medication.",['ccomp'],0
2402,2402,0.999934953433684,6.504656632387617e-05,0.0,1.0,0.0,"Despite therapy and meds, keep getting worse....",['conj'],0
2403,2403,0.9998394528830279,0.0001605471169618417,0.0,1.0,0.0,"I've taken so much medication that I rattle when I walk, everything from benzos, beta blockers, SSRI, SSNRI, self medication with alcohol.",['appos'],0
2404,2404,0.9998872131654368,0.00011278683454716027,0.188,0.812,0.0,"I had sought counselling in high school for depression, but I did not ever get counselling or meds for my anxiety in college.",['conj'],0
2407,2407,0.9999546614842671,4.5338515740014563e-05,0.0,0.8420000000000001,0.158,I heard that adderal is the strongest medication for ADHD so if it doesn't work for me what is gonna work?!?,['attr'],0
2408,2408,0.9996322206543208,0.0003677793456845937,0.068,0.873,0.059000000000000004,I'm well aware this could come from codependency related to my mothers severe alcoholism but with all the therapy and medication I can't seem to change.,['conj'],0
2415,2415,0.9998859366489228,0.00011406335105822539,0.128,0.7040000000000001,0.168,"Also, I'm not sure if it's the meds, but I've been constantly feeling like I'm forgetting something, or forget what I'm about to go do.",['attr'],0
2422,2422,0.9999447554145856,5.5244585419128675e-05,0.0,1.0,0.0,"Either in therapy, medication, approaches...etc?",['conj'],0
2434,2434,0.9999496870085848,5.031299139930679e-05,0.0,0.838,0.162,"Well, medication but I don't know if that ever helped.",['npadvmod'],0
2437,2437,0.998852840519222,0.0011471594807772793,0.11800000000000001,0.882,0.0,"I'm in Aus, no medications but booked in to see a counsellor on Tuesday.",['appos'],0
2446,2446,0.999979189530948,2.0810469055678e-05,0.175,0.825,0.0,"Does anyone else have anxiety and ADD, how did the ADD medication effect your anxiety or vice versa?",['compound'],0
2450,2450,0.9429849056628634,0.05701509433712253,0.0,1.0,0.0,"During the school year I attended therapy with a private professional,and was prescribed medication that I had to take at school instead of home because of my parents.",['conj'],0
2452,2452,0.9994544515321018,0.0005455484679032926,0.0,1.0,0.0,"But then the school year ended-and with it,the therapy sessions and medication intakes.",['compound'],0
2453,2453,0.999915255917568,8.474408242177068e-05,0.0,1.0,0.0,"I've tried therapy, self-help books, medications and just plain ol' doing it on my own.",['conj'],0
2456,2456,0.9999602868857472,3.971311425417713e-05,0.28600000000000003,0.7140000000000001,0.0,I had not taken Versed or any anti anxiety medicine by the way.,['conj'],0
2465,2465,0.9996603688585748,0.00033963114140794353,0.0,0.777,0.223,Any alternatives to melatonin that you may be aware of or any other medication that's known to help people ease their way through benzo withdrawal?,['conj'],0
2489,2489,0.9999658425060528,3.415749395468581e-05,0.0,1.0,0.0,"(My meds: Citalopram (Anxiety, morning), Atomoxetine (ADD, morning), Teva-Quetiapine (Anxiety, Supper). )",['dative'],0
2490,2490,0.9970926178490496,0.002907382150965226,0.0,0.8009999999999999,0.19899999999999998,"I'm trying to be positive about this and would love to make friends from here who are also starting a new medication regimen, so we can support each other through a rough time but my question right now is for the veterans.",['compound'],0
2491,2491,0.9990263577835864,0.0009736422164247172,0.17600000000000002,0.5529999999999999,0.271,"I'd like to hear everyone's personal experience with a new medication regimen, good or bad.",['compound'],0
2504,2504,0.9986488397613564,0.001351160238636058,0.26899999999999996,0.645,0.086,I get depressed at times and I have a hard time confronting her since I know it is the meds and I do not want to worry her.,['attr'],0
2506,2506,0.999993370631778,6.629368234619055e-06,0.08,0.7070000000000001,0.213,I have looked up non medicine treatments for anxiety but they aren't doing so well.,['compound'],0
2510,2510,0.999975011617428,2.498838257561904e-05,0.0,0.767,0.233,I don't know how anxiety medication Works.,['compound'],0
2513,2513,0.9999905230906976,9.476909296411084e-06,0.0,1.0,0.0,if so what meds?,['ROOT'],0
2519,2519,0.9969383150431186,0.003061684956860843,0.159,0.841,0.0,"I told her I had a medication question, she said she would transfer me to his assistant, but transferred me again to the wrong doctors voicemail.",['compound'],0
2548,2548,0.9997796473925648,0.00022035260743429058,0.0,1.0,0.0,My symptoms are under control after years of therapy and medication.,['conj'],0
2551,2551,0.991290929528904,0.008709070471108133,0.109,0.802,0.08900000000000001,"I have noticed a bit of improvement in my overall mood, but I am not sure if that is the medicine or me.",['attr'],0
2585,2585,0.9995390460302902,0.00046095396969196036,0.16899999999999998,0.7170000000000001,0.114,Ive never felt the need to seek help or meds (but I am terrified of doctors so there you go).,['conj'],0
2587,2587,0.999616966522566,0.00038303347743900464,0.0,0.804,0.196,"By the way, you can find inexpensive Phenelzine (*and other meds*) with this site: http://www.goodrx.com/

Thanks for your time, and I'd be happy to answer any questions you have.",['conj'],0
2594,2594,0.9999763238393441,2.3676160671229066e-05,0.146,0.657,0.19699999999999998,"Could medication alone help me, at least to get through college?",['ROOT'],0
2602,2602,0.9997822788655768,0.0002177211344301789,0.18899999999999997,0.7140000000000001,0.096,Klonopin and Xanax seem to be the only two medications that actually help my anxiety without the need for all the other shit.,['attr'],0
2612,2612,0.9999363383441596,6.366165584592191e-05,0.27399999999999997,0.726,0.0,"Incidentally, I was off meds for a while for some stupid reason.",['attr'],0
2614,2614,0.9997405306462284,0.0002594693537816179,0.235,0.765,0.0,I have been to see a doctor who has offered CBT and anti anxiety meds (citalopram / celexa).,['conj'],0
2617,2617,0.9995696388059212,0.0004303611940843103,0.0,1.0,0.0,"I implore anyone not to take this, or any medication in this family of drugs.",['conj'],0
2631,2631,0.9998615777293096,0.00013842227067561142,0.0,0.9129999999999999,0.087,"Up until Thursday, my nightly meds (I take 0.25mg Klonopin at 9am, 1pm, and 6pm and the rest at 6pm) would immediately calm me down.",['dep'],0
2640,2640,0.9997964386019108,0.0002035613981080743,0.0,1.0,0.0,Prescription medication sometimes gets dropped to sustain the meal budget.,['nsubjpass'],0
2654,2654,0.999866391358764,0.00013360864123817002,0.0,1.0,0.0,i've been to my doctor about this but the only thing she has to offer me is a medication that i have a long history with.,['attr'],0
2656,2656,0.8598371924265164,0.1401628075734896,0.092,0.8320000000000001,0.076,"At my previous university, I found that the Effexor-XR 150 for trait and Xanax 50 mg for state anxiety resulted in a relatively stable mode of living, but have recently started a graduate program at a different university where the clinicians are more negatively biased toward medication-based solutions.",['npadvmod'],0
2663,2663,0.9997208362492568,0.0002791637507280582,0.147,0.662,0.191,It wasn't until I got my anxiety under control with therapy and medication (of which I'm now off) that I lost that happy feeling.,['conj'],0
2664,2664,0.9998377848948534,0.0001622151051644569,0.0,1.0,0.0,I maintained the same dose and medications as previously mentioned.,['conj'],0
2668,2668,0.9997535683391544,0.0002464316608611332,0.21600000000000003,0.6759999999999999,0.10800000000000001,I can only pin it down to the alcohol in me affecting my medication's function and therefore the panic attack came on full strength.,['poss'],0
2677,2677,0.9998699228176684,0.00013007718233190018,0.23800000000000002,0.713,0.049,"**TL;DR: How the HELL did you get through your medication withdrawal symptoms, and how long did it take?",['compound'],0
2694,2694,0.9994604260201468,0.0005395739798394984,0.0,0.816,0.184,"I can't find a psychiatrist that takes my insurance, so I can't get meds to help.",['acomp'],0
2697,2697,0.9994031751555384,0.0005968248444660372,0.242,0.685,0.073,I've had a panic disorder for 8 years now and have been through therapy and meds and being housebound and being fine.,['conj'],0
2704,2704,0.999961839376961,3.816062305699297e-05,0.39799999999999996,0.364,0.23800000000000002,I really feel like shit and hate myself for not seeking help or effective medicines.,['conj'],0
2705,2705,0.9991588721811182,0.0008411278188933863,0.0,1.0,0.0,"It has helped somewhat, but I'm starting to think I either need a higher dose or a different medicine.",['conj'],0
2717,2717,0.9999312074279504,6.879257203837035e-05,0.174,0.6829999999999999,0.14300000000000002,"TL/DR: VS after head injury, please advice of experience, deterioration, medicine, cures, etc.",['conj'],0
2718,2718,0.9999248726459646,7.512735404945149e-05,0.0,0.8540000000000001,0.146,"My question is whether there is treatment, is there anything I can do to improve, does it deteriorate, medication?",['conj'],0
2722,2722,0.9991583212999852,0.0008416787000311795,0.044000000000000004,0.853,0.10300000000000001,"I had a doctors appointment this week just for a medication checkup and everything was fine, my Adderall XR (20mg twice a day, since it only lasts 6 hours each) is helping with my anxiety and ADHD without any side effects.",['compound'],0
2734,2734,0.9986875572468172,0.0013124427531746462,0.044000000000000004,0.688,0.26899999999999996,"I don't have insurance or a primary care physician, so it makes it hard to try and get consistent help and daily medication that will help besides Xanax.",['conj'],0
2738,2738,0.9999939278536564,6.0721463360559374e-06,0.155,0.845,0.0,"Is there anything I can do behaviorally (that is, no medicine) to change this?",['attr'],0
2743,2743,0.999540211399528,0.0004597886004654113,0.16,0.797,0.043,My doctor gave me anxiety meds(avitan) that I haven't taken in two days because I don't want to destroy my liver and i don't want to be dependent of any substance but it's getting hard to not use it when the anxiety is getting overwhelming.,['meta'],0
2744,2744,0.9999669964206068,3.300357940562821e-05,0.688,0.312,0.0,No medication.,['ROOT'],0
2749,2749,0.9998560410933937,0.00014395890661843486,0.221,0.779,0.0,"I'm on antidepressants, anxiety meds, the works.",['conj'],0
2764,2764,0.99999049964749,9.50035250938386e-06,0.0,0.748,0.252,"I would really like to try out an adhd medicine or something at least then I could see if it would help, or is there medicine that helps both?",['attr'],0
2773,2773,0.999965889366294,3.4110633692481976e-05,0.2,0.588,0.212,Chances are I will be prescribes anxiety meds.,['attr'],0
2774,2774,0.9995479114935704,0.0004520885064310591,0.14400000000000002,0.642,0.214,MY MAIN CONCERN IS...if I get prescribed anxiety meds...what are the chances of me gaining weight...I've gained about 15-20 lbs this year because of the emotional turmoil I've been dealing with....and now lack of motivation to lose it at the moment ..has caused me to be thicker than i'd like to be...,['ccomp'],0
2777,2777,0.9998692582089241,0.00013074179107103707,0.155,0.845,0.0,"Before I knew I was behind, I failed to submit work at university, I was being ushered towards counselling and was suggested medication.",['oprd'],0
2778,2778,0.9998902381442528,0.00010976185576291761,0.0,1.0,0.0,(The orgasm being an effect not listed on the medication list).,['compound'],0
2781,2781,0.99983431449118,0.000165685508819076,0.113,0.747,0.14,"The medication is not known for helping with sexual issues, though it is certainly responsible for my delayed ejaculations (given premature ejaculations are what they are also prescribed for)....",['nsubjpass'],0
2815,2815,0.9990774859720564,0.0009225140279320367,0.297,0.595,0.10800000000000001,I will also be having to get a medicine change as the zoloft was no good and made my problem much worse.,['compound'],0
2832,2832,0.9998458748908206,0.00015412510916221116,0.315,0.685,0.0,"I guess the point of this is that I'm so sick and tired of dealing with this with SSRIs, SNRI's, and other anti-depressants and bunk bullshit anxiety medications (I'm looking at you Buspar).",['conj'],0
2838,2838,0.9986500286347798,0.0013499713652385227,0.226,0.598,0.175,Meanwhile I lost a lot of hair and gained weight and was just generally feeling hopeless about my medication situation.,['compound'],0
2840,2840,0.9998788331513871,0.00012116684862870383,0.156,0.8440000000000001,0.0,"He is prescribed heart medications combined with Ativan and Zofran to combat his ""episodes.""",['attr'],0
2851,2851,0.996566962995014,0.003433037004967917,0.163,0.8370000000000001,0.0,"And as a result of all of this - being sick, new meds, etc, I haven't been eating or drinking much.",['conj'],0
2853,2853,0.9999881768744076,1.182312558780707e-05,0.0,1.0,0.0,Does anyone have any experience with lorazepam or similar meds?,['conj'],0
2855,2855,0.999948031763615,5.196823636502644e-05,0.0,1.0,0.0,I am new to the whole medicine thing.,['compound'],0
2864,2864,0.9999031403873779,9.685961261731175e-05,0.252,0.748,0.0,"Hi, I'm not sure if this is the place for this, but my fiance has just started therapy and medication for Generalized Anxiety Disorder.",['conj'],0
2874,2874,0.9996452966011362,0.0003547033988766607,0.0,0.747,0.253,I had a meds change (I am now on Zoloft) and so far so good.,['compound'],0
2882,2882,0.9999863100482964,1.3689951703431329e-05,0.523,0.47700000000000004,0.0,"Also, are anxiety medications really that bad?",['attr'],0
2884,2884,0.9999749803285332,2.501967145410546e-05,0.0,1.0,0.0,"My second visit to this ""counselor"" and she gives me pamphlets on this pseudo-medicine garbage.",['compound'],0
2886,2886,0.9995750519871959,0.000424948012794064,0.0,1.0,0.0,(Also there was a medicine change in there from Zoloft to Effexor.,['compound'],0
2889,2889,0.9995152697811984,0.00048473021881829286,0.13699999999999998,0.7959999999999999,0.067,"I have been struggling with GAD for most my life now and it's gotten better with therapy and medications but sometimes I get almost ""flair ups"" of anxiety.",['conj'],0
2896,2896,0.7831974548582699,0.2168025451417392,0.031,0.87,0.1,"I've recently been dealing with a lot of anxiety, and while there are many different ways of dealing with it, medication, meditation, therapy, or the million other things you can do, I have found a really easy way to take about 1% of the edge off, and I'm sure a lot of people do it.",['conj'],0
2918,2918,0.9999502861383271,4.97138616881325e-05,0.134,0.866,0.0,Pot is literally my only medication/remedy when it comes to my anxiety.,['attr'],0
2923,2923,0.9997703712880884,0.00022962871191522133,0.242,0.669,0.08900000000000001,"I know that the common advice for anxiety is therapy and medication, but I'm far too anxious for the former and strongly dislike the latter.",['conj'],0
2924,2924,0.9999327332756578,6.726672436025898e-05,0.452,0.5479999999999999,0.0,Usually just opiate pain medication.,['ROOT'],0
2929,2929,0.9999069359517448,9.306404823699521e-05,0.047,0.953,0.0,I talked with my therapist and she said if I don't want to go down the medication route I'd have to have long term therapy which I don't mind.,['compound'],0
2938,2938,0.9945216428682304,0.005478357131766799,0.115,0.8220000000000001,0.063,"first it was like faraway street lights seeming fuzzy and blurry and today just my sight seems off, i feel like i just wanna close my eyes could be eye strain from being on the pc for a while (online class) and reading in a dark room + meds but im getting scared its a a degenerative disease!",['dep'],0
2943,2943,0.9981834952971164,0.001816504702883248,0.153,0.754,0.09300000000000001,"I wake up feeling instantly alert when I'm sleeping on a sofa, probably because I never get any good quality deep sleep, and I hate how long it takes me to wake up when I sleep properly (thanks meds).",['parataxis'],0
2968,2968,0.9999461597337276,5.384026627321682e-05,0.0,0.787,0.213,Is it worth seeking councelling or new meds?,['conj'],0
2976,2976,0.9950990409003124,0.004900959099672245,0.19699999999999998,0.8029999999999999,0.0,"I never took the step to take antidepressants or anxiety medication, as I was fearful to even approach a doctor and talk about the subject.",['conj'],0
2984,2984,0.9999791330337806,2.0866966216561302e-05,0.171,0.8290000000000001,0.0,ive tried therapy and meds and im gonna try em again except my dads not really giving me much time to fix my problems at all.,['conj'],0
2988,2988,0.9997325059634984,0.0002674940364897861,0.039,0.723,0.23800000000000002,"After starting Zoloft I do feel like I'm more at ease and I don't take shit so seriously, but I can't really discern if it's the medication or placebo, since the change in my mood was pretty subtle.",['attr'],0
3001,3001,0.9935056797494016,0.006494320250589818,0.0,0.8220000000000001,0.17800000000000002,so I'm also aware of the benefits of a combo of therapy and medication.,['conj'],0
3005,3005,0.9998143395378096,0.00018566046218503605,0.0,1.0,0.0,I don't know if I should try to get medication/therapy if in a couple months I won't even be living here anymore.,['acomp'],0
3018,3018,0.9999297209867244,7.02790132565454e-05,0.067,0.8859999999999999,0.047,"Even after the CT scan that time, they sent me to get an echo for my organs (pancreas, liver, gall bladder and so on), he said, all good (well, except my liver because I am fat but no medication required).",['conj'],0
3036,3036,0.9999749482110208,2.5051788961791305e-05,0.242,0.705,0.052000000000000005,"It was starting to help, but my mother made me feel so horrible for taking any medication (she doesn't believe medication works or that I even have anxiety/depression), I stopped.",['compound'],0
3037,3037,0.9982815463039664,0.0017184536960328386,0.175,0.825,0.0,I have a couple of questions regarding general anxiety and meds.,['conj'],0
3045,3045,0.9999241096761472,7.5890323870138e-05,0.151,0.7140000000000001,0.136,"I'm managing it okay though, and don't feel ""stuck"" like I did pre-medication.",['advcl'],0
