,Unnamed: 0,neg_prob,pos_prob,neg_vader,neu_vader,pos_vader,sentence,dict,identifier
11,11,0.9998689890211864,0.00013101097883202507,0.052000000000000005,0.862,0.086,This last time she asked I explained that I was getting my anxiety medicine adjusted a few days before she needed me to watch them and maybe it would be easier for me.,nsubj,1
15,15,0.9999536393761326,4.636062385080013e-05,0.322,0.6779999999999999,0.0,"The medications I've tried are

Fluoxetine: Horrible nausea: lasted all day and interrupted work.",nsubj,1
17,17,0.999771862300802,0.00022813769918550718,0.0,0.737,0.263,"Mentally, this medication made me feel like a zombie.",nsubj,1
58,58,0.9977055294513126,0.00229447054867655,0.188,0.812,0.0,"The counselor helped a little bit, and I'm not entirely sure if the medication helped at all because I still felt anxious.",nsubj,1
62,62,0.999912739487101,8.726051288769172e-05,0.29100000000000004,0.5820000000000001,0.127,im excited to see how the meds are gonna kick ass over my anxiety!,nsubjpass,1
78,78,0.9983784420173092,0.0016215579826954374,0.0,1.0,0.0,"Things were really looking up for a while, since the medication was prescribed.",nsubjpass,1
91,91,0.9999297801304636,7.021986953124292e-05,0.128,0.872,0.0,"I suppose my medication is for laziness too, and the cuts on my arms are just coincidental.",nsubj,1
92,92,0.9999862139484084,1.378605158733248e-05,0.0,1.0,0.0,What anti-anxiety meds have worked for you that don't cause vertigo or nausea?,nsubj,1
96,96,0.9998431909132516,0.00015680908674705726,0.153,0.847,0.0,I'm really starting to feel scared about what my meds are doing to me in the long-term.,nsubj,1
99,99,0.9998073536872704,0.0001926463127373692,0.08,0.7609999999999999,0.159,I have no idea how these medications work or if it's worth starting up during a transition period like the new few weeks when I start classes.,nsubj,1
114,114,0.9987010296237252,0.001298970376287182,0.087,0.9129999999999999,0.0,The thought of not being able to get my meds is making me really anxious and last time this happened I ended up in the hospital.,nsubj,1
115,115,0.999831164962844,0.00016883503714213045,0.0,1.0,0.0,TL;DR My discount for my meds is ending soon but I need the meds to function.,nsubj,1
120,120,0.9988994893407596,0.0011005106592458086,0.139,0.861,0.0,"The meds didn't help that time, I just walked into walls a lot and felt wobbly woozy.",nsubj,1
121,121,0.9997612236114954,0.00023877638848588607,0.0,1.0,0.0,The only meds she is on now is Buspirone 30mg and Ativan 0.5 mg three times a day.,nsubj,1
122,122,0.9999558003537384,4.4199646252523e-05,0.0,1.0,0.0,Are these meds making her nauseas or is it her “nerves”?,nsubj,1
126,126,0.9861888346546884,0.01381116534532604,0.0,0.898,0.102,I know it takes a few weeks for meds to take effect so I don't know if it's because of the Prozac that I feel like this.,nsubj,1
136,136,0.99841246003935,0.0015875399606579967,0.284,0.5670000000000001,0.149,"I think this has helped me realise that the medication I'm on, while dulling the anxiety and depression, also dulls the good feelings sometimes as well.",nsubj,1
155,155,0.9999906577234148,9.342276582286363e-06,0.0,0.8390000000000001,0.161,"If I do, I'm just curious what medications worked for you guys, if any?",nsubj,1
164,164,0.9957155735567276,0.004284426443283545,0.0,1.0,0.0,"The broad goal of my research is to examine the different classes of anti-depressant medications in relation to side effects, specifically addressing the severity level, type and tolerability of side effects in relation to medication BNF classification (the pharmacological body which classifies antidepressants into categories depending on the primary proposed mechanism for how the medication works).",pobj_nsubj,1
167,167,0.9995436247174271,0.00045637528258601965,0.39899999999999997,0.507,0.094,"Although my medication has worked great for the past months i have been on it, i can feel the anxiety building and im worried ill suffer another large attack, im terrified.",nsubj,1
181,181,0.999554218206353,0.0004457817936296486,0.111,0.889,0.0,"(in which I think being bored is another trigger and with drinking coffee making me hyper and not knowing what to do with myself)

Also I did get my meds changed from citalopram to the generic of zoloft because of the attacks last week.",nsubj,1
192,192,0.9970844394681856,0.002915560531802418,0.0,0.797,0.203,"The opinion of the professional was that meds could help, but doing as much natural remedies as I could before turning to them.",nsubj,1
198,198,0.9998851569796746,0.00011484302032485191,0.0,1.0,0.0,I guess Im going to try to get some meds prescribed for the first time just for this interaction that lasts moments every day I work.,nsubj,1
203,203,0.9971777177467426,0.0028222822532408195,0.09699999999999999,0.7290000000000001,0.174,"I feel like some of you go on about how it's the *only* option, but meds are a big no for me, and others like me.",nsubj,1
206,206,0.9871662519939846,0.012833748006010677,0.122,0.6809999999999999,0.19699999999999998,It's a very sad way to live life and I am hoping the meds and meditation will help snap me out of this a bit.,nsubj,1
209,209,0.9998090760885984,0.0001909239114143185,0.122,0.878,0.0,I'm really worried I'll get to the airport and board the plane and realise that the medication isn't working.,nsubj,1
238,238,0.9999593480763412,4.065192363994237e-05,0.162,0.7509999999999999,0.087,"So far, my medications and effects have been:

Citalopram - Intensified the yucky mental feeling (anxiety?)",nsubj,1
247,247,0.999818172902126,0.0001818270978795255,0.0,0.794,0.20600000000000002,Wondering if anyone has had any luck with meds helping these kind of things OR anything that I should probably stay away from.,nsubj,1
251,251,0.9995820402088832,0.00041795979109766863,0.0,0.9129999999999999,0.087,"And if medication is not the right answer for me, that's okay, I'll try something else if it comes to that.",nsubj,1
252,252,0.9434738109485308,0.056526189051472005,0.0,1.0,0.0,"My psychiatrist suggested I do this test that involves swabbing the inside of my cheek with a cotton swab and sending it to a lab where they run your genetics against the common gene that the meds are composed of (all are in a different ""class"") and it tells you that based on the make up of your body and the class of the drugs, which class of drug your body metabolizes normally.",nsubj,1
254,254,0.9999903197414812,9.680258529263668e-06,0.14400000000000002,0.7490000000000001,0.107,"I trust my doctor, but I can't help wondering if my different medications are reacting poorly with one another.",nsubj,1
262,262,0.9999349461743516,6.505382562905204e-05,0.11900000000000001,0.593,0.28800000000000003,"I need to have my medication adjusted *right now,* but it seems like no one can help me.",nsubj,1
266,266,0.9999601781946144,3.9821805377626396e-05,0.132,0.868,0.0,"I need to learn to start controlling them because my attacks are situational, and meds aren't really necessary at this point.",nsubj,1
284,284,0.9976658085345336,0.002334191465456971,0.0,1.0,0.0,I thought it would of came back as the meds kicked in but still nothing.,nsubj,1
285,285,0.9998887690596504,0.00011123094036016641,0.098,0.727,0.175,"this might be a dumb question, but is there a definitive moment when i can truly know the meds are working ?",nsubj,1
301,301,0.991286761662252,0.008713238337730344,0.0,1.0,0.0,Will it take a little time for the medicine to get out of my system before I feel normal all the time again?,nsubj,1
317,317,0.998734993368294,0.0012650066317120518,0.0,1.0,0.0,"Due to a mix up at the clinic pharmacy, my medication wasn't filled and now i'm out.",nsubjpass,1
341,341,0.9998389403368472,0.00016105966315387382,0.127,0.653,0.22,"I realize all meds are ""your mileage may vary"" but it's still nice to hear from people who have had success on theirs since often you read horror stories online.",nsubj,1
363,363,0.9999417015991672,5.8298400850297464e-05,0.308,0.594,0.098,However the meds she likes to give me when I go through periods of extreme anxiety or depression just make me stupid.,nsubj,1
374,374,0.9995704047763392,0.00042959522366395184,0.084,0.9159999999999999,0.0,All the meds I'm taking mimic some of the side effects of pregnancy and I'm sufficiently freaked every time one of them makes an appearance.,nsubj,1
378,378,0.9999862427463728,1.3757253635567209e-05,0.0,1.0,0.0,What if medication doesn't work?,nsubj,1
382,382,0.9999856759132936,1.4324086724707196e-05,0.0,1.0,0.0,"So guys, I was wondering what medicines are prescribed and how dependent you are on them?",nsubjpass,1
390,390,0.9986057553010064,0.0013942446990055052,0.233,0.767,0.0,"It's been a while since I've had an attack (I don't take meds/I haven't discussed it with my family, so that's dumb on my part).",nsubj,1
395,395,0.9999143473197686,8.565268021703168e-05,0.0,0.856,0.14400000000000002,"TL;DR Currently on Wellbutrin for GAD, what are your experiences/opinions; what other medicines (preferably non-ssri/srni) may help?",nsubj,1
401,401,0.9993713170520264,0.0006286829479817942,0.0,0.833,0.16699999999999998,The medication is allowing me to get to a point where I have the resources to care for myself.,nsubj,1
402,402,0.9910245932210571,0.008975406778939996,0.12,0.88,0.0,"For me medication will not be the answer, but it provides a door to a long tunnel to the other side of this mess if I'm willing to do the work.",nsubj,1
411,411,0.9992082022273784,0.0007917977726256831,0.366,0.593,0.040999999999999995,"* - I used to eat very healthy and do a lot of cardio, but since my sleep meds has lowered my blood pressure I can't do cardio without fainting D: and I have been eating very bad unhealthy stuff lately.",nsubj,1
413,413,0.9999178487666374,8.215123335664616e-05,0.195,0.805,0.0,Could the meds and/or anxiety be causing it?,nsubj,1
420,420,0.9993477587110916,0.0006522412889264218,0.0,0.862,0.138,"The medication is helping, but full-effect is still a little while away.",nsubj,1
426,426,0.998231792109544,0.0017682078904618739,0.0,0.758,0.242,I know medication isn't going to be a miracle cure but I'd like to know how long it normally takes to kick in to see how well it's working for me.,nsubj,1
476,476,0.999994057657813,5.942342191062606e-06,0.109,0.705,0.18600000000000003,I am wondering if anxiety medication could be useful for when I have these episodes.,nsubj,1
477,477,0.999978800462134,2.1199537884932187e-05,0.20600000000000002,0.6729999999999999,0.121,"Technically, if I asked him ""I think I have anxiety attacks and I think anti-anxiety meds would help"" that is drug-seeking.",nsubj,1
492,492,0.999996347847952,3.652152032845722e-06,0.0,0.634,0.366,Thank you if you guys know any medicine can help me.,nsubj,1
495,495,0.9999488719364552,5.1128063547066354e-05,0.05,0.877,0.073,"Anxiety medication is the last resort (again), and I'm kind of hoping they end up putting me on some type of mild sedative, so I can at least do some type of work.",nsubj,1
497,497,0.9997866331350356,0.00021336686497421705,0.19399999999999998,0.8059999999999999,0.0,"I've quickly realized I wasn't any better, the medication just suppressed it...",nsubj,1
507,507,0.9999877307962186,1.2269203765870825e-05,0.111,0.606,0.28300000000000003,What else is there to do if no medications are able to help me improve.,nsubj,1
508,508,0.9999284042968438,7.159570315579002e-05,0.348,0.652,0.0,The only medications I've tried seemed to kill my emotions EXCEPT for the anxiety.,nsubj,1
511,511,0.9974083952626952,0.0025916047373048235,0.218,0.698,0.084,"The medication still works, but only at high doses (3-4 mg) my psychiatrist doesn't like the idea of giving it to me on an as needed basis because of its long half life, and while I understand the point he makes, it's also hard to accept because it was the only thing that helped me through my darkest moments and panic attacks.",nsubj,1
521,521,0.9974738912633829,0.002526108736599148,0.0,1.0,0.0,A lot of side effects wore off as the weeks went by and the medication worked it's magic.,nsubj,1
522,522,0.997511690395442,0.002488309604567119,0.0,0.787,0.213,"For about a week and a half, after the meds had time to set itself, I felt amazing.",nsubj,1
548,548,0.999853646141922,0.0001463538580765307,0.09300000000000001,0.8220000000000001,0.085,I had really slipped when things started to get pretty bad and then took a year off... came back this year and finally was diagnosed and on the way to get my meds sorted out.,nsubj,1
566,566,0.9868741294695682,0.013125870530427016,0.09,0.91,0.0,"I've studied psychology (just graduated with a degree in it, actually) and I know anxiety can be the same thing as diabetes; both can be manageable with no medication, but sometimes meds are necessary.",pobj_nsubj,1
567,567,0.9999602118832508,3.978811675547416e-05,0.23,0.575,0.195,I'm terrified that any medication I go on will make me gain weight.,nsubj,1
568,568,0.9995371028128506,0.00046289718713644494,0.0,0.9209999999999999,0.079,"After trying to cope with meditation and other methods, I feel as though I would benefit from seeing a psychiatrist and receiving some short lasting medication, and was wondering how medicine has helped anyone in a similar situation to me.",dobj_nsubj,1
569,569,0.9998406449509049,0.00015935504910144884,0.125,0.8240000000000001,0.051,I know the dangers of becoming addicted to benzos etc...I just want to know how medicine has or has not helped any of you.,nsubj,1
575,575,0.9987252315595971,0.001274768440390343,0.051,0.856,0.09300000000000001,"Since I did that, I went about 3 days where the meds weren't seeming as effective, but that has seemed typical that every two weeks around the same time I'd have a few days like that.",nsubj,1
593,593,0.9995598171253158,0.00044018287468373214,0.10300000000000001,0.897,0.0,"I'm not sure if the meds are speeding things along, or if I'm just THAT out of shape.",nsubj,1
596,596,0.9999635272419742,3.6472758012892986e-05,0.0,1.0,0.0,Should I try to back off the Xanax and talk to my doctor about getting my OCD medication upped?,nsubj,1
603,603,0.9999401839733214,5.981602669347524e-05,0.12,0.6509999999999999,0.22899999999999998,"They prescribed me synthroid, and it put my mind at ease, knowing that finally, these meds will help this awful feeling go away.",nsubj,1
610,610,0.9998521510832584,0.00014784891673662608,0.0,1.0,0.0,The two medications of choice are Lexapro or Celexa.,nsubj,1
611,611,0.9920346869621944,0.007965313037806928,0.125,0.875,0.0,"Now, I knew people who go on medication for anxiety+derealization/depersonalization+depression but I feel that I hear so much about those medications leaving the taker unfulfilled, with a void in their life.",pobj_nsubj,1
614,614,0.9992290419283658,0.0007709580716438463,0.0,1.0,0.0,Or is it just a fact that meds can only do so much when my head is full of screwed-up thinking that can't even be changed by understanding logic?,nsubj,1
615,615,0.9997886465595668,0.0002113534404191757,0.0,1.0,0.0,I should also mention that I can't see my psych until June 8th and that the meds she suggested I adjust over the phone haven't been working.,nsubj,1
622,622,0.9999903486490184,9.651350994096638e-06,0.0,1.0,0.0,"(Maybe I'm making up symptoms, what if medicine changes me, etc.)",nsubj,1
627,627,0.9970871613423272,0.002912838657677553,0.253,0.691,0.055,"The doctors determined that the diuretics had taken a toll on her kidneys and she could no longer be ""aggressively treated"" for her water retention problem, and the hallucinations were due to her medication poisoning her.",nsubj,1
650,650,0.9998595739718322,0.00014042602815382663,0.0,0.675,0.325,"Please, someone tell me that the meds don't make you numb.",nsubj,1
663,663,0.9999602036350492,3.9796364963389645e-05,0.162,0.58,0.258,"All but one of my friends just say ""be mentally stronger"" or tell me how bad medication is for me.",nsubj,1
668,668,0.999942528276808,5.747172320754089e-05,0.0,1.0,0.0,I'm thinking now medication might be the next step.,nsubj,1
682,682,0.9997611770926,0.00023882290740849635,0.0,1.0,0.0,The first time I sat down to meditate after the medication started to kick in I was amazed…at how *freaking easy* meditation is now.,nsubj,1
696,696,0.9973935091205473,0.0026064908794707466,0.161,0.8390000000000001,0.0,"Anyway, I know the medication isn't fully in my system yet, I just worry about my anxiety being at an all time high since I've started taking it.",nsubjpass,1
700,700,0.999837311680902,0.00016268831910133522,0.0,1.0,0.0,I was being prescribed a benzodiazepine by a doctor at this clinic but this medication has been blacklisted from being prescribed.,nsubjpass,1
707,707,0.9970892303038656,0.002910769696149675,0.0,0.87,0.13,I've been seeing a councilor and we've both agreed that medication was the next logical step.,nsubj,1
709,709,0.9999503976329559,4.960236704586e-05,0.473,0.489,0.038,"The meds didn't work, well they did help with the anxiety, but so far the SSRIs I've been on all make me horribly depressed ... but hey they stop the panic attacks!",nsubj,1
714,714,0.999824349546396,0.00017565045361879158,0.0,1.0,0.0,now its the 3d month and I don't feel that the meds are working.,nsubj,1
730,730,0.9910468974340872,0.008953102565917902,0.046,0.8959999999999999,0.057999999999999996,"Pregame: Honestly, I probably should have taken small bottles of liquor with me to take the edge of since meds are no longer a thing for me, but instead I pregamed with my crochet (like knitting).",nsubj,1
738,738,0.9902847078785412,0.009715292121475531,0.129,0.871,0.0,"I believe I'm psychologically addicted to it because once I start experiencing this sheer panic of having a seizure from stopping the medicine, it subsides a second after taking my dose, and I know the medicine doesn't work that fast.",nsubj,1
745,745,0.9978099453936912,0.0021900546062924675,0.05,0.88,0.07,"Two months into the school year and I had begun to form very unhealthy eating habits (skipping meals and binging later, restricting), but my Mom thought that the medication was really helping me, when I was really the acting classes I took after school twice a week.",nsubj,1
770,770,0.9957255429295756,0.004274457070428324,0.075,0.925,0.0,When I first saw a doctor for anxiety I was prescribed Celexa (20mg) and given clonazepam to take as needed until the meds kicked in.,nsubj,1
773,773,0.9999123730192864,8.762698072185783e-05,0.272,0.728,0.0,TL; DR- The medications I've been prescribed thus far have been limited in effectiveness but have crappy side effects.,nsubjpass,1
802,802,0.9999903367664654,9.663233552352915e-06,0.258,0.457,0.285,I feel like medicine doesn't help me.,nsubj,1
805,805,0.9998405631222659,0.00015943687773629033,0.303,0.633,0.063,"My ADD medications were not helping me focus anymore, they only helped combat the tired feeling in my head.",nsubj,1
818,818,0.9995417708046188,0.00045822919539498377,0.21899999999999997,0.7809999999999999,0.0,My medication runs out in almost a week.. and I'm freaking out.,nsubj,1
822,822,0.9999634902924124,3.6509707604891604e-05,0.059000000000000004,0.711,0.23,"He didn't prescribe me medication but encouraged me try some tricks to help with my anxieties.If I get prescribed, what medications work for you guys?",dobj_nsubj,1
823,823,0.9994675691194224,0.0005324308805665783,0.0,0.816,0.184,"i currently don't have health insurance so meds/therapy are out of the picture, and i would much rather use techniques and natural methods to help my situation.",nsubj,1
837,837,0.99916161914834,0.000838380851661875,0.32799999999999996,0.672,0.0,"Benzodiazepines as Treatment for Generalized Anxiety Disorder

Benzodiazepine medications are commonly prescribed in Northport as part of treatment for generalized anxiety disorder.",nsubjpass,1
847,847,0.9998470582776274,0.00015294172238388822,0.265,0.735,0.0,I've only seen life full of anxiety and I guess maybe I had REALLY bad anxiety and now the medication is making me normal and who I am.,nsubj,1
848,848,0.9997703796065748,0.00022962039344431303,0.0,0.5379999999999999,0.462,Is my medication just kicking in and is this a great success story?,nsubj,1
850,850,0.9995911785989516,0.0004088214010585748,0.0,1.0,0.0,"The medication is working, but it's a short term effect..",nsubj,1
868,868,0.9998367085444024,0.000163291455595017,0.145,0.652,0.204,I know never to mix the two but with my problem I want this medication to help as soon as possible,nsubj,1
870,870,0.9997374137164088,0.00026258628360674294,0.0,0.565,0.435,"Anyways, medication sounds like it could be a good idea.",nsubj,1
873,873,0.999381306753102,0.0006186932468901277,0.0,0.5539999999999999,0.446,"Obviously medication isn't for everyone, but it definitely saved my life.",nsubj,1
881,881,0.9999013728444028,9.862715559828248e-05,0.24600000000000002,0.754,0.0,"I started having chain panic attacks shortly after my first dose, and they lasted for hours until the medicine finally wore off.",nsubj,1
882,882,0.9997004946469992,0.0002995053530042792,0.0,1.0,0.0,"It didn't take me too long to catch on that the meds must have caused it, so I looked up the ingredients.",nsubj,1
886,886,0.9999486392098528,5.136079014631504e-05,0.0,1.0,0.0,The people at the place I go to have told my mom that medicine is an option that can be discussed later.,nsubj,1
887,887,0.999993024571493,6.975428488573723e-06,0.0,0.526,0.474,Can medicine help me?,nsubj,1
892,892,0.9999637056170656,3.6294382939549227e-05,0.0,0.353,0.647,I hope the medicine helps soon.,nsubj,1
928,928,0.9997746600318076,0.00022533996818529972,0.10800000000000001,0.892,0.0,Back then the medications for anxiety were in their infancy and not covered by insurance.,nsubj,1
931,931,0.9998951335758124,0.00010486642418557228,0.0,1.0,0.0,"Remembering to get Pollux's medications refilled on time, not to mention getting him to not vomit up said medications.",nsubj,1
951,951,0.993905701465845,0.006094298534160927,0.128,0.833,0.04,"everyday from there out till today id wake up and have crappy thoughts and feel crap, feel sick in the stomach and vomit and go to the toilet all the time ""Number 2"" on Saturday and Sunday i would fell amazing and normal so i always looked forward to it, however i did not seek help because i thought what i experienced everyday was normal as it runs in my family and my dad and his dad has it, other symptoms i get is freezing feet, always tired, horrible memory, horrible concentration, and always think something bad iss going to happen eg, house burn down :Z.

anyhow i am now 19 and seeing a therapist and started taking Paroxatine 14 days ago i have yet to see any improvement but i know medication takes time 6 weeks at least.",nsubj,1
952,952,0.9988603214621552,0.001139678537861808,0.038,0.899,0.063,"i have come to terms that my anxiety will not go away i am just hoping that the medication at least aids in the severity of it, and the therapy gives me techniques on how to deal with it which therapy is all about.",nsubj,1
958,958,0.9999105116618779,8.948833811074629e-05,0.0,0.7040000000000001,0.29600000000000004,I'm wondering if medication could be the best option for now.,nsubj,1
964,964,0.9999887120798304,1.128792016605763e-05,0.0,1.0,0.0,Should I get my meds adjusted or changed?,nsubj,1
970,970,0.9999799527428664,2.004725714628669e-05,0.0,0.526,0.474,Did medication help you?,nsubj,1
984,984,0.9999870616977474,1.2938302262348448e-05,0.09699999999999999,0.759,0.14400000000000002,"Experiencing new weird stuff, almost like paranoïa, and figure I should write this stuff to wait for my meds to kick in rather then building up more anxiety by letting my brain go free.",nsubj,1
990,990,0.9957548167491036,0.004245183250902647,0.127,0.873,0.0,"Gotta get through the first couple weeks, today is day one and the medicine is sort of making me a bit tired.",nsubj,1
999,999,0.9954780459506776,0.00452195404931189,0.048,0.9059999999999999,0.046,I make good money but not quite enough to pay for health insurance separate from my own (Of which she isn't covered) so taking her to a doctor and getting her some medication seems to be out of the realm of possibility.,nsubj,1
1005,1005,0.9997297032683704,0.0002702967316426789,0.0,0.83,0.17,It's been a while since I've posted (or needed to) because my meds have been absolutely amazing (aside from some memory loss).,nsubj,1
1013,1013,0.9999340506203642,6.594937964684376e-05,0.0,1.0,0.0,What medications would not have the most side effects?,nsubj,1
1025,1025,0.999992469865568,7.530134423238442e-06,0.261,0.7390000000000001,0.0,"That had never happened to me before, so now my only reliable medicine is either not working or making shit worse.",nsubj,1
1034,1034,0.9993794026344609,0.0006205973655258425,0.127,0.774,0.099,"The first session with him wasn't bad but he revealed to me that he is against treating anxiety with medication (while, admittedly, meds were what I was hoping for) and insisted that if we went through some of the more troubling memories from my childhood, it would fix everything.",pobj_nsubj,1
1036,1036,0.9997872903849828,0.00021270961501600958,0.245,0.755,0.0,"New meds, more therapy, move back home with parents because I can't be trusted to be alone.",nsubj,1
1040,1040,0.9999546310058176,4.53689941659852e-05,0.27399999999999997,0.726,0.0,"Note: When my anxiety medication wears off, I now GET anxiety immediately.",nsubj,1
1046,1046,0.9999321874925102,6.78125074821459e-05,0.38299999999999995,0.617,0.0,This medication has ruined my life.,nsubj,1
1075,1075,0.999033471476894,0.0009665285231000136,0.332,0.637,0.031,"I know that the meds and the therapy have helped me in these weeks, and helped me realize that I have had this problem for a long time, but I just want to say ""fuck you anxiety, seriously, fuck you.",nsubj,1
1086,1086,0.9999757540762793,2.4245923730600273e-05,0.0,1.0,0.0,"Is medication needed, or even an option?",nsubj,1
